#,ama,title,journal,year,volume,issue,pages,doi,pmid,authors
1,"Westaby S, Shepherd MP. Palliation of intrathoracic tracheal compression with a silastic tracheobronchial stent. Thorax. 1983;38.",Palliation of intrathoracic tracheal compression with a silastic tracheobronchial stent,Thorax,1983,38,,,,,Westaby S; Shepherd MP
2,Dumon JF. A dedicated tracheobronchial stent. Chest. 1990;97.,A dedicated tracheobronchial stent,Chest,1990,97,,,,,Dumon JF
3,"Mahler DA, Weinberg DH, Wells CK. The measurement of dyspnea: contents, interobserver agreement and physiologic correlates to two new clinical indexes. Chest. 1984;85.","The measurement of dyspnea: contents, interobserver agreement and physiologic correlates to two new clinical indexes",Chest,1984,85,,,,,Mahler DA; Weinberg DH; Wells CK
4,"Jantz MA, Silvestri GA. Silicone stents versus metal stents for management of benign tracheobronchial disease. J Bronchol. 2000;7.",Silicone stents versus metal stents for management of benign tracheobronchial disease,J Bronchol,2000,7,,,,,Jantz MA; Silvestri GA
5,"Miyazawa T, Yamakido M, Ikeda S. Implantation of Ultraflex nitinol stents in malignant tracheobronchial stenoses. Chest. 2000;118.",Implantation of Ultraflex nitinol stents in malignant tracheobronchial stenoses,Chest,2000,118,,,,,Miyazawa T; Yamakido M; Ikeda S
6,"Saad CP, Murthy S, Krizmanich G. Self-expandable metallic airway stents and flexible bronchoscopy. Chest. 2003;124.",Self-expandable metallic airway stents and flexible bronchoscopy,Chest,2003,124,,,,,Saad CP; Murthy S; Krizmanich G
7,"Bolliger C, Heitz M, Hauser R. An airway Wallstent for the treatment of tracheobronchial malignancies. Thorax. 1996;51.",An airway Wallstent for the treatment of tracheobronchial malignancies,Thorax,1996,51,,,,,Bolliger C; Heitz M; Hauser R
