#,ama,title,journal,year,volume,issue,pages,doi,pmid,authors
78,"Feller-Kopman D, Walkey A, Berkowitz D. The relationship of pleural pressure to symptom development during therapeutic thoracentesis. Chest. 2006;129.",The relationship of pleural pressure to symptom development during therapeutic thoracentesis,Chest,2006,129,,,,,Feller-Kopman D; Walkey A; Berkowitz D
79,"Salamonsen MR, Lo AK, Ng AC. Novel use of pleural ultrasound can identify malignant entrapped lung prior to effusion drainage. Chest. 2014;146.",Novel use of pleural ultrasound can identify malignant entrapped lung prior to effusion drainage,Chest,2014,146,,,,,Salamonsen MR; Lo AK; Ng AC
80,"Zahid I, Routledge T, Bille A. What is the best treatment for malignant pleural effusions?. Interact Cardiovasc Thorac Surg. 2011;12.",What is the best treatment for malignant pleural effusions?,Interact Cardiovasc Thorac Surg,2011,12,,,,,Zahid I; Routledge T; Bille A
81,"Pien GW, Gant MJ, Washam CL. Use of an implantable pleural catheter for trapped lung syndrome in patients with malignant pleural effusion. Chest. 2001;119.",Use of an implantable pleural catheter for trapped lung syndrome in patients with malignant pleural effusion,Chest,2001,119,,,,,Pien GW; Gant MJ; Washam CL
82,"Ohm C, Park D, Vogen M. Use of an indwelling pleural catheter compared with thorascopic talc pleurodesis in the management of malignant pleural effusions. Am Surg. 2003;69.",Use of an indwelling pleural catheter compared with thorascopic talc pleurodesis in the management of malignant pleural effusions,Am Surg,2003,69,,,,,Ohm C; Park D; Vogen M
83,"Qureshi RA, Collinson SL, Powell RJ. Management of malignant pleural effusion associated with trapped lung syndrome. Asian Cardiovasc Thorac Ann. 2008;16.",Management of malignant pleural effusion associated with trapped lung syndrome,Asian Cardiovasc Thorac Ann,2008,16,,,,,Qureshi RA; Collinson SL; Powell RJ
84,"Van Den Toorn LM, Schaap E, Surmont VF. Management of recurrent malignant pleural effusions with a chronic indwelling pleural catheter. Lung Cancer. 2005;50.",Management of recurrent malignant pleural effusions with a chronic indwelling pleural catheter,Lung Cancer,2005,50,,,,,Van Den Toorn LM; Schaap E; Surmont VF
85,"Burgers JA, Olijve A, Baas P. Chronic indwelling pleural catheter for malignant pleural effusion in 25 patients. Ned Tijdschr Geneeskd. 2006;150.",Chronic indwelling pleural catheter for malignant pleural effusion in 25 patients,Ned Tijdschr Geneeskd,2006,150,,,,,Burgers JA; Olijve A; Baas P
86,"Efthymiou CA, Masudi T, Thorpe J. Malignant pleural effusion in the presence of trapped lung. Five-year experience of PleurX tunnelled catheters. Interact Cardiovasc Thorac Surg. 2009;9.",Malignant pleural effusion in the presence of trapped lung. Five-year experience of PleurX tunnelled catheters,Interact Cardiovasc Thorac Surg,2009,9,,,,,Efthymiou CA; Masudi T; Thorpe J
87,"Petrou M, Kaplan D, Goldstraw P. Management of recurrent malignant pleural effusions: the complementary role of talc pleurodesis and pleuroperitoneal shunting. Cancer. 1995;75.",Management of recurrent malignant pleural effusions: the complementary role of talc pleurodesis and pleuroperitoneal shunting,Cancer,1995,75,,,,,Petrou M; Kaplan D; Goldstraw P
88,"Genc O, Petrou M, Ladas G. The long-term morbidity of pleuroperitoneal shunts in the management of recurrent malignant effusions. Eur J Cardiothorac Surg. 2000;18.",The long-term morbidity of pleuroperitoneal shunts in the management of recurrent malignant effusions,Eur J Cardiothorac Surg,2000,18,,,,,Genc O; Petrou M; Ladas G
89,"Yim AP, Ho JK, Lee TW. Thoracoscopic management of pleural effusions revisited. Aust N Z J Surg. 1995;65.",Thoracoscopic management of pleural effusions revisited,Aust N Z J Surg,1995,65,,,,,Yim AP; Ho JK; Lee TW
90,"Hsu LH, Soong TC, Feng AC. Intrapleural urokinase for the treatment of loculated malignant pleural effusions and trapped lungs in medically inoperable cancer patients. J Thorac Oncol. 2006;1.",Intrapleural urokinase for the treatment of loculated malignant pleural effusions and trapped lungs in medically inoperable cancer patients,J Thorac Oncol,2006,1,,,,,Hsu LH; Soong TC; Feng AC
91,"Chung C, Chen C, Sheu J. Proinflammatory cytokines, transforming growth factor-β1, and fibrinolytic enzymes in loculated and free-flowing pleural exudates. Chest. 2005;128.","Proinflammatory cytokines, transforming growth factor-β1, and fibrinolytic enzymes in loculated and free-flowing pleural exudates",Chest,2005,128,,,,,Chung C; Chen C; Sheu J
92,"Sioris T, Sihvo E, Salo J. Long-term indwelling pleural catheter (PleurX) for malignant pleural effusion unsuitable for talc pleurodesis. Eur J Surg Oncol. 2009;35.",Long-term indwelling pleural catheter (PleurX) for malignant pleural effusion unsuitable for talc pleurodesis,Eur J Surg Oncol,2009,35,,,,,Sioris T; Sihvo E; Salo J
93,"Bielsa S, Martin-Juan J, Porcel JM. Diagnostic and prognostic implications of pleural adhesions in malignant effusions. J Thorac Oncol. 2008;3.",Diagnostic and prognostic implications of pleural adhesions in malignant effusions,J Thorac Oncol,2008,3,,,,,Bielsa S; Martin-Juan J; Porcel JM
94,"Mason AC, Miller BH, Krasna MJ. Accuracy of CT for the detection of pleural adhesions: correlation with video-assisted thoracoscopic surgery. Chest. 1999;115.",Accuracy of CT for the detection of pleural adhesions: correlation with video-assisted thoracoscopic surgery,Chest,1999,115,,,,,Mason AC; Miller BH; Krasna MJ
95,"Cassanelli N, Caroli G, Dolci G. Accuracy of transthoracic ultrasound for the detection of pleural adhesions. Eur J Cardiothorac Surg. 2012;42.",Accuracy of transthoracic ultrasound for the detection of pleural adhesions,Eur J Cardiothorac Surg,2012,42,,,,,Cassanelli N; Caroli G; Dolci G
96,"Wei B, Wang T, Jiang F. Use of transthoracic ultrasound to predict pleural adhesions: a prospective blinded study. Thorac Cardiovasc Surg. 2012;60.",Use of transthoracic ultrasound to predict pleural adhesions: a prospective blinded study,Thorac Cardiovasc Surg,2012,60,,,,,Wei B; Wang T; Jiang F
97,"Medford AR, Agrawal S, Bennett JA. Thoracic ultrasound prior to medical thoracoscopy improves pleural access and predicts fibrous septation. Respirology. 2010;15.",Thoracic ultrasound prior to medical thoracoscopy improves pleural access and predicts fibrous septation,Respirology,2010,15,,,,,Medford AR; Agrawal S; Bennett JA
98,"Kohan JM, Poe RH, Israel RH. Value of chest ultrasonography versus decubitus roentgenography for thoracentesis. Am Rev Respir Dis. 1986;133.",Value of chest ultrasonography versus decubitus roentgenography for thoracentesis,Am Rev Respir Dis,1986,133,,,,,Kohan JM; Poe RH; Israel RH
99,"Havelock T, Teoh R, Laws D. Pleural procedures and thoracic ultrasound: British Thoracic Society pleural disease guideline 2010. Thorax. 2010;65.",Pleural procedures and thoracic ultrasound: British Thoracic Society pleural disease guideline 2010,Thorax,2010,65,,,,,Havelock T; Teoh R; Laws D
100,"Silverman SG, Mueller PR, Saini S. Thoracic empyema: management with image-guided catheter drainage. Radiology. 1988;169.",Thoracic empyema: management with image-guided catheter drainage,Radiology,1988,169,,,,,Silverman SG; Mueller PR; Saini S
101,"Davies HE, Davies RJ, Davies CW. Management of pleural infection in adults: British Thoracic Society Pleural Disease Guideline 2010. Thorax. 2010;65(2).",Management of pleural infection in adults: British Thoracic Society Pleural Disease Guideline 2010,Thorax,2010,65,2,,,,Davies HE; Davies RJ; Davies CW
102,"Vansonnenberg E, Nakamoto S, Mueller P. CT-and ultrasound-guided catheter drainage of empyemas after chest-tube failure. Radiology. 1984;151.",CT-and ultrasound-guided catheter drainage of empyemas after chest-tube failure,Radiology,1984,151,,,,,Vansonnenberg E; Nakamoto S; Mueller P
103,"Rahman NM, Maskell NA, West A. Intrapleural use of tissue plasminogen activator and DNase in pleural infection. N Engl J Med. 2011;365.",Intrapleural use of tissue plasminogen activator and DNase in pleural infection,N Engl J Med,2011,365,,,,,Rahman NM; Maskell NA; West A
104,"Balamugesh T, Christopher DJ, Rajesh T. Fibrinolysis of loculated pleural effusion in malignant mesothelioma. Singapore Med J. 2004;45.",Fibrinolysis of loculated pleural effusion in malignant mesothelioma,Singapore Med J,2004,45,,,,,Balamugesh T; Christopher DJ; Rajesh T
105,"Dixit R, Dixit K, Bansal R. Intrapleural streptokinase in multiloculated malignant pleural effusion. Indian J Chest Dis Allied Sci. 2004;46.",Intrapleural streptokinase in multiloculated malignant pleural effusion,Indian J Chest Dis Allied Sci,2004,46,,,,,Dixit R; Dixit K; Bansal R
106,"Maskell NA, Gleeson FV. Images in clinical medicine. Effect of intrapleural streptokinase on a loculated malignant pleural effusion. N Engl J Med. 2003;348:e4.",Images in clinical medicine. Effect of intrapleural streptokinase on a loculated malignant pleural effusion,N Engl J Med,2003,348,,e4,,,Maskell NA; Gleeson FV
107,"Jerjes-Sanchez C, Ramirez-Rivera A, Elizalde JJ. Intrapleural fibrinolysis with streptokinase as an adjunctive treatment in hemothorax and empyema: a multicenter trial. Chest. 1996;109.",Intrapleural fibrinolysis with streptokinase as an adjunctive treatment in hemothorax and empyema: a multicenter trial,Chest,1996,109,,,,,Jerjes-Sanchez C; Ramirez-Rivera A; Elizalde JJ
108,"Davies CW, Traill ZC, Gleeson FV. Intrapleural streptokinase in the management of malignant multiloculated pleural effusions. Chest. 1999;115.",Intrapleural streptokinase in the management of malignant multiloculated pleural effusions,Chest,1999,115,,,,,Davies CW; Traill ZC; Gleeson FV
109,"Ben-Or S, Feins RH, Veeramachaneni NK. Effectiveness and risks associated with intrapleural alteplase by means of tube thoracostomy. Ann Thorac Surg. 2011;91.",Effectiveness and risks associated with intrapleural alteplase by means of tube thoracostomy,Ann Thorac Surg,2011,91,,,,,Ben-Or S; Feins RH; Veeramachaneni NK
110,"Gilkeson RC, Silverman P, Haaga JR. Using urokinase to treat malignant pleural effusions. AJR Am J Roentgenol. 1999;173.",Using urokinase to treat malignant pleural effusions,AJR Am J Roentgenol,1999,173,,,,,Gilkeson RC; Silverman P; Haaga JR
111,"Abu-Daff S, Maziak DE, Alshehab D. Intrapleural fibrinolytic therapy (IPFT) in loculated pleural effusions-analysis of predictors for failure of therapy and bleeding: a cohort study. BMJ Open. 2013;3:e001887.",Intrapleural fibrinolytic therapy (IPFT) in loculated pleural effusions-analysis of predictors for failure of therapy and bleeding: a cohort study,BMJ Open,2013,3,,e001887,,,Abu-Daff S; Maziak DE; Alshehab D
112,"Okur E, Baysungur V, Tezel C. Streptokinase for malignant pleural effusions: a randomized controlled study. Asian Cardiovasc Thorac Ann. 2011;19.",Streptokinase for malignant pleural effusions: a randomized controlled study,Asian Cardiovasc Thorac Ann,2011,19,,,,,Okur E; Baysungur V; Tezel C
113,"Saydam O, Karapinar K, Gokce M. The palliative treatment with intrapleural streptokinase in patients with multiloculated malignant pleural effusion: a double-blind, placebo-controlled, randomized study. Med Oncol. 2015;32:179.","The palliative treatment with intrapleural streptokinase in patients with multiloculated malignant pleural effusion: a double-blind, placebo-controlled, randomized study",Med Oncol,2015,32,,179,,,Saydam O; Karapinar K; Gokce M
114,"Mishra D, Dao C, Wills M. Randomised controlled trial of urokinase versus placebo for non-draining malignant pleural effusion. Am J Respir Crit Care Med. 2017;197.",Randomised controlled trial of urokinase versus placebo for non-draining malignant pleural effusion,Am J Respir Crit Care Med,2017,197,,,,,Mishra D; Dao C; Wills M
115,"Thomas R, Piccolo F, Miller D. Intrapleural fibrinolysis for the treatment of indwelling pleural catheter-related symptomatic loculations: a multicenter observational study. Chest. 2015;148. doi:10.1183/13993003.00349-2018115.",Intrapleural fibrinolysis for the treatment of indwelling pleural catheter-related symptomatic loculations: a multicenter observational study,Chest,2015,148,,,10.1183/13993003.00349-2018115,,Thomas R; Piccolo F; Miller D
116,"Antony VB, Loddenkemper R, Astoul P. Management of malignant pleural effusions. Am J Respir Crit Care Med. 2000;162:116.",Management of malignant pleural effusions,Am J Respir Crit Care Med,2000,162,,116,,,Antony VB; Loddenkemper R; Astoul P
117,"Heffner JE, Nietert PJ, Barbieri C. Pleural fluid pH as a predictor of survival for patients with malignant pleural effusions. Chest. 2000;117:117.",Pleural fluid pH as a predictor of survival for patients with malignant pleural effusions,Chest,2000,117,,117,,,Heffner JE; Nietert PJ; Barbieri C
118,"Abakay A, Komek H, Abakay O. Relationship between 18 FDG PET-CT findings and the survival of 177 patients with malignant pleural mesothelioma. Eur Rev Med Pharmacol Sci. 2013;17:118.",Relationship between 18 FDG PET-CT findings and the survival of 177 patients with malignant pleural mesothelioma,Eur Rev Med Pharmacol Sci,2013,17,,118,,,Abakay A; Komek H; Abakay O
119,"Zamboni MM, Da Silva CT, Baretta R. Important prognostic factors for survival in patients with malignant pleural effusion. BMC Pulm Med. 2015;15:119.",Important prognostic factors for survival in patients with malignant pleural effusion,BMC Pulm Med,2015,15,,119,,,Zamboni MM; Da Silva CT; Baretta R
120,"Bielsa S, Salud A, Martínez M. Prognostic significance of pleural fluid data in patients with malignant effusion. Eur J Intern Med. 2008;19:120.",Prognostic significance of pleural fluid data in patients with malignant effusion,Eur J Intern Med,2008,19,,120,,,Bielsa S; Salud A; Martínez M
121,"Fentiman IS, Millis R, Sexton S. Pleural effusion in breast cancer: a review of 105 cases. Cancer. 1981;47:121.",Pleural effusion in breast cancer: a review of 105 cases,Cancer,1981,47,,121,,,Fentiman IS; Millis R; Sexton S
122,"Anevlavis S, Kouliatsis G, Sotiriou I. Prognostic factors in patients presenting with pleural effusion revealing malignancy. Respiration. 2014;87:122.",Prognostic factors in patients presenting with pleural effusion revealing malignancy,Respiration,2014,87,,122,,,Anevlavis S; Kouliatsis G; Sotiriou I
123,"Edge S, Byrd D, Compton C. American Joint Committee on Cancer. American Joint Committee on Cancer. 2009;None:123.",American Joint Committee on Cancer,American Joint Committee on Cancer,2009,,,123,,,Edge S; Byrd D; Compton C
124,"Rusch VW, Chansky K, Kindler HL. The IASLC Mesothelioma Staging Project: proposals for the M descriptors and for revision of the TNM stage groupings in the forthcoming (eighth) edition of the TNM classification for mesothelioma. J Thorac Oncol. 2016;11:124.",The IASLC Mesothelioma Staging Project: proposals for the M descriptors and for revision of the TNM stage groupings in the forthcoming (eighth) edition of the TNM classification for mesothelioma,J Thorac Oncol,2016,11,,124,,,Rusch VW; Chansky K; Kindler HL
125,"Buccheri G, Ferrigno D, Tamburini M. Karnofsky and ECOG performance status scoring in lung cancer: a prospective, longitudinal study of 536 patients from a single institution. Eur J Cancer. 1996;32:125.","Karnofsky and ECOG performance status scoring in lung cancer: a prospective, longitudinal study of 536 patients from a single institution",Eur J Cancer,1996,32,,125,,,Buccheri G; Ferrigno D; Tamburini M
126,"Hwang SS, Scott CB, Chang VT. Prediction of survival for advanced cancer patients by recursive partitioning analysis: role of Karnofsky performance status, quality of life, and symptom distress. Cancer Invest. 2004;22:126.","Prediction of survival for advanced cancer patients by recursive partitioning analysis: role of Karnofsky performance status, quality of life, and symptom distress",Cancer Invest,2004,22,,126,,,Hwang SS; Scott CB; Chang VT
127,"Burrows CM, Mathews WC, Colt HG. Predicting survival in patients with recurrent symptomatic malignant pleural effusions: an assessment of the prognostic values of physiologic, morphologic, and quality of life measures of extent of disease. Chest. 2000;117:127.","Predicting survival in patients with recurrent symptomatic malignant pleural effusions: an assessment of the prognostic values of physiologic, morphologic, and quality of life measures of extent of disease",Chest,2000,117,,127,,,Burrows CM; Mathews WC; Colt HG
128,"Oken MM, Creech RH, Tormey DC. Toxicity and response criteria of the Eastern Cooperative Oncology Group. Am J Clin Oncol. 1982;5:128.",Toxicity and response criteria of the Eastern Cooperative Oncology Group,Am J Clin Oncol,1982,5,,128,,,Oken MM; Creech RH; Tormey DC
129,"Karnofsky DA, Burchenal JH. The clinical evaluation of chemotherapeutic agents in cancer. Evaluation of Chemotherapeutic Agents. 1949;None:129.",The clinical evaluation of chemotherapeutic agents in cancer,Evaluation of Chemotherapeutic Agents,1949,,,129,,,Karnofsky DA; Burchenal JH
130,"Martinez-Moragon E, Aparicio J, Sanchis J. Malignant pleural effusion: prognostic factors for survival and response to chemical pleurodesis in a series of 120 cases. Respiration. 1998;65:130.",Malignant pleural effusion: prognostic factors for survival and response to chemical pleurodesis in a series of 120 cases,Respiration,1998,65,,130,,,Martinez-Moragon E; Aparicio J; Sanchis J
131,"Jiménez D, Díaz G, Gil D. Etiology and prognostic significance of massive pleural effusions. Respir Med. 2005;99:131.",Etiology and prognostic significance of massive pleural effusions,Respir Med,2005,99,,131,,,Jiménez D; Díaz G; Gil D
132,"Sahn SA, Good JT. Pleural fluid pH in malignant effusions. Diagnostic, prognostic, and therapeutic implications. Ann Intern Med. 1988;108:132.","Pleural fluid pH in malignant effusions. Diagnostic, prognostic, and therapeutic implications",Ann Intern Med,1988,108,,132,,,Sahn SA; Good JT
133,"Sakr L, Maldonado F, Greillier L. Thoracoscopic assessment of pleural tumor burden in patients with malignant pleural effusion: prognostic and therapeutic implications. J Thorac Oncol. 2011;6:133.",Thoracoscopic assessment of pleural tumor burden in patients with malignant pleural effusion: prognostic and therapeutic implications,J Thorac Oncol,2011,6,,133,,,Sakr L; Maldonado F; Greillier L
134,"Wu S, Yu C, Tsai M. Survival of lung adenocarcinoma patients with malignant pleural effusion. Eur Respir J. 2013;41:134.",Survival of lung adenocarcinoma patients with malignant pleural effusion,Eur Respir J,2013,41,,134,,,Wu S; Yu C; Tsai M
135,"Soh J, Toyooka S, Aoe K. Usefulness of EGFR mutation screening in pleural fluid to predict the clinical outcome of gefitinib treated patients with lung cancer. Int J Cancer. 2006;119:135.",Usefulness of EGFR mutation screening in pleural fluid to predict the clinical outcome of gefitinib treated patients with lung cancer,Int J Cancer,2006,119,,135,,,Soh J; Toyooka S; Aoe K
136,"Zalcman G, Mazieres J, Margery J. Bevacizumab for newly diagnosed pleural mesothelioma in the Mesothelioma Avastin Cisplatin Pemetrexed Study (MAPS): a randomised, controlled, open-label, phase 3 trial. Lancet. 2015;387:136.","Bevacizumab for newly diagnosed pleural mesothelioma in the Mesothelioma Avastin Cisplatin Pemetrexed Study (MAPS): a randomised, controlled, open-label, phase 3 trial",Lancet,2015,387,,136,,,Zalcman G; Mazieres J; Margery J
137,"Gkiozos I, Tsagouli S, Charpidou A. Levels of vascular endothelial growth factor in serum and pleural fluid are independent predictors of survival in advanced non-small cell lung cancer: results of a prospective study. Anticancer Res. 2015;35:137.",Levels of vascular endothelial growth factor in serum and pleural fluid are independent predictors of survival in advanced non-small cell lung cancer: results of a prospective study,Anticancer Res,2015,35,,137,,,Gkiozos I; Tsagouli S; Charpidou A
138,"Hsu IL, Su WC, Yan JJ. Angiogenetic biomarkers in non-small cell lung cancer with malignant pleural effusion: correlations with patient survival and pleural effusion control. Lung Cancer. 2009;65:138.",Angiogenetic biomarkers in non-small cell lung cancer with malignant pleural effusion: correlations with patient survival and pleural effusion control,Lung Cancer,2009,65,,138,,,Hsu IL; Su WC; Yan JJ
139,"Edwards JG, Abrams KR, Leverment JN. Prognostic factors for malignant mesothelioma in 142 patients: validation of CALGB and EORTC prognostic scoring systems. Thorax. 2000;55:139.",Prognostic factors for malignant mesothelioma in 142 patients: validation of CALGB and EORTC prognostic scoring systems,Thorax,2000,55,,139,,,Edwards JG; Abrams KR; Leverment JN
140,"Edwards JG, Swinson DE, Jones JL. Tumor necrosis correlates with angiogenesis and is a predictor of poor prognosis in malignant mesothelioma. Chest. 2003;124:140.",Tumor necrosis correlates with angiogenesis and is a predictor of poor prognosis in malignant mesothelioma,Chest,2003,124,,140,,,Edwards JG; Swinson DE; Jones JL
141,"Rutter M, Saunders B, Wilkinson K. Severity of inflammation is a risk factor for colorectal neoplasia in ulcerative colitis. Gastroenterology. 2004;126:141.",Severity of inflammation is a risk factor for colorectal neoplasia in ulcerative colitis,Gastroenterology,2004,126,,141,,,Rutter M; Saunders B; Wilkinson K
142,"Grivennikov SI, Greten FR, KM. Immunity, inflammation, and cancer. Cell. 2010;140:142.","Immunity, inflammation, and cancer",Cell,2010,140,,142,,,Grivennikov SI; Greten FR; KM
143,"Fearon K, Strasser F, Anker SD. Definition and classification of cancer cachexia: an international consensus. Lancet Oncol. 2011;12:143.",Definition and classification of cancer cachexia: an international consensus,Lancet Oncol,2011,12,,143,,,Fearon K; Strasser F; Anker SD
144,"Linton A, Van Zandwijk N, Reid G. Inflammation in malignant mesothelioma -friend or foe?. Ann Cardiothorac Surg. 2012;1:144.",Inflammation in malignant mesothelioma -friend or foe?,Ann Cardiothorac Surg,2012,1,,144,,,Linton A; Van Zandwijk N; Reid G
145,Mcmillan DC. The systemic inflammation-based Glasgow Prognostic Score: a decade of experience in patients with cancer. Cancer Treat Rev. 2013;39:145.,The systemic inflammation-based Glasgow Prognostic Score: a decade of experience in patients with cancer,Cancer Treat Rev,2013,39,,145,,,Mcmillan DC
146,"Pinato DJ, Mauri FA, Ramakrishnan R. Inflammation-based prognostic indices in malignant pleural mesothelioma. J Thorac Oncol. 2012;7:146.",Inflammation-based prognostic indices in malignant pleural mesothelioma,J Thorac Oncol,2012,7,,146,,,Pinato DJ; Mauri FA; Ramakrishnan R
147,"Forrest L, Mcmillan D, Mcardle C. Evaluation of cumulative prognostic scores based on the systemic inflammatory response in patients with inoperable non-small-cell lung cancer. Br J Cancer. 2003;89:147.",Evaluation of cumulative prognostic scores based on the systemic inflammatory response in patients with inoperable non-small-cell lung cancer,Br J Cancer,2003,89,,147,,,Forrest L; Mcmillan D; Mcardle C
148,"Sculier J, Chansky K, Crowley JJ. The impact of additional prognostic factors on survival and their relationship with the anatomical extent of disease expressed by the 6th Edition of the TNM Classification of Malignant Tumors and the proposals for the 7th Edition. J Thorac Oncol. 2008;3:148.",The impact of additional prognostic factors on survival and their relationship with the anatomical extent of disease expressed by the 6th Edition of the TNM Classification of Malignant Tumors and the proposals for the 7th Edition,J Thorac Oncol,2008,3,,148,,,Sculier J; Chansky K; Crowley JJ
149,"Paesmans M, Sculier J, Libert P. Prognostic factors for survival in advanced non-small-cell lung cancer: univariate and multivariate analyses including recursive partitioning and amalgamation algorithms in 1,052 patients. The European Lung Cancer Working Party. J Clin Oncol. 1995;13:149.","Prognostic factors for survival in advanced non-small-cell lung cancer: univariate and multivariate analyses including recursive partitioning and amalgamation algorithms in 1,052 patients. The European Lung Cancer Working Party",J Clin Oncol,1995,13,,149,,,Paesmans M; Sculier J; Libert P
150,"Schmidt H, Bastholt L, Geertsen P. Elevated neutrophil and monocyte counts in peripheral blood are associated with poor survival in patients with metastatic melanoma: a prognostic model. Br J Cancer. 2005;93:150.",Elevated neutrophil and monocyte counts in peripheral blood are associated with poor survival in patients with metastatic melanoma: a prognostic model,Br J Cancer,2005,93,,150,,,Schmidt H; Bastholt L; Geertsen P
151,"Atzpodien J, Royston P, Wandert T. Metastatic renal carcinoma comprehensive prognostic system. Br J Cancer. 2003;88:151.",Metastatic renal carcinoma comprehensive prognostic system,Br J Cancer,2003,88,,151,,,Atzpodien J; Royston P; Wandert T
152,"Lissoni P, Brivio F, Fumagalli L. Efficacy of cancer chemotherapy in relation to the pretreatment number of lymphocytes in patients with metastatic solid tumors. Int J Biol Markers. 2003;19:152.",Efficacy of cancer chemotherapy in relation to the pretreatment number of lymphocytes in patients with metastatic solid tumors,Int J Biol Markers,2003,19,,152,,,Lissoni P; Brivio F; Fumagalli L
153,"Anraku M, Cunningham KS, Yun Z. Impact of tumor-infiltrating T cells on survival in patients with malignant pleural mesothelioma. J Thorac Cardiovasc Surg. 2008;135:153.",Impact of tumor-infiltrating T cells on survival in patients with malignant pleural mesothelioma,J Thorac Cardiovasc Surg,2008,135,,153,,,Anraku M; Cunningham KS; Yun Z
