#,ama,title,journal,year,volume,issue,pages,doi,pmid,authors
224,"Abouzgheib W, Bartter T, Dagher H. A prospective study of the volume of pleural fluid required for accurate diagnosis of malignant pleural effusion. Chest. 2009;135:225.",A prospective study of the volume of pleural fluid required for accurate diagnosis of malignant pleural effusion,Chest,2009,135,,225,,,Abouzgheib W; Bartter T; Dagher H
225,"Thomas SC, Davidson LR, Mckean ME. An investigation of adequate volume for the diagnosis of malignancy in pleural fluids. Cytopathology. 2011;22:226.",An investigation of adequate volume for the diagnosis of malignancy in pleural fluids,Cytopathology,2011,22,,226,,,Thomas SC; Davidson LR; Mckean ME
226,"Rooper LM, Ali SZ, Olson MT. A minimum fluid volume of 75 mL is needed to ensure adequacy in a pleural effusion: a retrospective analysis of 2540 cases. Cancer Cytopathol. 2014;122:227.",A minimum fluid volume of 75 mL is needed to ensure adequacy in a pleural effusion: a retrospective analysis of 2540 cases,Cancer Cytopathol,2014,122,,227,,,Rooper LM; Ali SZ; Olson MT
227,"Swiderek J, Morcos S, Donthireddy V. Prospective study to determine the volume of pleural fluid required to diagnose malignancy. Chest. 2010;137:228.",Prospective study to determine the volume of pleural fluid required to diagnose malignancy,Chest,2010,137,,228,,,Swiderek J; Morcos S; Donthireddy V
228,"Porcel JM, Quiros M, Gatius S. Examination of cytological smears and cell blocks of pleural fluid: complementary diagnostic value for malignant effusions. Rev Clin Esp. 2017;217:229.",Examination of cytological smears and cell blocks of pleural fluid: complementary diagnostic value for malignant effusions,Rev Clin Esp,2017,217,,229,,,Porcel JM; Quiros M; Gatius S
229,"Dekker A, Bupp PA. Cytology of serous effusions: an investigation into the usefulness of cell blocks versus smears. Am J Clin Pathol. 1978;70:230.",Cytology of serous effusions: an investigation into the usefulness of cell blocks versus smears,Am J Clin Pathol,1978,70,,230,,,Dekker A; Bupp PA
230,"Galateau-Salle F, Churg A, Roggli V. The 2015 World Health Organization Classification of Tumors of the Pleura: advances since the 2004 classification. J Thorac Oncol. 2016;11:231.",The 2015 World Health Organization Classification of Tumors of the Pleura: advances since the 2004 classification,J Thorac Oncol,2016,11,,231,,,Galateau-Salle F; Churg A; Roggli V
231,"Husain AN, Colby T, Ordonez N. Guidelines for pathologic diagnosis of malignant mesothelioma: 2012 update of the consensus statement from the International Mesothelioma Interest Group. Arch Pathol Lab Med. 2013;137:232.",Guidelines for pathologic diagnosis of malignant mesothelioma: 2012 update of the consensus statement from the International Mesothelioma Interest Group,Arch Pathol Lab Med,2013,137,,232,,,Husain AN; Colby T; Ordonez N
232,"Husain AN, Colby TV, Ordonez NG. Guidelines for pathologic diagnosis of malignant mesothelioma: 2017 update of the consensus statement from the International Mesothelioma Interest Group. Arch Pathol Lab Med. 2017;142:233.",Guidelines for pathologic diagnosis of malignant mesothelioma: 2017 update of the consensus statement from the International Mesothelioma Interest Group,Arch Pathol Lab Med,2017,142,,233,,,Husain AN; Colby TV; Ordonez NG
233,"Karpathiou G, Stefanou D, Froudarakis ME. Pleural neoplastic pathology. Respir Med. 2015;109:234.",Pleural neoplastic pathology,Respir Med,2015,109,,234,,,Karpathiou G; Stefanou D; Froudarakis ME
234,"Yang Y, Liu YL, Shi HZ. Diagnostic accuracy of combinations of tumor markers for malignant pleural effusion: an updated meta-analysis. Respiration. 2017;94:235.",Diagnostic accuracy of combinations of tumor markers for malignant pleural effusion: an updated meta-analysis,Respiration,2017,94,,235,,,Yang Y; Liu YL; Shi HZ
235,"Katz RL, Raval P, Manning JT. A morphologic, immunologic, and cytometric approach to the classification of non-Hodgkin's lymphoma in effusions. Diagn Cytopathol. 1987;3:236.","A morphologic, immunologic, and cytometric approach to the classification of non-Hodgkin's lymphoma in effusions",Diagn Cytopathol,1987,3,,236,,,Katz RL; Raval P; Manning JT
236,"Simsir A, Fetsch P, Stetler-Stevenson M. Immunophenotypic analysis of non-Hodgkin's lymphomas in cytologic specimens: a correlative study of immunocytochemical and flow cytometric techniques. Diagn Cytopathol. 1999;20:237.",Immunophenotypic analysis of non-Hodgkin's lymphomas in cytologic specimens: a correlative study of immunocytochemical and flow cytometric techniques,Diagn Cytopathol,1999,20,,237,,,Simsir A; Fetsch P; Stetler-Stevenson M
237,"Pillai V, Cibas ES, Dorfman DM. A simplified flow cytometric immunophenotyping procedure for the diagnosis of effusions caused by epithelial malignancies. Am J Clin Pathol. 2013;139:238.",A simplified flow cytometric immunophenotyping procedure for the diagnosis of effusions caused by epithelial malignancies,Am J Clin Pathol,2013,139,,238,,,Pillai V; Cibas ES; Dorfman DM
238,"Davidson B, Dong HP, Berner A. Detection of malignant epithelial cells in effusions using flow cytometric immunophenotyping: an analysis of 92 cases. Am J Clin Pathol. 2002;118:239.",Detection of malignant epithelial cells in effusions using flow cytometric immunophenotyping: an analysis of 92 cases,Am J Clin Pathol,2002,118,,239,,,Davidson B; Dong HP; Berner A
239,"Acosta M, Pereira J, Arroz M. Screening of carcinoma metastasis by flow cytometry: a study of 238 cases. Cytometry B Clin Cytom. 2016;90:240.",Screening of carcinoma metastasis by flow cytometry: a study of 238 cases,Cytometry B Clin Cytom,2016,90,,240,,,Acosta M; Pereira J; Arroz M
240,"Tse HT, Gossett DR, Moon YS. Quantitative diagnosis of malignant pleural effusions by single-cell mechanophenotyping. Sci Transl Med. 2013;5:241.",Quantitative diagnosis of malignant pleural effusions by single-cell mechanophenotyping,Sci Transl Med,2013,5,,241,,,Tse HT; Gossett DR; Moon YS
241,"Berg KB, Churg A. GATA3 immunohistochemistry for distinguishing sarcomatoid and desmoplastic mesothelioma from sarcomatoid carcinoma of the lung. Am J Surg Pathol. 2017;41:242.",GATA3 immunohistochemistry for distinguishing sarcomatoid and desmoplastic mesothelioma from sarcomatoid carcinoma of the lung,Am J Surg Pathol,2017,41,,242,,,Berg KB; Churg A
242,"Churg A, Sheffield BS, Galateau-Salle F. New markers for separating benign from malignant mesothelial proliferations: are we there yet?. Arch Pathol Lab Med. 2016;140:243.",New markers for separating benign from malignant mesothelial proliferations: are we there yet?,Arch Pathol Lab Med,2016,140,,243,,,Churg A; Sheffield BS; Galateau-Salle F
243,"Hwang HC, Sheffield BS, Rodriguez S. Utility of BAP1 immunohistochemistry and p16 (CDKN2A) FISH in the diagnosis of malignant mesothelioma in effusion cytology specimens. Am J Surg Pathol. 2016;40:244.",Utility of BAP1 immunohistochemistry and p16 (CDKN2A) FISH in the diagnosis of malignant mesothelioma in effusion cytology specimens,Am J Surg Pathol,2016,40,,244,,,Hwang HC; Sheffield BS; Rodriguez S
244,"Cigognetti M, Lonardi S, Fisogni S. BAP1 (BRCA1-associated protein 1) is a highly specific marker for differentiating mesothelioma from reactive mesothelial proliferations. Mod Pathol. 2015;28:245.",BAP1 (BRCA1-associated protein 1) is a highly specific marker for differentiating mesothelioma from reactive mesothelial proliferations,Mod Pathol,2015,28,,245,,,Cigognetti M; Lonardi S; Fisogni S
245,"Hiroshima K, Wu D, Hasegawa M. Cytologic differential diagnosis of malignant mesothelioma and reactive mesothelial cells with FISH analysis of p16. Diagn Cytopathol. 2016;44:246.",Cytologic differential diagnosis of malignant mesothelioma and reactive mesothelial cells with FISH analysis of p16,Diagn Cytopathol,2016,44,,246,,,Hiroshima K; Wu D; Hasegawa M
246,"Paintal A, Raparia K, Zakowski MF. The diagnosis of malignant mesothelioma in effusion cytology: a reappraisal and results of a multi-institution survey. Cancer Cytopathol. 2013;121:247.",The diagnosis of malignant mesothelioma in effusion cytology: a reappraisal and results of a multi-institution survey,Cancer Cytopathol,2013,121,,247,,,Paintal A; Raparia K; Zakowski MF
247,"Valente K, Blackham AU, Levine E. A histomorphologic grading system that predicts overall survival in diffuse malignant peritoneal mesothelioma with epithelioid subtype. Am J Surg Pathol. 2016;40:248.",A histomorphologic grading system that predicts overall survival in diffuse malignant peritoneal mesothelioma with epithelioid subtype,Am J Surg Pathol,2016,40,,248,,,Valente K; Blackham AU; Levine E
248,"Habougit C, Trombert-Paviot B, Karpathiou G. Histopathologic features predict survival in diffuse pleural malignant mesothelioma on pleural biopsies. Virchows Arch. 2017;470:249.",Histopathologic features predict survival in diffuse pleural malignant mesothelioma on pleural biopsies,Virchows Arch,2017,470,,249,,,Habougit C; Trombert-Paviot B; Karpathiou G
249,"Kadota K, Suzuki K, Colovos C. A nuclear grading system is a strong predictor of survival in epitheloid diffuse malignant pleural mesothelioma. Mod Pathol. 2012;25:250.",A nuclear grading system is a strong predictor of survival in epitheloid diffuse malignant pleural mesothelioma,Mod Pathol,2012,25,,250,,,Kadota K; Suzuki K; Colovos C
250,"Ghanim B, Klikovits T, Hoda MA. Ki67 index is an independent prognostic factor in epithelioid but not in non-epithelioid malignant pleural mesothelioma: a multicenter study. Br J Cancer. 2015;112:251.",Ki67 index is an independent prognostic factor in epithelioid but not in non-epithelioid malignant pleural mesothelioma: a multicenter study,Br J Cancer,2015,112,,251,,,Ghanim B; Klikovits T; Hoda MA
251,"Hatoum H, Lourdes Y, Dhillon SS. Adequacy of malignant pleural effusion for epidermal growth factor receptor mutation analysis using the pyrosequencing method. Pleura. 2015;2:252.",Adequacy of malignant pleural effusion for epidermal growth factor receptor mutation analysis using the pyrosequencing method,Pleura,2015,2,,252,,,Hatoum H; Lourdes Y; Dhillon SS
252,"Carter J, Miller JA, Feller-Kopman D. Molecular profiling of malignant pleural effusion in metastatic non-small-cell lung carcinoma the effect of preanalytical factors. Ann Am Thorac Soc. 2017;14:253.",Molecular profiling of malignant pleural effusion in metastatic non-small-cell lung carcinoma the effect of preanalytical factors,Ann Am Thorac Soc,2017,14,,253,,,Carter J; Miller JA; Feller-Kopman D
253,"Shin S, Kim J, Kim Y. Assessment of real-time PCR method for detection of EGFR mutation using both supernatant and cell pellet of malignant pleural effusion samples from non-small-cell lung cancer patients. Clin Chem Lab Med. 2017;55:254.",Assessment of real-time PCR method for detection of EGFR mutation using both supernatant and cell pellet of malignant pleural effusion samples from non-small-cell lung cancer patients,Clin Chem Lab Med,2017,55,,254,,,Shin S; Kim J; Kim Y
254,"Tang Y, Wang Z, Li Z. High-throughput screening of rare metabolically active tumor cells in pleural effusion and peripheral blood of lung cancer patients. Proc Natl Acad Sci. 2017;114:255.",High-throughput screening of rare metabolically active tumor cells in pleural effusion and peripheral blood of lung cancer patients,Proc Natl Acad Sci,2017,114,,255,,,Tang Y; Wang Z; Li Z
255,"Rahman NM, Ali NJ, Brown G. Local anaesthetic thoracoscopy: British Thoracic Society Pleural Disease Guideline 2010. Thorax. 2010;65:256.",Local anaesthetic thoracoscopy: British Thoracic Society Pleural Disease Guideline 2010,Thorax,2010,65,,256,,,Rahman NM; Ali NJ; Brown G
256,"Bibby AC, Maskell NA. Pleural biopsies in undiagnosed pleural effusions; Abrams vs image-guided vs thoracoscopic biopsies. Curr Opin Pulm Med. 2016;22:257.",Pleural biopsies in undiagnosed pleural effusions; Abrams vs image-guided vs thoracoscopic biopsies,Curr Opin Pulm Med,2016,22,,257,,,Bibby AC; Maskell NA
257,"Miyoshi S, Sasada S, Izumo T. Diagnostic utility of pleural fluid cell block versus pleural biopsy collected by flex-rigid pleuroscopy for malignant pleural disease: a single center retrospective analysis. PLoS One. 2016;11:258.",Diagnostic utility of pleural fluid cell block versus pleural biopsy collected by flex-rigid pleuroscopy for malignant pleural disease: a single center retrospective analysis,PLoS One,2016,11,,258,,,Miyoshi S; Sasada S; Izumo T
258,"Davies HE, Nicholson JE, Rahman NM. Outcome of patients with nonspecific pleuritis/fibrosis on thoracoscopic pleural biopsies. Eur J Cardiothorac Surg. 2010;38:259.",Outcome of patients with nonspecific pleuritis/fibrosis on thoracoscopic pleural biopsies,Eur J Cardiothorac Surg,2010,38,,259,,,Davies HE; Nicholson JE; Rahman NM
259,"Gunluoglu G, Olcmen A, Gunluoglu MZ. Long-term outcome of patients with undiagnosed pleural effusion. Arch Bronconeumol. 2015;51:260.",Long-term outcome of patients with undiagnosed pleural effusion,Arch Bronconeumol,2015,51,,260,,,Gunluoglu G; Olcmen A; Gunluoglu MZ
260,"Venekamp LN, Velkeniers B, Noppen M. Does 'idiopathic pleuritis' exist? Natural history of non-specific pleuritis diagnosed after thoracoscopy. Respiration. 2005;72:261.",Does 'idiopathic pleuritis' exist? Natural history of non-specific pleuritis diagnosed after thoracoscopy,Respiration,2005,72,,261,,,Venekamp LN; Velkeniers B; Noppen M
261,"Janssen JP, Ramlal S, Mravunac M. The long-term follow-up of exudative pleural effusion after nondiagnostic thoracoscopy. J Bronchol. 2004;11:262.",The long-term follow-up of exudative pleural effusion after nondiagnostic thoracoscopy,J Bronchol,2004,11,,262,,,Janssen JP; Ramlal S; Mravunac M
262,"Yang Y, Wu YB, Wang Z. Long-term outcome of patients with nonspecific pleurisy at medical thoracoscopy. Respir Med. 2017;124:263.",Long-term outcome of patients with nonspecific pleurisy at medical thoracoscopy,Respir Med,2017,124,,263,,,Yang Y; Wu YB; Wang Z
263,"Siravegna G, Marsoni S, Siena S. Integrating liquid biopsies into the management of cancer. Nat Rev Clin Oncol. 2017;14:264.",Integrating liquid biopsies into the management of cancer,Nat Rev Clin Oncol,2017,14,,264,,,Siravegna G; Marsoni S; Siena S
264,"Cappellesso R, Galasso M, Nicole L. miR-130A as a diagnostic marker to differentiate malignant mesothelioma from lung adenocarcinoma in pleural effusion cytology. Cancer. 2017;125:265.",miR-130A as a diagnostic marker to differentiate malignant mesothelioma from lung adenocarcinoma in pleural effusion cytology,Cancer,2017,125,,265,,,Cappellesso R; Galasso M; Nicole L
265,"Karachaliou N, Mayo-De Las Casas C, Queralt C. Association of EGFR L858R mutation in circulating free DNA with survival in the EURTAC trial. JAMA Oncol. 2015;1:266.",Association of EGFR L858R mutation in circulating free DNA with survival in the EURTAC trial,JAMA Oncol,2015,1,,266,,,Karachaliou N; Mayo-De Las Casas C; Queralt C
266,"Mok T, Wu YL, Lee JS. Detection and dynamic changes of EGFR mutations from circulating tumor DNA as a predictor of survival outcomes in NSCLC patients treated with first-line intercalated erlotinib and chemotherapy. Clin Cancer Res. 2015;21:267.",Detection and dynamic changes of EGFR mutations from circulating tumor DNA as a predictor of survival outcomes in NSCLC patients treated with first-line intercalated erlotinib and chemotherapy,Clin Cancer Res,2015,21,,267,,,Mok T; Wu YL; Lee JS
267,"Oxnard GR, Thress KS, Alden RS. Association between plasma genotyping and outcomes of treatment with osimertinib (AZD9291) in advanced non-small-cell lung cancer. J Clin Oncol. 2016;34:268.",Association between plasma genotyping and outcomes of treatment with osimertinib (AZD9291) in advanced non-small-cell lung cancer,J Clin Oncol,2016,34,,268,,,Oxnard GR; Thress KS; Alden RS
268,"Sacher AG, Paweletz C, Dahlberg SE. Prospective validation of rapid plasma genotyping for the detection of EGFR and KRAS mutations in advanced lung cancer. JAMA Oncol. 2016;2:269.",Prospective validation of rapid plasma genotyping for the detection of EGFR and KRAS mutations in advanced lung cancer,JAMA Oncol,2016,2,,269,,,Sacher AG; Paweletz C; Dahlberg SE
269,"Muraoka T, Soh J, Toyooka S. The degree of microRNA-34b/c methylation in serum-circulating DNA is associated with malignant pleural mesothelioma. Lung Cancer. 2013;82:270.",The degree of microRNA-34b/c methylation in serum-circulating DNA is associated with malignant pleural mesothelioma,Lung Cancer,2013,82,,270,,,Muraoka T; Soh J; Toyooka S
270,"Santarelli L, Staffolani S, Strafella E. Combined circulating epigenetic markers to improve mesothelin performance in the diagnosis of malignant mesothelioma. Lung Cancer. 2015;90:271.",Combined circulating epigenetic markers to improve mesothelin performance in the diagnosis of malignant mesothelioma,Lung Cancer,2015,90,,271,,,Santarelli L; Staffolani S; Strafella E
271,"Kirschner MB, Cheng YY, Badrian B. Increased circulating miR-625-3p: a potential biomarker for patients with malignant pleural mesothelioma. J Thorac Oncol. 2012;7.",Increased circulating miR-625-3p: a potential biomarker for patients with malignant pleural mesothelioma,J Thorac Oncol,2012,7,,,,,Kirschner MB; Cheng YY; Badrian B
