#,ama,title,journal,year,volume,issue,pages,doi,pmid,authors
154,"Yamada N, Oizumi S, Kikuchi E. CD8+ tumor-infiltrating lymphocytes predict favorable prognosis in malignant pleural mesothelioma after resection. Cancer Immunol Immunother. 2010;59:154.",CD8+ tumor-infiltrating lymphocytes predict favorable prognosis in malignant pleural mesothelioma after resection,Cancer Immunol Immunother,2010,59,,154,,,Yamada N; Oizumi S; Kikuchi E
155,"Templeton AJ, Mcnamara MG, Šeruga B. Prognostic role of neutrophil-to-lymphocyte ratio in solid tumors: a systematic review and meta-analysis. J Natl Canc Inst. 2014;106:155.",Prognostic role of neutrophil-to-lymphocyte ratio in solid tumors: a systematic review and meta-analysis,J Natl Canc Inst,2014,106,,155,,,Templeton AJ; Mcnamara MG; Šeruga B
156,"Kao S, Pavlakis N, Harvie R. High blood neutrophil-to-lymphocyte ratio is an indicator of poor prognosis in malignant mesothelioma patients undergoing systemic therapy. Clin Cancer Res. 2010;16:156.",High blood neutrophil-to-lymphocyte ratio is an indicator of poor prognosis in malignant mesothelioma patients undergoing systemic therapy,Clin Cancer Res,2010,16,,156,,,Kao S; Pavlakis N; Harvie R
157,"Clive AO, Kahan BC, Hooper CE. Predicting survival in malignant pleural effusion: development and validation of the LENT prognostic score. Thorax. 2014;69:157.",Predicting survival in malignant pleural effusion: development and validation of the LENT prognostic score,Thorax,2014,69,,157,,,Clive AO; Kahan BC; Hooper CE
158,"Linton A, Pavlakis N, Connell O, R. Factors associated with survival in a large series of patients with malignant pleural mesothelioma in New South Wales. Br J Cancer. 2014;111:158.",Factors associated with survival in a large series of patients with malignant pleural mesothelioma in New South Wales,Br J Cancer,2014,111,,158,,,Linton A; Pavlakis N; Connell O; R
159,"Suzuki K, Kadota K, Sima CS. Chronic inflammation in tumor stroma is an independent predictor of prolonged survival in epithelioid malignant pleural mesothelioma patients. Cancer Immunol Immunother. 2011;60:159.",Chronic inflammation in tumor stroma is an independent predictor of prolonged survival in epithelioid malignant pleural mesothelioma patients,Cancer Immunol Immunother,2011,60,,159,,,Suzuki K; Kadota K; Sima CS
160,"Hooper CE, Lyburn ID, Searle J. The South West Area Mesothelioma and Pemetrexed trial: a multicentre prospective observational study evaluating novel markers of chemotherapy response and prognostication. Br J Cancer. 2015;112:160.",The South West Area Mesothelioma and Pemetrexed trial: a multicentre prospective observational study evaluating novel markers of chemotherapy response and prognostication,Br J Cancer,2015,112,,160,,,Hooper CE; Lyburn ID; Searle J
161,"Lee YS, Nam HS, Lim JH. Prognostic impact of a new score using neutrophil-to-lymphocyte ratios in the serum and malignant pleural effusion in lung cancer patients. BMC Cancer. 2017;17:161.",Prognostic impact of a new score using neutrophil-to-lymphocyte ratios in the serum and malignant pleural effusion in lung cancer patients,BMC Cancer,2017,17,,161,,,Lee YS; Nam HS; Lim JH
162,"Yao ZH, Tian GY, Yang SX. Serum albumin as a significant prognostic factor in patients with malignant pleural mesothelioma. Tumour Biol. 2014;35:162.",Serum albumin as a significant prognostic factor in patients with malignant pleural mesothelioma,Tumour Biol,2014,35,,162,,,Yao ZH; Tian GY; Yang SX
163,"Yamagishi T, Fujimoto N, Nishi H. Prognostic significance of the lymphocyte-to-monocyte ratio in patients with malignant pleural mesothelioma. Lung Cancer. 2015;90:163.",Prognostic significance of the lymphocyte-to-monocyte ratio in patients with malignant pleural mesothelioma,Lung Cancer,2015,90,,163,,,Yamagishi T; Fujimoto N; Nishi H
164,"Yao ZH, Tian GY, Wan YY. Prognostic nutritional index predicts outcomes of malignant pleural mesothelioma. J Cancer Res Clin Oncol. 2013;139:164.",Prognostic nutritional index predicts outcomes of malignant pleural mesothelioma,J Cancer Res Clin Oncol,2013,139,,164,,,Yao ZH; Tian GY; Wan YY
165,"Borasio P, Berruti A, Bille A. Malignant pleural mesothelioma: clinicopathologic and survival characteristics in a consecutive series of 394 patients. Eur J Cardiothorac Surg. 2008;33:165.",Malignant pleural mesothelioma: clinicopathologic and survival characteristics in a consecutive series of 394 patients,Eur J Cardiothorac Surg,2008,33,,165,,,Borasio P; Berruti A; Bille A
166,"Christensen BC, Godleski JJ, Roelofs CR. Asbestos burden predicts survival in pleural mesothelioma. Environ Health Perspect. 2008;116:166.",Asbestos burden predicts survival in pleural mesothelioma,Environ Health Perspect,2008,116,,166,,,Christensen BC; Godleski JJ; Roelofs CR
167,"Wolf AS, Richards WG, Tilleman TR. Characteristics of malignant pleural mesothelioma in women. Ann Thorac Surg. 2010;90:167.",Characteristics of malignant pleural mesothelioma in women,Ann Thorac Surg,2010,90,,167,,,Wolf AS; Richards WG; Tilleman TR
168,"Vigneswaran WT, Kircheva DY, Ananthanarayanan V. Amount of epithelioid differentiation is a predictor of survival in malignant pleural mesothelioma. Ann Thorac Surg. 2017;103:168.",Amount of epithelioid differentiation is a predictor of survival in malignant pleural mesothelioma,Ann Thorac Surg,2017,103,,168,,,Vigneswaran WT; Kircheva DY; Ananthanarayanan V
169,"Baud M, Strano S, Dechartres A. Outcome and prognostic factors of pleural mesothelioma after surgical diagnosis and/or pleurodesis. J Thorac Cardiovasc Surg. 2013;145:169.",Outcome and prognostic factors of pleural mesothelioma after surgical diagnosis and/or pleurodesis,J Thorac Cardiovasc Surg,2013,145,,169,,,Baud M; Strano S; Dechartres A
170,"Curran D, Sahmoud T, Therasse P. Prognostic factors in patients with pleural mesothelioma: the European Organization for Research and Treatment of Cancer experience. J Clin Oncol. 1998;16:170.",Prognostic factors in patients with pleural mesothelioma: the European Organization for Research and Treatment of Cancer experience,J Clin Oncol,1998,16,,170,,,Curran D; Sahmoud T; Therasse P
171,"Francart J, Vaes E, Henrard S. A prognostic index for progression-free survival in malignant mesothelioma with application to the design of phase II trials: a combined analysis of 10 EORTC trials. Eur J Cancer. 2009;45:171.",A prognostic index for progression-free survival in malignant mesothelioma with application to the design of phase II trials: a combined analysis of 10 EORTC trials,Eur J Cancer,2009,45,,171,,,Francart J; Vaes E; Henrard S
172,"Kataoka Y, Yamamoto Y, Otsuki T. External validation of prognostic indices for overall survival of malignant pleural mesothelioma. Lung Cancer. None;113:172.",External validation of prognostic indices for overall survival of malignant pleural mesothelioma,Lung Cancer,,113,,172,,,Kataoka Y; Yamamoto Y; Otsuki T
173,"Bille A, Krug LM, Woo KM. Contemporary analysis of prognostic factors in patients with unresectable malignant pleural mesothelioma. J Thorac Oncol. 2016;11:173.",Contemporary analysis of prognostic factors in patients with unresectable malignant pleural mesothelioma,J Thorac Oncol,2016,11,,173,,,Bille A; Krug LM; Woo KM
174,"Flores RM, Zakowski M, Venkatraman E. Prognostic factors in the treatment of malignant pleural mesothelioma at a large tertiary referral center. J Thorac Oncol. 2007;2:174.",Prognostic factors in the treatment of malignant pleural mesothelioma at a large tertiary referral center,J Thorac Oncol,2007,2,,174,,,Flores RM; Zakowski M; Venkatraman E
175,"Jennings CJ, Walsh PM, Deady S. Malignant pleural mesothelioma incidence and survival in the Republic of Ireland 1994-2009. Cancer Epidemiol. 2014;38:175.",Malignant pleural mesothelioma incidence and survival in the Republic of Ireland 1994-2009,Cancer Epidemiol,2014,38,,175,,,Jennings CJ; Walsh PM; Deady S
176,"Montanaro F, Rosato R, Gangemi M. Survival of pleural malignant mesothelioma in Italy: a population-based study. Int J Cancer. 2009;124:176.",Survival of pleural malignant mesothelioma in Italy: a population-based study,Int J Cancer,2009,124,,176,,,Montanaro F; Rosato R; Gangemi M
177,"Taioli E, Wolf AS, Camacho-Rivera M. Determinants of survival in malignant pleural mesothelioma: a surveillance, epidemiology, and end results (SEER) study of 14,228 patients. PLoS One. 2015;10.","Determinants of survival in malignant pleural mesothelioma: a surveillance, epidemiology, and end results (SEER) study of 14,228 patients",PLoS One,2015,10,,,,,Taioli E; Wolf AS; Camacho-Rivera M
178,"Rena O, Boldorini R, Papalia E. Persistent lung expansion after pleural talc poudrage in non-surgically resected malignant pleural mesothelioma. Ann Thorac Surg. 2015;99:178.",Persistent lung expansion after pleural talc poudrage in non-surgically resected malignant pleural mesothelioma,Ann Thorac Surg,2015,99,,178,,,Rena O; Boldorini R; Papalia E
179,"Adel AM, Hafeez A, ZM, Sheikh E, ET. Malignant pleural mesothelioma: a retrospective analysis of clinicopathological and survival data. Thorac Cancer. 2011;2:179.",Malignant pleural mesothelioma: a retrospective analysis of clinicopathological and survival data,Thorac Cancer,2011,2,,179,,,Adel AM; Hafeez A; ZM; Sheikh E; ET
180,"Rahouma M, Aziz H, Ghaly G. Survival in good performance malignant pleural mesothelioma patients; prognostic factors and predictors of response. Asian Pac J Cancer Prev. 2017;18:180.",Survival in good performance malignant pleural mesothelioma patients; prognostic factors and predictors of response,Asian Pac J Cancer Prev,2017,18,,180,,,Rahouma M; Aziz H; Ghaly G
181,"Wang S, Ma K, Wang Q. The revised staging system for malignant pleural mesothelioma based on surveillance, epidemiology, and end results database. Int J Surg. 2017;48:181.","The revised staging system for malignant pleural mesothelioma based on surveillance, epidemiology, and end results database",Int J Surg,2017,48,,181,,,Wang S; Ma K; Wang Q
182,"Zhang A, Cao S, JS. Elevated aspartate aminotransferase and monocyte counts predict unfavorable prognosis in patients with malignant pleural mesothelioma. Neoplasma. 2017;64:182.",Elevated aspartate aminotransferase and monocyte counts predict unfavorable prognosis in patients with malignant pleural mesothelioma,Neoplasma,2017,64,,182,,,Zhang A; Cao S; JS
183,"Kataoka Y, Yamamoto Y, Otsuki T. A new prognostic index for overall survival in malignant pleural mesothelioma: the rPHS (regimen, PS, histology or stage) index. Jpn J Clin Oncol. 2015;45:183.","A new prognostic index for overall survival in malignant pleural mesothelioma: the rPHS (regimen, PS, histology or stage) index",Jpn J Clin Oncol,2015,45,,183,,,Kataoka Y; Yamamoto Y; Otsuki T
184,"Herndon JE, Green MR, Chahinian AP. Factors predictive of survival among 337 patients with mesothelioma treated between 1984 and 1994 by the Cancer and Leukemia Group B. Chest. 1998;113:184.",Factors predictive of survival among 337 patients with mesothelioma treated between 1984 and 1994 by the Cancer and Leukemia Group B,Chest,1998,113,,184,,,Herndon JE; Green MR; Chahinian AP
185,"Bottomley A, Coens C, Efficace F. Symptoms and patient-reported well-being: do they predict survival in malignant pleural mesothelioma? A prognostic factor analysis of EORTC-NCIC 08983: randomized phase III study of cisplatin with or without raltitrexed in patients with malignant pleural mesothelioma. J Clin Oncol. 2007;25:185.",Symptoms and patient-reported well-being: do they predict survival in malignant pleural mesothelioma? A prognostic factor analysis of EORTC-NCIC 08983: randomized phase III study of cisplatin with or without raltitrexed in patients with malignant pleural mesothelioma,J Clin Oncol,2007,25,,185,,,Bottomley A; Coens C; Efficace F
186,"Creaney J, Francis RJ, Dick IM. Serum soluble mesothelin concentrations in malignant pleural mesothelioma: relationship to tumor volume, clinical stage and changes in tumor burden. Clin Cancer Res. 2011;17:186.","Serum soluble mesothelin concentrations in malignant pleural mesothelioma: relationship to tumor volume, clinical stage and changes in tumor burden",Clin Cancer Res,2011,17,,186,,,Creaney J; Francis RJ; Dick IM
187,"Arnold DT, Fonseka D, Hamilton D, FW. Prognostication and monitoring of mesothelioma using biomarkers: a systematic review. Br J Cancer. 2017;116:187.",Prognostication and monitoring of mesothelioma using biomarkers: a systematic review,Br J Cancer,2017,116,,187,,,Arnold DT; Fonseka D; Hamilton D; FW
188,"Hollevoet K, Nackaerts K, Gosselin R. Soluble mesothelin, megakaryocyte potentiating factor, and osteopontin as markers of patient response and outcome in mesothelioma. J Thorac Oncol. 2011;6:188.","Soluble mesothelin, megakaryocyte potentiating factor, and osteopontin as markers of patient response and outcome in mesothelioma",J Thorac Oncol,2011,6,,188,,,Hollevoet K; Nackaerts K; Gosselin R
189,"Fennell DA, Parmar A, Shamash J. Statistical validation of the EORTC prognostic model for malignant pleural mesothelioma based on three consecutive phase II trials. J Clin Oncol. 2005;23:189.",Statistical validation of the EORTC prognostic model for malignant pleural mesothelioma based on three consecutive phase II trials,J Clin Oncol,2005,23,,189,,,Fennell DA; Parmar A; Shamash J
190,"Sandri A, Guerrera F, Roffinella M. Validation of EORTC and CALGB prognostic models in surgical patients submitted to diagnostic, palliative or curative surgery for malignant pleural mesothelioma. J Thorac Dis. 2016;8:190.","Validation of EORTC and CALGB prognostic models in surgical patients submitted to diagnostic, palliative or curative surgery for malignant pleural mesothelioma",J Thorac Dis,2016,8,,190,,,Sandri A; Guerrera F; Roffinella M
191,"Meniawy TM, Creaney J, Lake RA. Existing models, but not neutrophil-to-lymphocyte ratio, are prognostic in malignant mesothelioma. Br J Cancer. 2013;109:191.","Existing models, but not neutrophil-to-lymphocyte ratio, are prognostic in malignant mesothelioma",Br J Cancer,2013,109,,191,,,Meniawy TM; Creaney J; Lake RA
192,"Wang S, Ma K, Chen Z. A nomogram to predict prognosis in malignant pleural mesothelioma. World J Surg. 2017;42:192.",A nomogram to predict prognosis in malignant pleural mesothelioma,World J Surg,2017,42,,192,,,Wang S; Ma K; Chen Z
193,"Brims FJ, Meniawy TM, Duffus I. A novel clinical prediction model for prognosis in malignant pleural mesothelioma using decision tree analysis. J Thorac Oncol. 2016;11:193.",A novel clinical prediction model for prognosis in malignant pleural mesothelioma using decision tree analysis,J Thorac Oncol,2016,11,,193,,,Brims FJ; Meniawy TM; Duffus I
194,"Niho S, Kubota K, Yoh K. Clinical outcome of chemoradiation therapy in patients with limited-disease small cell lung cancer with ipsilateral pleural effusion. J Thorac Oncol. 2008;3:194.",Clinical outcome of chemoradiation therapy in patients with limited-disease small cell lung cancer with ipsilateral pleural effusion,J Thorac Oncol,2008,3,,194,,,Niho S; Kubota K; Yoh K
195,"Herrstedt J, Clementsen P, Hansen OP. Increased myelosuppression during cytostatic treatment and pleural effusion in patients with small cell lung cancer. Eur J Cancer. 1992;28:196.",Increased myelosuppression during cytostatic treatment and pleural effusion in patients with small cell lung cancer,Eur J Cancer,1992,28,,196,,,Herrstedt J; Clementsen P; Hansen OP
196,"Adiguzel C, Bozkurt SU, Kaygusuz I. Human herpes virus 8-unrelated primary effusion lymphoma-like lymphoma: report of a rare case and review of the literature. APMIS. 2009;117:197.",Human herpes virus 8-unrelated primary effusion lymphoma-like lymphoma: report of a rare case and review of the literature,APMIS,2009,117,,197,,,Adiguzel C; Bozkurt SU; Kaygusuz I
197,"Waddington TW, Aboulafia DM. Failure to eradicate AIDS-associated primary effusion lymphoma with high-dose chemotherapy and autologous stem cell reinfusion: case report and literature review. AIDS Patient Care STDS. 2004;18:198.",Failure to eradicate AIDS-associated primary effusion lymphoma with high-dose chemotherapy and autologous stem cell reinfusion: case report and literature review,AIDS Patient Care STDS,2004,18,,198,,,Waddington TW; Aboulafia DM
198,"Dabaja BS, Ha CS, Thomas DA. The role of local radiation therapy for mediastinal disease in adults with T-cell lymphoblastic lymphoma. Cancer. 2002;94:199.",The role of local radiation therapy for mediastinal disease in adults with T-cell lymphoblastic lymphoma,Cancer,2002,94,,199,,,Dabaja BS; Ha CS; Thomas DA
199,"Fujita A, Takabatake H, Tagaki S. Combination chemotherapy in patients with malignant pleural effusions from non-small cell lung cancer: cisplatin, ifosfamide, and irinotecan with recombinant human granulocyte colony-stimulating factor support. Chest. 2001;119:200.","Combination chemotherapy in patients with malignant pleural effusions from non-small cell lung cancer: cisplatin, ifosfamide, and irinotecan with recombinant human granulocyte colony-stimulating factor support",Chest,2001,119,,200,,,Fujita A; Takabatake H; Tagaki S
200,"Kitamura K, Kubota K, Ando M. Bevacizumab plus chemotherapy for advanced non-squamous non-small-cell lung cancer with malignant pleural effusion. Cancer Chemother Pharmacol. 2013;71:201.",Bevacizumab plus chemotherapy for advanced non-squamous non-small-cell lung cancer with malignant pleural effusion,Cancer Chemother Pharmacol,2013,71,,201,,,Kitamura K; Kubota K; Ando M
201,"Masago K, Fujimoto D, Fujita S. Response to bevacizumab combination chemotherapy of malignant pleural effusions associated with non-squamous non-small-cell lung cancer. Mol Clin Oncol. 2015;3:202.",Response to bevacizumab combination chemotherapy of malignant pleural effusions associated with non-squamous non-small-cell lung cancer,Mol Clin Oncol,2015,3,,202,,,Masago K; Fujimoto D; Fujita S
202,"Huang Z, Yan H, Chavan D. Effective treatment of a patient with stage IV ovarian cancer: a case report. Oncol Lett. 2018;15:203.",Effective treatment of a patient with stage IV ovarian cancer: a case report,Oncol Lett,2018,15,,203,,,Huang Z; Yan H; Chavan D
203,"Lin JB, Lai FC, Li X. Sequential treatment strategy for malignant pleural effusion in non-small cell lung cancer with the activated epithelial grow factor receptor mutation. J Drug Target. 2017;25:204.",Sequential treatment strategy for malignant pleural effusion in non-small cell lung cancer with the activated epithelial grow factor receptor mutation,J Drug Target,2017,25,,204,,,Lin JB; Lai FC; Li X
204,"Jiang T, Li A, Su C. Addition of bevacizumab for malignant pleural effusion as the manifestation of acquired EGFR-TKI resistance in NSCLC patients. Oncotarget. 2017;8:205.",Addition of bevacizumab for malignant pleural effusion as the manifestation of acquired EGFR-TKI resistance in NSCLC patients,Oncotarget,2017,8,,205,,,Jiang T; Li A; Su C
205,"Mori R, Fujimoto D, Ito M. Bevacizumab for ramucirumab refractory malignant pleural effusion in non-small cell lung cancer: a case report and review of the literature. Oncotarget. 2017;8:206.",Bevacizumab for ramucirumab refractory malignant pleural effusion in non-small cell lung cancer: a case report and review of the literature,Oncotarget,2017,8,,206,,,Mori R; Fujimoto D; Ito M
206,"Sebastian M, Kiewe P, Schuette W. Treatment of malignant pleural effusion with the trifunctional antibody catumaxomab (removab) (anti-EpCAMxanti-CD3): results of a phase 1/2 study. J Immunother. 2009;32:207.",Treatment of malignant pleural effusion with the trifunctional antibody catumaxomab (removab) (anti-EpCAMxanti-CD3): results of a phase 1/2 study,J Immunother,2009,32,,207,,,Sebastian M; Kiewe P; Schuette W
207,"Shen J, Zhu Z. Catumaxomab, a rat/murine hybrid trifunctional bispecific monoclonal antibody for the treatment of cancer. Curr Opin Mol Ther. 2008;10:208.","Catumaxomab, a rat/murine hybrid trifunctional bispecific monoclonal antibody for the treatment of cancer",Curr Opin Mol Ther,2008,10,,208,,,Shen J; Zhu Z
208,"Qi N, Li F, Li X. Combination use of paclitaxel and avastin enhances treatment effect for the NSCLC patients with malignant pleural effusion. Medicine. 2016;95:209.",Combination use of paclitaxel and avastin enhances treatment effect for the NSCLC patients with malignant pleural effusion,Medicine,2016,95,,209,,,Qi N; Li F; Li X
209,"Du N, Li X, Li F. Intrapleural combination therapy with bevacizumab and cisplatin for non-small cell lung cancer-mediated malignant pleural effusion. Oncol Rep. 2013;29:210.",Intrapleural combination therapy with bevacizumab and cisplatin for non-small cell lung cancer-mediated malignant pleural effusion,Oncol Rep,2013,29,,210,,,Du N; Li X; Li F
210,"Tamiya M, Tamiya A, Yamadori T. Phase2 study of bevacizumab with carboplatin-paclitaxel for non-small cell lung cancer with malignant pleural effusion. Med Oncol. 2013;30:211.",Phase2 study of bevacizumab with carboplatin-paclitaxel for non-small cell lung cancer with malignant pleural effusion,Med Oncol,2013,30,,211,,,Tamiya M; Tamiya A; Yamadori T
211,"Salyer WR, Eggleston JC, Erozan YS. Efficacy of pleural needle biopsy and pleural fluid cytopathology in the diagnosis of malignant neoplasm involving the pleura. Chest. 1975;67:212.",Efficacy of pleural needle biopsy and pleural fluid cytopathology in the diagnosis of malignant neoplasm involving the pleura,Chest,1975,67,,212,,,Salyer WR; Eggleston JC; Erozan YS
212,"Nance KV, Shermer RW, Askin FB. Diagnostic efficacy of pleural biopsy as compared with that of pleural fluid examination. Mod Pathol. 1991;4:213.",Diagnostic efficacy of pleural biopsy as compared with that of pleural fluid examination,Mod Pathol,1991,4,,213,,,Nance KV; Shermer RW; Askin FB
213,"Prakash UB, Reiman HM. Comparison of needle biopsy with cytologic analysis for the evaluation of pleural effusion: analysis of 414 cases. Mayo Clin Proc. 1985;60:214.",Comparison of needle biopsy with cytologic analysis for the evaluation of pleural effusion: analysis of 414 cases,Mayo Clin Proc,1985,60,,214,,,Prakash UB; Reiman HM
214,"Froudarakis ME, Plojoux J, Kaspi E. Positive pleural cytology is an indicator for visceral pleural invasion in metastatic pleural effusions. Clin Respir J. 2018;12:215.",Positive pleural cytology is an indicator for visceral pleural invasion in metastatic pleural effusions,Clin Respir J,2018,12,,215,,,Froudarakis ME; Plojoux J; Kaspi E
215,"Renshaw AA, Dean BR, Antman KH. The role of cytologic evaluation of pleural fluid in the diagnosis of malignant mesothelioma. Chest. 1997;111:216.",The role of cytologic evaluation of pleural fluid in the diagnosis of malignant mesothelioma,Chest,1997,111,,216,,,Renshaw AA; Dean BR; Antman KH
216,"Hooper C, Lee YC, Maskell N. BTS Pleural Guideline Group. Investigation of a unilateral pleural effusion in adults: British Thoracic Society Pleural Disease Guideline 2010. Thorax. 2010;65.",BTS Pleural Guideline Group. Investigation of a unilateral pleural effusion in adults: British Thoracic Society Pleural Disease Guideline 2010,Thorax,2010,65,,,,,Hooper C; Lee YC; Maskell N
217,"Henderson DW, Reid G, Kao SC. Challenges and controversies in the diagnosis of mesothelioma: part 1. Cytology-only diagnosis, biopsies, immunohistochemistry, discrimination between mesothelioma and reactive mesothelial hyperplasia, and biomarkers. J Clin Pathol. 2013;66:218.","Challenges and controversies in the diagnosis of mesothelioma: part 1. Cytology-only diagnosis, biopsies, immunohistochemistry, discrimination between mesothelioma and reactive mesothelial hyperplasia, and biomarkers",J Clin Pathol,2013,66,,218,,,Henderson DW; Reid G; Kao SC
218,"Segal A, Sterrett GF, Frost FA. A diagnosis of malignant pleural mesothelioma can be made by effusion cytology: results of a 20 year audit. Pathology. 2013;45:219.",A diagnosis of malignant pleural mesothelioma can be made by effusion cytology: results of a 20 year audit,Pathology,2013,45,,219,,,Segal A; Sterrett GF; Frost FA
219,"Rossi ED, Bizzarro T, Schmitt F. The role of liquid-based cytology and ancillary techniques in pleural and pericardic effusions: an institutional experience. Cancer Cytopathol. 2015;123:220.",The role of liquid-based cytology and ancillary techniques in pleural and pericardic effusions: an institutional experience,Cancer Cytopathol,2015,123,,220,,,Rossi ED; Bizzarro T; Schmitt F
220,"Rivera MP, Mehta AC, Wahidi MM. Establishing the diagnosis of lung cancer: diagnosis and management of lung cancer, 3rd ed: American College of Chest Physicians evidence-based clinical practice guidelines. Chest. 2013;143(5):221.","Establishing the diagnosis of lung cancer: diagnosis and management of lung cancer, 3rd ed: American College of Chest Physicians evidence-based clinical practice guidelines",Chest,2013,143,5,221,,,Rivera MP; Mehta AC; Wahidi MM
221,"Garcia LW, Ducatman BS, Wang HH. The value of multiple fluid specimens in the cytological diagnosis of malignancy. Mod Pathol. 1994;7:222.",The value of multiple fluid specimens in the cytological diagnosis of malignancy,Mod Pathol,1994,7,,222,,,Garcia LW; Ducatman BS; Wang HH
222,"Rakha EA, Patil S, Abdulla K. The sensitivity of cytologic evaluation of pleural fluid in the diagnosis of malignant mesothelioma. Diagn Cytopathol. 2010;38:223.",The sensitivity of cytologic evaluation of pleural fluid in the diagnosis of malignant mesothelioma,Diagn Cytopathol,2010,38,,223,,,Rakha EA; Patil S; Abdulla K
223,"Pinelli V, Laroumagne S, Sakr L. Pleural fluid cytological yield and visceral pleural invasion in patients with epithelioid malignant pleural mesothelioma. J Thorac Oncol. 2012;7:224.",Pleural fluid cytological yield and visceral pleural invasion in patients with epithelioid malignant pleural mesothelioma,J Thorac Oncol,2012,7,,224,,,Pinelli V; Laroumagne S; Sakr L
