#,ama,title,journal,year,volume,issue,pages,doi,pmid,authors
172,"Rano A, Agusti C, Jimenez P. Pulmonary infiltrates in non-HIV immunocompromised patients: a diagnostic approach using non-invasive and bronchoscopic procedures. Thorax. 2001;56:173.",Pulmonary infiltrates in non-HIV immunocompromised patients: a diagnostic approach using non-invasive and bronchoscopic procedures,Thorax,2001,56,,173,,,Rano A; Agusti C; Jimenez P
173,"Jensen BN, Gerstoft J, Hojlyng N. Pulmonary pathogens in HIV-infected patients. Scand J Infect Dis. 1990;22:174.",Pulmonary pathogens in HIV-infected patients,Scand J Infect Dis,1990,22,,174,,,Jensen BN; Gerstoft J; Hojlyng N
174,"Golden JA, Hollander H, Stulbarg MS. Bronchoalveolar lavage as the exclusive diagnostic modality for Pneumocystis carinii pneumonia. A prospective study among patients with acquired immunodeficiency syndrome. Chest. 1986;90:175.",Bronchoalveolar lavage as the exclusive diagnostic modality for Pneumocystis carinii pneumonia. A prospective study among patients with acquired immunodeficiency syndrome,Chest,1986,90,,175,,,Golden JA; Hollander H; Stulbarg MS
175,"Heurlin N, Lidman EK, C. Fiberoptic bronchoscopy and sputum examination for diagnosis of pulmonary disease in AIDS patients in Stockholm. Scand J Infect Dis. 1990;22:176.",Fiberoptic bronchoscopy and sputum examination for diagnosis of pulmonary disease in AIDS patients in Stockholm,Scand J Infect Dis,1990,22,,176,,,Heurlin N; Lidman EK; C
176,"Orenstein M, Webber CA, Cash M. Value of bronchoalveolar lavage in the diagnosis of pulmonary infection in acquired immune deficiency syndrome. Thorax. 1986;41:177.",Value of bronchoalveolar lavage in the diagnosis of pulmonary infection in acquired immune deficiency syndrome,Thorax,1986,41,,177,,,Orenstein M; Webber CA; Cash M
177,"Chuang MT, Rosen MJ, Teirstein AS. Flexible bronchoscopy in the diagnosis of Pneumocystis carinii pneumonia in patients with acquired immune deficiency syndrome. South Med J. 1986;79:178.",Flexible bronchoscopy in the diagnosis of Pneumocystis carinii pneumonia in patients with acquired immune deficiency syndrome,South Med J,1986,79,,178,,,Chuang MT; Rosen MJ; Teirstein AS
178,"Gracia JD, Miravitlles M, Mayordomo C. Empiric treatments impair the diagnostic yield of BAL in HIV-positive patients. Chest. 1997;111:179.",Empiric treatments impair the diagnostic yield of BAL in HIV-positive patients,Chest,1997,111,,179,,,Gracia JD; Miravitlles M; Mayordomo C
179,"Meduri GU, Stover DE, Greeno RA. Bilateral bronchoalveolar lavage in the diagnosis of opportunistic pulmonary infections. Chest. 1991;100:180.",Bilateral bronchoalveolar lavage in the diagnosis of opportunistic pulmonary infections,Chest,1991,100,,180,,,Meduri GU; Stover DE; Greeno RA
180,"Baughman RP, Dohn MN, Shipley R. Increased Pneumocystis carinii recovery from the upper lobes in Pneumocystis pneumonia. The effect of aerosol pentamidine prophylaxis. Chest. 1993;103:181.",Increased Pneumocystis carinii recovery from the upper lobes in Pneumocystis pneumonia. The effect of aerosol pentamidine prophylaxis,Chest,1993,103,,181,,,Baughman RP; Dohn MN; Shipley R
181,"Read CA, Cerrone F, Busseniers AE. Differential lobe lavage for diagnosis of acute Pneumocystis carinii pneumonia in patients receiving prophylactic aerosolized pentamidine therapy. Chest. 1993;103:182.",Differential lobe lavage for diagnosis of acute Pneumocystis carinii pneumonia in patients receiving prophylactic aerosolized pentamidine therapy,Chest,1993,103,,182,,,Read CA; Cerrone F; Busseniers AE
182,"Salzman SH, Schindel ML, Aranda CP. The role of bronchoscopy in the diagnosis of pulmonary tuberculosis in patients at risk for HIV infection. Chest. 1992;102:183.",The role of bronchoscopy in the diagnosis of pulmonary tuberculosis in patients at risk for HIV infection,Chest,1992,102,,183,,,Salzman SH; Schindel ML; Aranda CP
183,"Kennedy DJ, Lewis WP, Barnes PF. Yield of bronchoscopy for the diagnosis of tuberculosis in patients with human immunodeficiency virus infection. Chest. 1992;102:184.",Yield of bronchoscopy for the diagnosis of tuberculosis in patients with human immunodeficiency virus infection,Chest,1992,102,,184,,,Kennedy DJ; Lewis WP; Barnes PF
184,"Miro AM, Gibilara E, Powell S. The role of fiberoptic bronchoscopy for diagnosis of pulmonary tuberculosis in patients at risk for AIDS. Chest. 1992;101:185.",The role of fiberoptic bronchoscopy for diagnosis of pulmonary tuberculosis in patients at risk for AIDS,Chest,1992,101,,185,,,Miro AM; Gibilara E; Powell S
185,"Kibiki GS, Mulder B, Van Der Ven AJ. Laboratory diagnosis of pulmonary tuberculosis in TB and HIV endemic settings and the contribution of real time PCR for M. tuberculosis in bronchoalveolar lavage fluid. Trop Med Int Health. 2007;12:186.",Laboratory diagnosis of pulmonary tuberculosis in TB and HIV endemic settings and the contribution of real time PCR for M. tuberculosis in bronchoalveolar lavage fluid,Trop Med Int Health,2007,12,,186,,,Kibiki GS; Mulder B; Van Der Ven AJ
186,"Baughman RP, Dohn MN, Loudon RG. Bronchoscopy with bronchoalveolar lavage in tuberculosis and fungal infections. Chest. 1991;99:187.",Bronchoscopy with bronchoalveolar lavage in tuberculosis and fungal infections,Chest,1991,99,,187,,,Baughman RP; Dohn MN; Loudon RG
187,"Levy H, Horak DA, Tegtmeier BR. The value of bronchoalveolar lavage and bronchial washings in the diagnosis of invasive pulmonary aspergillosis. Respir Med. 1992;86:188.",The value of bronchoalveolar lavage and bronchial washings in the diagnosis of invasive pulmonary aspergillosis,Respir Med,1992,86,,188,,,Levy H; Horak DA; Tegtmeier BR
188,"Kahn FW, Jones JM, England DM. The role of bronchoalveolar lavage in the diagnosis of invasive pulmonary aspergillosis. Am J Clin Pathol. 1986;86:189.",The role of bronchoalveolar lavage in the diagnosis of invasive pulmonary aspergillosis,Am J Clin Pathol,1986,86,,189,,,Kahn FW; Jones JM; England DM
189,"Guo YL, Chen YQ, Wang K. Accuracy of BAL galactomannan in diagnosing invasive aspergillosis: a bivariate metaanalysis and systematic review. Chest. 2010;138:190.",Accuracy of BAL galactomannan in diagnosing invasive aspergillosis: a bivariate metaanalysis and systematic review,Chest,2010,138,,190,,,Guo YL; Chen YQ; Wang K
190,"Meersseman W, Lagrou K, Maertens J. Galactomannan in bronchoalveolar lavage fluid: a tool for diagnosing aspergillosis in intensive care unit patients. Am J Respir Crit Care Med. 2008;177:191.",Galactomannan in bronchoalveolar lavage fluid: a tool for diagnosing aspergillosis in intensive care unit patients,Am J Respir Crit Care Med,2008,177,,191,,,Meersseman W; Lagrou K; Maertens J
191,"Mattei D, Rapezzi D, Mordini N. False-positive Aspergillus galactomannan enzyme-linked immunosorbent assay results in vivo during amoxicillin-clavulanic acid treatment. J Clin Microbiol. 2004;42:192.",False-positive Aspergillus galactomannan enzyme-linked immunosorbent assay results in vivo during amoxicillin-clavulanic acid treatment,J Clin Microbiol,2004,42,,192,,,Mattei D; Rapezzi D; Mordini N
192,"Adam O, Auperin A, Wilquin F. Treatment with piperacillin-tazobactam and false-positive Aspergillus galactomannan antigen test results for patients with hematological malignancies. Clin Infect Dis. 2004;38:193.",Treatment with piperacillin-tazobactam and false-positive Aspergillus galactomannan antigen test results for patients with hematological malignancies,Clin Infect Dis,2004,38,,193,,,Adam O; Auperin A; Wilquin F
193,"Viscoli C, Machetti M, Cappellano P. False-positive galactomannan platelia Aspergillus test results for patients receiving piperacillin-tazobactam. Clin Infect Dis. 2004;38:194.",False-positive galactomannan platelia Aspergillus test results for patients receiving piperacillin-tazobactam,Clin Infect Dis,2004,38,,194,,,Viscoli C; Machetti M; Cappellano P
194,"Aubry A, Porcher R, Bottero J. Occurrence and kinetics of false-positive Aspergillus galactomannan test results following treatment with beta-lactam antibiotics in patients with hematological disorders. J Clin Microbiol. 2006;44:195.",Occurrence and kinetics of false-positive Aspergillus galactomannan test results following treatment with beta-lactam antibiotics in patients with hematological disorders,J Clin Microbiol,2006,44,,195,,,Aubry A; Porcher R; Bottero J
195,"Luong ML, Clancy CJ, Vadnerkar A. Comparison of an Aspergillus real-time polymerase chain reaction assay with galactomannan testing of bronchoalvelolar lavage fluid for the diagnosis of invasive pulmonary aspergillosis in lung transplant recipients. Clin Infect Dis. None;52:196.",Comparison of an Aspergillus real-time polymerase chain reaction assay with galactomannan testing of bronchoalvelolar lavage fluid for the diagnosis of invasive pulmonary aspergillosis in lung transplant recipients,Clin Infect Dis,,52,,196,,,Luong ML; Clancy CJ; Vadnerkar A
196,"Musher B, Fredricks D, Leisenring W. Aspergillus galactomannan enzyme immunoassay and quantitative PCR for diagnosis of invasive aspergillosis with bronchoalveolar lavage fluid. J Clin Microbiol. 2004;42:197.",Aspergillus galactomannan enzyme immunoassay and quantitative PCR for diagnosis of invasive aspergillosis with bronchoalveolar lavage fluid,J Clin Microbiol,2004,42,,197,,,Musher B; Fredricks D; Leisenring W
197,"Lewin SR, Hoy J, Crowe SM. The role of bronchoscopy in the diagnosis and treatment of pulmonary disease in HIV-infected patients. Aust N Z J Med. 1995;25:198.",The role of bronchoscopy in the diagnosis and treatment of pulmonary disease in HIV-infected patients,Aust N Z J Med,1995,25,,198,,,Lewin SR; Hoy J; Crowe SM
198,"Malabonga VM, Basti J, Kamholz SL. Utility of bronchoscopic sampling techniques for cryptococcal disease in AIDS. Chest. 1991;99:199.",Utility of bronchoscopic sampling techniques for cryptococcal disease in AIDS,Chest,1991,99,,199,,,Malabonga VM; Basti J; Kamholz SL
199,"Dugan JM, Avitabile AM, Rossman MD. Diagnosis of Pneumocystis carinii pneumonia by cytologic evaluation of Papanicolaou-stained bronchial specimens. Diagn Cytopathol. 1988;4:200.",Diagnosis of Pneumocystis carinii pneumonia by cytologic evaluation of Papanicolaou-stained bronchial specimens,Diagn Cytopathol,1988,4,,200,,,Dugan JM; Avitabile AM; Rossman MD
200,"Hartman B, Koss M, Hui A. Pneumocystis carinii pneumonia in the acquired immunodeficiency syndrome (AIDS). Diagnosis with bronchial brushings, biopsy, and bronchoalveolar lavage. Chest. 1985;87:201.","Pneumocystis carinii pneumonia in the acquired immunodeficiency syndrome (AIDS). Diagnosis with bronchial brushings, biopsy, and bronchoalveolar lavage",Chest,1985,87,,201,,,Hartman B; Koss M; Hui A
201,"Albelda SM, Talbot GH, Gerson SL. Role of fiberoptic bronchoscopy in the diagnosis of invasive pulmonary aspergillosis in patients with acute leukemia. Am J Med. 1984;76:202.",Role of fiberoptic bronchoscopy in the diagnosis of invasive pulmonary aspergillosis in patients with acute leukemia,Am J Med,1984,76,,202,,,Albelda SM; Talbot GH; Gerson SL
202,"Lim WS, Baudouin SV, George RC. BTS guidelines for the management of community acquired pneumonia in adults: update 2009. Thorax. 2009;64(Suppl 3).",BTS guidelines for the management of community acquired pneumonia in adults: update 2009,Thorax,2009,64,Suppl 3,,,,Lim WS; Baudouin SV; George RC
203,"Mandell LA, Wunderink RG, Anzueto A. Infectious Diseases Society of America/American Thoracic Society consensus guidelines on the management of community-acquired pneumonia in adults. Clin Infect Dis. 2007;44(Suppl 2):204.",Infectious Diseases Society of America/American Thoracic Society consensus guidelines on the management of community-acquired pneumonia in adults,Clin Infect Dis,2007,44,Suppl 2,204,,,Mandell LA; Wunderink RG; Anzueto A
204,"Gibson SP, Weir DC, Burge PS. A prospective audit of the value of fibre optic bronchoscopy in adults admitted with community acquired pneumonia. Respir Med. 1993;87:205.",A prospective audit of the value of fibre optic bronchoscopy in adults admitted with community acquired pneumonia,Respir Med,1993,87,,205,,,Gibson SP; Weir DC; Burge PS
205,"Dikensoy O, Usalan C, Filiz A. Foreign body aspiration: clinical utility of flexible bronchoscopy. Postgrad Med J. 2002;78:206.",Foreign body aspiration: clinical utility of flexible bronchoscopy,Postgrad Med J,2002,78,,206,,,Dikensoy O; Usalan C; Filiz A
206,"Dasgupta KS, Mundada PS, Soni N. Diagnostic role of fibreoptic bronchoscopy in pulmonary tuberculosis. Indian J Otolaryngol Head Neck Surg. 2000;52:207.",Diagnostic role of fibreoptic bronchoscopy in pulmonary tuberculosis,Indian J Otolaryngol Head Neck Surg,2000,52,,207,,,Dasgupta KS; Mundada PS; Soni N
207,"Jaiswal AK, Kulpati DD, Jain NK. Role of bronchoscopy in the early diagnosis of suspected smear negative cases of pulmonary tuberculosis. Ind J Tub. 1989;36:208.",Role of bronchoscopy in the early diagnosis of suspected smear negative cases of pulmonary tuberculosis,Ind J Tub,1989,36,,208,,,Jaiswal AK; Kulpati DD; Jain NK
208,"De Gracia J, Curull V, Vidal R. Diagnostic value of bronchoalveolar lavage in suspected pulmonary tuberculosis. Chest. 1988;93:209.",Diagnostic value of bronchoalveolar lavage in suspected pulmonary tuberculosis,Chest,1988,93,,209,,,De Gracia J; Curull V; Vidal R
209,"Bachh A, Gupta A, Haq R, I. Diagnosing sputum/smear-negative pulmonary tuberculosis: does fibre-optic bronchoscopy play a significant role. Lung India. 2010;27:210.",Diagnosing sputum/smear-negative pulmonary tuberculosis: does fibre-optic bronchoscopy play a significant role,Lung India,2010,27,,210,,,Bachh A; Gupta A; Haq R; I
210,"Bartlett JG, Alexander J, Mayhew J. Should fiberoptic bronchoscopy aspirates be cultured?. Am Rev Respir Dis. 1976;114:211.",Should fiberoptic bronchoscopy aspirates be cultured?,Am Rev Respir Dis,1976,114,,211,,,Bartlett JG; Alexander J; Mayhew J
211,"Wimberley N, Faling LJ, Bartlett JG. A fiberoptic bronchoscopy technique to obtain uncontaminated lower airway secretions for bacterial culture. Am Rev Respir Dis. 1979;119:212.",A fiberoptic bronchoscopy technique to obtain uncontaminated lower airway secretions for bacterial culture,Am Rev Respir Dis,1979,119,,212,,,Wimberley N; Faling LJ; Bartlett JG
212,"Manali E, Papadopoulos A, Tsiodras S. The impact on community acquired pneumonia empirical therapy of diagnostic bronchoscopic techniques. Scand J Infect Dis. 2008;40:213.",The impact on community acquired pneumonia empirical therapy of diagnostic bronchoscopic techniques,Scand J Infect Dis,2008,40,,213,,,Manali E; Papadopoulos A; Tsiodras S
213,"Jimenez P, Saldias F, Meneses M. Diagnostic fiberoptic bronchoscopy in patients with community-acquired pneumonia. Comparison between bronchoalveolar lavage and telescoping plugged catheter cultures. Chest. 1993;103:214.",Diagnostic fiberoptic bronchoscopy in patients with community-acquired pneumonia. Comparison between bronchoalveolar lavage and telescoping plugged catheter cultures,Chest,1993,103,,214,,,Jimenez P; Saldias F; Meneses M
214,"Ortqvist A, Kalin M, Lejdeborn L. Diagnostic fiberoptic bronchoscopy and protected brush culture in patients with community-acquired pneumonia. Chest. 1990;97:215.",Diagnostic fiberoptic bronchoscopy and protected brush culture in patients with community-acquired pneumonia,Chest,1990,97,,215,,,Ortqvist A; Kalin M; Lejdeborn L
215,"Jimenez P, Meneses M, Saldias F. Pneumococcal antigen detection in bronchoalveolar lavage fluid from patients with pneumonia. Thorax. 1994;49:216.",Pneumococcal antigen detection in bronchoalveolar lavage fluid from patients with pneumonia,Thorax,1994,49,,216,,,Jimenez P; Meneses M; Saldias F
216,"Jacobs JA, Stobberingh EE, Cornelissen EI. Detection of Streptococcus pneumoniae antigen in bronchoalveolar lavage fluid samples by a rapid immunochromatographic membrane assay. J Clin Microbiol. 2005;43.",Detection of Streptococcus pneumoniae antigen in bronchoalveolar lavage fluid samples by a rapid immunochromatographic membrane assay,J Clin Microbiol,2005,43,,,,,Jacobs JA; Stobberingh EE; Cornelissen EI
217,"Rand D, IA. Thorax. Thorax. 2013;68:217. doi:10.1136/thoraxjnl-2013-203618i31.",Thorax,Thorax,2013,68,,217,10.1136/thoraxjnl-2013-203618i31,,Rand D; IA
218,"Jaulhac B, Nowicki M, Bornstein N. Detection of Legionella spp. in bronchoalveolar lavage fluids by DNA amplification. J Clin Microbiol. 1992;30:218.",Detection of Legionella spp. in bronchoalveolar lavage fluids by DNA amplification,J Clin Microbiol,1992,30,,218,,,Jaulhac B; Nowicki M; Bornstein N
219,"Reischl U, Linde HJ, Lehn N. Direct detection and differentiation of Legionella spp. and Legionella pneumophila in clinical specimens by dual-color real-time PCR and melting curve analysis. J Clin Microbiol. 2002;40:219.",Direct detection and differentiation of Legionella spp. and Legionella pneumophila in clinical specimens by dual-color real-time PCR and melting curve analysis,J Clin Microbiol,2002,40,,219,,,Reischl U; Linde HJ; Lehn N
220,"Charoenratanakul S, Dejsomritrutai W, Chaiprasert A. Diagnostic role of fiberoptic bronchoscopy in suspected smear negative pulmonary tuberculosis. Respir Med. 1995;89:220.",Diagnostic role of fiberoptic bronchoscopy in suspected smear negative pulmonary tuberculosis,Respir Med,1995,89,,220,,,Charoenratanakul S; Dejsomritrutai W; Chaiprasert A
221,"Liam CK, Chen YC, Yap SF. Detection of Mycobacterium tuberculosis in bronchoalveolar lavage from patients with sputum smear-negative pulmonary tuberculosis using a polymerase chain reaction assay. Respirology. 1998;3:221.",Detection of Mycobacterium tuberculosis in bronchoalveolar lavage from patients with sputum smear-negative pulmonary tuberculosis using a polymerase chain reaction assay,Respirology,1998,3,,221,,,Liam CK; Chen YC; Yap SF
222,"Tueller C, Chhajed PN, Buitrago-Tellez C. Value of smear and PCR in bronchoalveolar lavage fluid in culture positive pulmonary tuberculosis. Eur Respir J. 2005;26:222.",Value of smear and PCR in bronchoalveolar lavage fluid in culture positive pulmonary tuberculosis,Eur Respir J,2005,26,,222,,,Tueller C; Chhajed PN; Buitrago-Tellez C
223,"Jafari C, Thijsen S, Sotgiu G. Bronchoalveolar lavage enzyme-linked immunospot for a rapid diagnosis of tuberculosis: a Tuberculosis Network European Trials group study. Am J Respir Crit Care Med. 2009;180:223.",Bronchoalveolar lavage enzyme-linked immunospot for a rapid diagnosis of tuberculosis: a Tuberculosis Network European Trials group study,Am J Respir Crit Care Med,2009,180,,223,,,Jafari C; Thijsen S; Sotgiu G
224,"Jafari C, Ernst M, Kalsdorf B. Rapid diagnosis of smear-negative tuberculosis by bronchoalveolar lavage enzyme-linked immunospot. Am J Respir Crit Care Med. 2006;174:224.",Rapid diagnosis of smear-negative tuberculosis by bronchoalveolar lavage enzyme-linked immunospot,Am J Respir Crit Care Med,2006,174,,224,,,Jafari C; Ernst M; Kalsdorf B
225,"Fujii H, Ishihara J, Fukaura A. Early diagnosis of tuberculosis by fibreoptic bronchoscopy. Tuber Lung Dis. 1992;73:225.",Early diagnosis of tuberculosis by fibreoptic bronchoscopy,Tuber Lung Dis,1992,73,,225,,,Fujii H; Ishihara J; Fukaura A
226,"Brimacombe J, Dunbar-Reid K. The effect of introducing fibreoptic bronchoscopes on gas flow in laryngeal masks and tracheal tubes. Anaesthesia. 1996;51:226.",The effect of introducing fibreoptic bronchoscopes on gas flow in laryngeal masks and tracheal tubes,Anaesthesia,1996,51,,226,,,Brimacombe J; Dunbar-Reid K
227,"Haenel JB, Moore FA, Moore EE. Efficacy of selective intrabronchial air insufflation in acute lobar collapse. Am J Surg. 1992;164:227.",Efficacy of selective intrabronchial air insufflation in acute lobar collapse,Am J Surg,1992,164,,227,,,Haenel JB; Moore FA; Moore EE
228,"Harada K, Mutsuda T, Saoyama N. Re-expansion of refractory atelectasis using a bronchofiberscope with a balloon cuff. Chest. 1983;84:228.",Re-expansion of refractory atelectasis using a bronchofiberscope with a balloon cuff,Chest,1983,84,,228,,,Harada K; Mutsuda T; Saoyama N
229,"Lee TS, Wright BD. Selective insufflation of collapsed lung with fiberoptic bronchoscope and Swan-Ganz catheter. Intensive Care Med. 1981;7:229.",Selective insufflation of collapsed lung with fiberoptic bronchoscope and Swan-Ganz catheter,Intensive Care Med,1981,7,,229,,,Lee TS; Wright BD
230,"Tsao TC, Tsai YH, Lan RS. Treatment for collapsed lung in critically ill patients. Selective intrabronchial air insufflation using the fiberoptic bronchoscope. Chest. 1990;97:230.",Treatment for collapsed lung in critically ill patients. Selective intrabronchial air insufflation using the fiberoptic bronchoscope,Chest,1990,97,,230,,,Tsao TC; Tsai YH; Lan RS
231,"Tabboush ZS, Ayash RH, Badran HM. When fiberoptic bronchoscopy is indicated in the management of postoperative atelectasis. Acta Anaesthesiol Scand. 1998;42:231.",When fiberoptic bronchoscopy is indicated in the management of postoperative atelectasis,Acta Anaesthesiol Scand,1998,42,,231,,,Tabboush ZS; Ayash RH; Badran HM
232,"Jaworski A, Goldberg SK, Walkenstein MD. Utility of immediate postlobectomy fiberoptic bronchoscopy in preventing atelectasis. Chest. 1988;94:232.",Utility of immediate postlobectomy fiberoptic bronchoscopy in preventing atelectasis,Chest,1988,94,,232,,,Jaworski A; Goldberg SK; Walkenstein MD
233,"Dupree HJ, Lewejohann JC, Gleiss J. Fiberoptic bronchoscopy of intubated patients with life-threatening hemoptysis. World J Surg. 2001;25:233.",Fiberoptic bronchoscopy of intubated patients with life-threatening hemoptysis,World J Surg,2001,25,,233,,,Dupree HJ; Lewejohann JC; Gleiss J
234,"Khalil A, Soussan M, Mangiapan G. Utility of high-resolution chest CT scan in the emergency management of haemoptysis in the intensive care unit: severity, localization and aetiology. Br J Radiol. 2007;80:234.","Utility of high-resolution chest CT scan in the emergency management of haemoptysis in the intensive care unit: severity, localization and aetiology",Br J Radiol,2007,80,,234,,,Khalil A; Soussan M; Mangiapan G
235,"Baigelman W, Bellin S, Cupples LA. Bacteriologic assessment of the lower respiratory tract in intubated patients. Crit Care Med. 1986;14:235.",Bacteriologic assessment of the lower respiratory tract in intubated patients,Crit Care Med,1986,14,,235,,,Baigelman W; Bellin S; Cupples LA
236,"Barreiro B, Dorca J, Manresa F. Protected bronchoalveolar lavage in the diagnosis of ventilator-associated pneumonia. Eur Respir J. 1996;9:236.",Protected bronchoalveolar lavage in the diagnosis of ventilator-associated pneumonia,Eur Respir J,1996,9,,236,,,Barreiro B; Dorca J; Manresa F
237,"Bello S, Tajada A, Chacon E. Blind' protected specimen brushing versus bronchoscopic techniques in the aetiolological diagnosis of ventilator-associated pneumonia. Eur Respir J. 1996;9:237.",Blind' protected specimen brushing versus bronchoscopic techniques in the aetiolological diagnosis of ventilator-associated pneumonia,Eur Respir J,1996,9,,237,,,Bello S; Tajada A; Chacon E
238,"Casetta M, Blot F, Antoun S. Diagnosis of nosocomial pneumonia in cancer patients undergoing mechanical ventilation: a prospective comparison of the plugged telescoping catheter with the protected specimen brush. Chest. 1999;115:238.",Diagnosis of nosocomial pneumonia in cancer patients undergoing mechanical ventilation: a prospective comparison of the plugged telescoping catheter with the protected specimen brush,Chest,1999,115,,238,,,Casetta M; Blot F; Antoun S
239,"Humphreys H, Winter R, Baker M. Comparison of bronchoalveolar lavage and catheter lavage to confirm ventilator-associated lower respiratory tract infection. J Med Microbiol. 1996;45:239.",Comparison of bronchoalveolar lavage and catheter lavage to confirm ventilator-associated lower respiratory tract infection,J Med Microbiol,1996,45,,239,,,Humphreys H; Winter R; Baker M
240,"Jorda R, Parras F, Ibanez J. Diagnosis of nosocomial pneumonia in mechanically ventilated patients by the blind protected telescoping catheter. Intensive Care Med. 1993;19:240.",Diagnosis of nosocomial pneumonia in mechanically ventilated patients by the blind protected telescoping catheter,Intensive Care Med,1993,19,,240,,,Jorda R; Parras F; Ibanez J
241,"Jourdain B, Novara A, Ml J. Role of quantitative cultures of endotracheal aspirates in the diagnosis of nosocomial pneumonia. Am J Respir Crit Care Med. 1995;152:241.",Role of quantitative cultures of endotracheal aspirates in the diagnosis of nosocomial pneumonia,Am J Respir Crit Care Med,1995,152,,241,,,Jourdain B; Novara A; Ml J
242,"Kirtland SH, Corley DE, Winterbauer RH. The diagnosis of ventilator-associated pneumonia: a comparison of histologic, microbiologic, and clinical criteria. Chest. 1997;112:242.","The diagnosis of ventilator-associated pneumonia: a comparison of histologic, microbiologic, and clinical criteria",Chest,1997,112,,242,,,Kirtland SH; Corley DE; Winterbauer RH
243,"Lambert RS, Vereen LE, George RB. Comparison of tracheal aspirates and protected brush catheter specimens for identifying pathogenic bacteria in mechanically ventilated patients. Am J Med Sci. 1989;297:243.",Comparison of tracheal aspirates and protected brush catheter specimens for identifying pathogenic bacteria in mechanically ventilated patients,Am J Med Sci,1989,297,,243,,,Lambert RS; Vereen LE; George RB
244,"Leal-Noval SR, Alfaro-Rodriguez E, Murillo-Cabeza F. Diagnostic value of the blind brush in mechanically ventilated patients with nosocomial pneumonia. Intensive Care Med. 1992;18:244.",Diagnostic value of the blind brush in mechanically ventilated patients with nosocomial pneumonia,Intensive Care Med,1992,18,,244,,,Leal-Noval SR; Alfaro-Rodriguez E; Murillo-Cabeza F
