#,ama,title,journal,year,volume,issue,pages,doi,pmid,authors
245,"Marquette CH, Herengt F, Mathieu D. Diagnosis of pneumonia in mechanically ventilated patients. Repeatability of the protected specimen brush. Am Rev Respir Dis. 1993;147:245.",Diagnosis of pneumonia in mechanically ventilated patients. Repeatability of the protected specimen brush,Am Rev Respir Dis,1993,147,,245,,,Marquette CH; Herengt F; Mathieu D
246,"Marquette CH, Herengt F, Saulnier F. Protected specimen brush in the assessment of ventilator-associated pneumonia. Selection of a certain lung segment for bronchoscopic sampling is unnecessary. Chest. 1993;103:246.",Protected specimen brush in the assessment of ventilator-associated pneumonia. Selection of a certain lung segment for bronchoscopic sampling is unnecessary,Chest,1993,103,,246,,,Marquette CH; Herengt F; Saulnier F
247,"Pham LH, Brun-Buisson C, Legrand P. Diagnosis of nosocomial pneumonia in mechanically ventilated patients. Comparison of a plugged telescoping catheter with the protected specimen brush. Am Rev Respir Dis. 1991;143(5 Pt 1):247.",Diagnosis of nosocomial pneumonia in mechanically ventilated patients. Comparison of a plugged telescoping catheter with the protected specimen brush,Am Rev Respir Dis,1991,143,5 Pt 1,247,,,Pham LH; Brun-Buisson C; Legrand P
248,"Potgieter PD, Hammond JM. Etiology and diagnosis of pneumonia requiring ICU admission. Chest. 1992;101:248.",Etiology and diagnosis of pneumonia requiring ICU admission,Chest,1992,101,,248,,,Potgieter PD; Hammond JM
249,"Pugin J, Auckenthaler R, Mili N. Diagnosis of ventilator-associated pneumonia by bacteriologic analysis of bronchoscopic and nonbronchoscopic 'blind' bronchoalveolar lavage fluid. Am Rev Respir Dis. 1991;143(5 Pt 1):249.",Diagnosis of ventilator-associated pneumonia by bacteriologic analysis of bronchoscopic and nonbronchoscopic 'blind' bronchoalveolar lavage fluid,Am Rev Respir Dis,1991,143,5 Pt 1,249,,,Pugin J; Auckenthaler R; Mili N
250,"Rodriguez De Castro F, Sole-Violan J, Leon A, A. Do quantitative cultures of protected brush specimens modify the initial empirical therapy in ventilated patients with suspected pneumonia?. Eur Respir J. 1996;9:250.",Do quantitative cultures of protected brush specimens modify the initial empirical therapy in ventilated patients with suspected pneumonia?,Eur Respir J,1996,9,,250,,,Rodriguez De Castro F; Sole-Violan J; Leon A; A
251,"Rouby JJ, Rossignon MD, Nicolas MH. A prospective study of protected bronchoalveolar lavage in the diagnosis of nosocomial pneumonia. Anesthesiology. 1989;71:251.",A prospective study of protected bronchoalveolar lavage in the diagnosis of nosocomial pneumonia,Anesthesiology,1989,71,,251,,,Rouby JJ; Rossignon MD; Nicolas MH
252,"Sanchez-Nieto JM, Torres A, Garcia-Cordoba F. Impact of invasive and noninvasive quantitative culture sampling on outcome of ventilator-associated pneumonia: a pilot study. Am J Respir Crit Care Med. 1998;157:252.",Impact of invasive and noninvasive quantitative culture sampling on outcome of ventilator-associated pneumonia: a pilot study,Am J Respir Crit Care Med,1998,157,,252,,,Sanchez-Nieto JM; Torres A; Garcia-Cordoba F
253,"Souweine B, Veber B, Bedos JP. Diagnostic accuracy of protected specimen brush and bronchoalveolar lavage in nosocomial pneumonia: impact of previous antimicrobial treatments. Crit Care Med. 1998;26:253.",Diagnostic accuracy of protected specimen brush and bronchoalveolar lavage in nosocomial pneumonia: impact of previous antimicrobial treatments,Crit Care Med,1998,26,,253,,,Souweine B; Veber B; Bedos JP
254,"Swanson JM, Wood GC, Croce MA. Utility of preliminary bronchoalveolar lavage results in suspected ventilator-associated pneumonia. J Trauma. 2008;65:254.",Utility of preliminary bronchoalveolar lavage results in suspected ventilator-associated pneumonia,J Trauma,2008,65,,254,,,Swanson JM; Wood GC; Croce MA
255,"Timsit JF, Misset B, Francoual S. Is protected specimen brush a reproducible method to diagnose ICU-acquired pneumonia?. Chest. 1993;104:255.",Is protected specimen brush a reproducible method to diagnose ICU-acquired pneumonia?,Chest,1993,104,,255,,,Timsit JF; Misset B; Francoual S
256,"Timsit JF, Misset B, Renaud B. Effect of previous antimicrobial therapy on the accuracy of the main procedures used to diagnose nosocomial pneumonia in patients who are using ventilation. Chest. 1995;108:256.",Effect of previous antimicrobial therapy on the accuracy of the main procedures used to diagnose nosocomial pneumonia in patients who are using ventilation,Chest,1995,108,,256,,,Timsit JF; Misset B; Renaud B
257,"Torres A, El-Ebiary M, Padro L. Validation of different techniques for the diagnosis of ventilator-associated pneumonia. Comparison with immediate postmortem pulmonary biopsy. Am J Respir Crit Care Med. 1994;149(2 Pt 1):257.",Validation of different techniques for the diagnosis of ventilator-associated pneumonia. Comparison with immediate postmortem pulmonary biopsy,Am J Respir Crit Care Med,1994,149,2 Pt 1,257,,,Torres A; El-Ebiary M; Padro L
258,"Torres A, De La Bellacasa P, Rodriguez-Roisin J, R. Diagnostic value of telescoping plugged catheters in mechanically ventilated patients with bacterial pneumonia using the Metras catheter. Am Rev Respir Dis. 1988;138:258.",Diagnostic value of telescoping plugged catheters in mechanically ventilated patients with bacterial pneumonia using the Metras catheter,Am Rev Respir Dis,1988,138,,258,,,Torres A; De La Bellacasa P; Rodriguez-Roisin J; R
259,"Berton DC, Kalil AC, Cavalcanti M. Quantitative versus qualitative cultures of respiratory secretions for clinical outcomes in patients with ventilator-associated pneumonia. Cochrane Database Syst Rev. 2008;4.",Quantitative versus qualitative cultures of respiratory secretions for clinical outcomes in patients with ventilator-associated pneumonia,Cochrane Database Syst Rev,2008,,4,,,,Berton DC; Kalil AC; Cavalcanti M
260,"Berton DC, Kalil AC, Teixeira PJ. Quantitative versus qualitative cultures of respiratory secretions for clinical outcomes in patients with ventilator-associated pneumonia. Cochrane Database Syst Rev. 2012;1.",Quantitative versus qualitative cultures of respiratory secretions for clinical outcomes in patients with ventilator-associated pneumonia,Cochrane Database Syst Rev,2012,,1,,,,Berton DC; Kalil AC; Teixeira PJ
261,"Pincus PS, Kallenbach JM, Hurwitz MD. Transbronchial biopsy during mechanical ventilation. Crit Care Med. 1987;15:261.",Transbronchial biopsy during mechanical ventilation,Crit Care Med,1987,15,,261,,,Pincus PS; Kallenbach JM; Hurwitz MD
262,"Ghamande S, Rafanan A, Dweik R. Role of transbronchial needle aspiration in patients receiving mechanical ventilation. Chest. 2002;122:262.",Role of transbronchial needle aspiration in patients receiving mechanical ventilation,Chest,2002,122,,262,,,Ghamande S; Rafanan A; Dweik R
263,"Perkins GD, Chatterjie S, Mcauley DF. Role of nonbronchoscopic lavage for investigating alveolar inflammation and permeability in acute respiratory distress syndrome. Crit Care Med. 2006;34:263.",Role of nonbronchoscopic lavage for investigating alveolar inflammation and permeability in acute respiratory distress syndrome,Crit Care Med,2006,34,,263,,,Perkins GD; Chatterjie S; Mcauley DF
264,"Kim YH, Suh GY, Kim MH. Safety and usefulness of bronchoscopy in ventilator-dependent patients with severe thrombocytopenia. Anaesth Intensive Care. 2008;36:264.",Safety and usefulness of bronchoscopy in ventilator-dependent patients with severe thrombocytopenia,Anaesth Intensive Care,2008,36,,264,,,Kim YH; Suh GY; Kim MH
265,"Steinberg KP, Mitchell DR, Maunder RJ. Safety of bronchoalveolar lavage in patients with adult respiratory distress syndrome. Am Rev Respir Dis. 1993;148:265.",Safety of bronchoalveolar lavage in patients with adult respiratory distress syndrome,Am Rev Respir Dis,1993,148,,265,,,Steinberg KP; Mitchell DR; Maunder RJ
266,"Bauer TT, Torres A, Ewig S. Effects of bronchoalveolar lavage volume on arterial oxygenation in mechanically ventilated patients with pneumonia. Intensive Care Med. 2001;27:266.",Effects of bronchoalveolar lavage volume on arterial oxygenation in mechanically ventilated patients with pneumonia,Intensive Care Med,2001,27,,266,,,Bauer TT; Torres A; Ewig S
267,"Hilbert G, Gruson D, Vargas F. Bronchoscopy with bronchoalveolar lavage via the laryngeal mask airway in high-risk hypoxemic immunosuppressed patients. Crit Care Med. 2001;29:267.",Bronchoscopy with bronchoalveolar lavage via the laryngeal mask airway in high-risk hypoxemic immunosuppressed patients,Crit Care Med,2001,29,,267,,,Hilbert G; Gruson D; Vargas F
268,"Klein U, Karzai W, Zimmermann P. Changes in pulmonary mechanics after fiberoptic bronchoalveolar lavage in mechanically ventilated patients. Intensive Care Med. 1998;24:268.",Changes in pulmonary mechanics after fiberoptic bronchoalveolar lavage in mechanically ventilated patients,Intensive Care Med,1998,24,,268,,,Klein U; Karzai W; Zimmermann P
269,"Maitre B, Jaber S, Maggiore SM. Continuous positive airway pressure during fiberoptic bronchoscopy in hypoxemic patients. A randomized double-blind study using a new device. Am J Respir Crit Care Med. 2000;162(3 Pt 1):269.",Continuous positive airway pressure during fiberoptic bronchoscopy in hypoxemic patients. A randomized double-blind study using a new device,Am J Respir Crit Care Med,2000,162,3 Pt 1,269,,,Maitre B; Jaber S; Maggiore SM
270,"Papazian L, Colt HG, Scemama F. Effects of consecutive protected specimen brushing and bronchoalveolar lavage on gas exchange and hemodynamics in ventilated patients. Chest. 1993;104:270.",Effects of consecutive protected specimen brushing and bronchoalveolar lavage on gas exchange and hemodynamics in ventilated patients,Chest,1993,104,,270,,,Papazian L; Colt HG; Scemama F
271,"Previgliano IJ, Ripoll PI, Chiappero G. Optimizing cerebral perfusion pressure during fiberoptic bronchoscopy in severe head injury: effect of hyperventilation. Acta Neurochir Suppl. 2002;81:271.",Optimizing cerebral perfusion pressure during fiberoptic bronchoscopy in severe head injury: effect of hyperventilation,Acta Neurochir Suppl,2002,81,,271,,,Previgliano IJ; Ripoll PI; Chiappero G
272,"Trouillet JL, Guiguet M, Gibert C. Fiberoptic bronchoscopy in ventilated patients. Evaluation of cardiopulmonary risk under midazolam sedation. Chest. 1990;97:272.",Fiberoptic bronchoscopy in ventilated patients. Evaluation of cardiopulmonary risk under midazolam sedation,Chest,1990,97,,272,,,Trouillet JL; Guiguet M; Gibert C
273,"Macintyre NR, Ramage JE, Follett JV. Jet ventilation in support of fiberoptic bronchoscopy. Crit Care Med. 1987;15:273.",Jet ventilation in support of fiberoptic bronchoscopy,Crit Care Med,1987,15,,273,,,Macintyre NR; Ramage JE; Follett JV
274,"Ramanathan S, Sinha K, Arismendy J. Humidification and airway pressures during high-frequency jet ventilation delivered through the suction-biopsy channel of a flexible bronchofiberscope. Crit Care Med. 1984;12.",Humidification and airway pressures during high-frequency jet ventilation delivered through the suction-biopsy channel of a flexible bronchofiberscope,Crit Care Med,1984,12,,,,,Ramanathan S; Sinha K; Arismendy J
275,"Rand D, IA. Thorax. Thorax. 2013;68:274. doi:10.1136/thoraxjnl-2013-203618.",Thorax,Thorax,2013,68,,274,10.1136/thoraxjnl-2013-203618,,Rand D; IA
276,"Flatau E, Lewinsohn G, Konichezky S. Mechanical ventilation in fiberoptic-bronchoscopy: comparison between high frequency positive pressure ventilation and normal frequency positive pressure ventilation. Crit Care Med. 1982;10:275.",Mechanical ventilation in fiberoptic-bronchoscopy: comparison between high frequency positive pressure ventilation and normal frequency positive pressure ventilation,Crit Care Med,1982,10,,275,,,Flatau E; Lewinsohn G; Konichezky S
277,"Antonelli M, Conti G, Riccioni L. Noninvasive positive-pressure ventilation via face mask during bronchoscopy with BAL in high-risk hypoxemic patients. Chest. 1996;110:276.",Noninvasive positive-pressure ventilation via face mask during bronchoscopy with BAL in high-risk hypoxemic patients,Chest,1996,110,,276,,,Antonelli M; Conti G; Riccioni L
278,"Chiner E, Jn S, Llombart M. Fiberoptic bronchoscopy during nasal non-invasive ventilation in acute respiratory failure. Respiration. 2010;80:277.",Fiberoptic bronchoscopy during nasal non-invasive ventilation in acute respiratory failure,Respiration,2010,80,,277,,,Chiner E; Jn S; Llombart M
279,"Baumann HJ, Klose H, Simon M. Fiber optic bronchoscopy in patients with acute hypoxemic respiratory failure requiring noninvasive ventilation-a feasibility study. Crit Care. 2011;15:278.",Fiber optic bronchoscopy in patients with acute hypoxemic respiratory failure requiring noninvasive ventilation-a feasibility study,Crit Care,2011,15,,278,,,Baumann HJ; Klose H; Simon M
280,"Bajwa MK, Henein S, Kamholz SL. Fiberoptic bronchoscopy in the presence of space-occupying intracranial lesions. Chest. 1993;104:279.",Fiberoptic bronchoscopy in the presence of space-occupying intracranial lesions,Chest,1993,104,,279,,,Bajwa MK; Henein S; Kamholz SL
281,"Kerwin AJ, Croce MA, Timmons SD. Effects of fiberoptic bronchoscopy on intracranial pressure in patients with brain injury: a prospective clinical study. J Trauma. 2000;48:280.",Effects of fiberoptic bronchoscopy on intracranial pressure in patients with brain injury: a prospective clinical study,J Trauma,2000,48,,280,,,Kerwin AJ; Croce MA; Timmons SD
282,"Peerless JR, Snow N, Likavec MJ. 5. 281 Cleaning and disinfection of equipment for gastrointestinal endoscopy. Report of a Working Party of the British Society of Gastroenterology Endoscopy Committee. Chest. 1995;108:282.",5. 281 Cleaning and disinfection of equipment for gastrointestinal endoscopy. Report of a Working Party of the British Society of Gastroenterology Endoscopy Committee,Chest,1995,108,,282,,,Peerless JR; Snow N; Likavec MJ
283,"Beilenhoff U, Neumann CS, Rey JF. The ESGE Guidelines Committee. ESGE-ESGENA guideline: cleaning and disinfection in gastrointestinal endoscopy. Update 2008. Endoscopy. 2008;40:284.",The ESGE Guidelines Committee. ESGE-ESGENA guideline: cleaning and disinfection in gastrointestinal endoscopy. Update 2008,Endoscopy,2008,40,,284,,,Beilenhoff U; Neumann CS; Rey JF
284, on decontamination of endoscopes. on decontamination of endoscopes. 2002;None:286.,on decontamination of endoscopes,on decontamination of endoscopes,2002,,,286,,,
285, Code of practice for the prevention and control of healthcare associated infections. Code of practice for the prevention and control of healthcare associated infections. 2006;None:287.,Code of practice for the prevention and control of healthcare associated infections,Code of practice for the prevention and control of healthcare associated infections,2006,,,287,,,
286,NK. An evaluation of disinfecting agents used in endoscopy suites. An evaluation of chemical disinfecting agents used in endoscopy suites in the NHS. 2001;None:290.,An evaluation of disinfecting agents used in endoscopy suites,An evaluation of chemical disinfecting agents used in endoscopy suites in the NHS,2001,,,290,,,NK
287,"Poi PJ, Chuah SY, Srinivas P. Common fears of patients undergoing bronchoscopy. Eur Respir J. 1998;11:291.",Common fears of patients undergoing bronchoscopy,Eur Respir J,1998,11,,291,,,Poi PJ; Chuah SY; Srinivas P
288,"Diette GB, White P, Jr, Terry P. Quality assessment through patient self-report of symptoms prefiberoptic and postfiberoptic bronchoscopy. Chest. 1998;114:292.",Quality assessment through patient self-report of symptoms prefiberoptic and postfiberoptic bronchoscopy,Chest,1998,114,,292,,,Diette GB; White P; Jr; Terry P
289,"Lechtzin N, Rubin HR, White P Jr. Patient satisfaction with bronchoscopy. Am J Respir Crit Care Med. 2002;166:293.",Patient satisfaction with bronchoscopy,Am J Respir Crit Care Med,2002,166,,293,,,Lechtzin N; Rubin HR; White P Jr
290,"Hirose T, Okuda K, Ishida H. Patient satisfaction with sedation for flexible bronchoscopy. Respirology. 2008;13:294.",Patient satisfaction with sedation for flexible bronchoscopy,Respirology,2008,13,,294,,,Hirose T; Okuda K; Ishida H
291,"Hadzri H, Azarisman S, Fauzi A. Can a bronchoscopist reliably assess a patient's experience of bronchoscopy?. JRSM Short Rep. 2010;1:295.",Can a bronchoscopist reliably assess a patient's experience of bronchoscopy?,JRSM Short Rep,2010,1,,295,,,Hadzri H; Azarisman S; Fauzi A
292,"Bernasconi M, Chhajed PN, Muller P. Patients' satisfaction with flexible bronchoscopy in a hospital-based community practice. Respiration. 2009;78:296.",Patients' satisfaction with flexible bronchoscopy in a hospital-based community practice,Respiration,2009,78,,296,,,Bernasconi M; Chhajed PN; Muller P
293,"Mitsumune T, Senoh E, Adachi M. Prediction of patient discomfort during fibreoptic bronchoscopy. Respirology. 2005;10:297.",Prediction of patient discomfort during fibreoptic bronchoscopy,Respirology,2005,10,,297,,,Mitsumune T; Senoh E; Adachi M
294,"Diette GB, Lechtzin N, Haponik E. Distraction therapy with nature sights and sounds reduces pain during flexible bronchoscopy: a complementary approach to routine analgesia. Chest. 2003;123:298.",Distraction therapy with nature sights and sounds reduces pain during flexible bronchoscopy: a complementary approach to routine analgesia,Chest,2003,123,,298,,,Diette GB; Lechtzin N; Haponik E
295,"Dubois JM, Bartter T, Pratter MR. Music improves patient comfort level during outpatient bronchoscopy. Chest. 1995;108:299.",Music improves patient comfort level during outpatient bronchoscopy,Chest,1995,108,,299,,,Dubois JM; Bartter T; Pratter MR
296,"Colt HG, Powers A, Shanks TG. Effect of music on state anxiety scores in patients undergoing fiberoptic bronchoscopy. Chest. 1999;116:300.",Effect of music on state anxiety scores in patients undergoing fiberoptic bronchoscopy,Chest,1999,116,,300,,,Colt HG; Powers A; Shanks TG
297,"Brady M, Kinn S, Stuart P. Preoperative fasting for adults to prevent perioperative complications. Cochrane Database Syst Rev. 2003;4.",Preoperative fasting for adults to prevent perioperative complications,Cochrane Database Syst Rev,2003,,4,,,,Brady M; Kinn S; Stuart P
298,"Molina JA, Lobo CA, Goh HK. Review of studies and guidelines on fasting and procedural sedation at the emergency department. Int J Evid Based Healthc. 2008;8:302.",Review of studies and guidelines on fasting and procedural sedation at the emergency department,Int J Evid Based Healthc,2008,8,,302,,,Molina JA; Lobo CA; Goh HK
299,"Rand D, IA. Thorax. Thorax. 2013;68. doi:10.1136/thoraxjnl-2013-203618i33.",Thorax,Thorax,2013,68,,,10.1136/thoraxjnl-2013-203618i33,,Rand D; IA
300, Ensure adequate oxygenation and IV access for fluid resuscitation. Ensure adequate oxygenation and IV access for fluid resuscitation. None;None.,Ensure adequate oxygenation and IV access for fluid resuscitation,Ensure adequate oxygenation and IV access for fluid resuscitation,,,,,,,
301, free blood to preserve airway patency. Retract the bronchoscope proximally to maintain vision. None;None.,free blood to preserve airway patency,Retract the bronchoscope proximally to maintain vision,,,,,,,
302, C saline. Saline has the advantage that it may be administered repeatedly. Agents include. None;5(10).,C saline. Saline has the advantage that it may be administered repeatedly,Agents include,,5,10,,,,
303," If bleeding continues, the bronchoscope should be wedged into the bleeding segmental bronchus, if possible. If bleeding continues, the bronchoscope should be wedged into the bleeding segmental bronchus, if possible. None;None.","If bleeding continues, the bronchoscope should be wedged into the bleeding segmental bronchus, if possible","If bleeding continues, the bronchoscope should be wedged into the bleeding segmental bronchus, if possible",,,,,,,
304," Check platelet count, PT and PTT, and recheck drug history. Check platelet count, PT and PTT, and recheck drug history. None;None.","Check platelet count, PT and PTT, and recheck drug history","Check platelet count, PT and PTT, and recheck drug history",,,,,,,
305," TBLB : Transbronchial lung biopsy, PT: Prothrombin time, PTT: partial thromboplastin time) i36 Du Rand IA, et al. Thorax. 2013;68. doi:10.1136/thoraxjnl-2013-203618.","TBLB : Transbronchial lung biopsy, PT: Prothrombin time, PTT: partial thromboplastin time) i36 Du Rand IA, et al",Thorax,2013,68,,,10.1136/thoraxjnl-2013-203618,,
