#,ama,title,journal,year,volume,issue,pages,doi,pmid,authors
1,"Brasel KJ, Lindeman B, Jones A. Implementation of entrustable professional activities in general surgery: results of a national pilot study. Ann Surg. 2023;278.",Implementation of entrustable professional activities in general surgery: results of a national pilot study,Ann Surg,2023,278,,,,,Brasel KJ; Lindeman B; Jones A
2,"Lindeman B, Brasel K, Minter RM. A phased approach: the general surgery experience adopting entrustable professional activities in the United States. Acad Med. 2021;96.",A phased approach: the general surgery experience adopting entrustable professional activities in the United States,Acad Med,2021,96,,,,,Lindeman B; Brasel K; Minter RM
3,"Montgomery KB, Mellinger JD, Lindeman B. Entrustable professional activities in surgery: a review. JAMA Surg. 2024;159.",Entrustable professional activities in surgery: a review,JAMA Surg,2024,159,,,,,Montgomery KB; Mellinger JD; Lindeman B
4,"Urbina J, Monks SM. Validating assessment tools in simulation. Validating assessment tools in simulation. 2024;None.",Validating assessment tools in simulation,Validating assessment tools in simulation,2024,,,,,,Urbina J; Monks SM
5,"Jelovsek JE, Kow N, Diwadkar GB. Tools for the direct observation and assessment of psychomotor skills in medical trainees: a systematic review. Med Educ. 2013;47.",Tools for the direct observation and assessment of psychomotor skills in medical trainees: a systematic review,Med Educ,2013,47,,,,,Jelovsek JE; Kow N; Diwadkar GB
6,Messick S. Validity of psychological assessment: validation of inferences from person's responses and performances as scientific inquiry into score meaning. Am Psychol. 1995;50.,Validity of psychological assessment: validation of inferences from person's responses and performances as scientific inquiry into score meaning,Am Psychol,1995,50,,,,,Messick S
7,Downing SM. Validity: on meaningful interpretation of assessment data. Med Educ. 2003;37.,Validity: on meaningful interpretation of assessment data,Med Educ,2003,37,,,,,Downing SM
8,"Ilgen JS, Ma IW, Hatala R, Cook DA. A systematic review of validity evidence for checklists versus global rating scales in simulation-based assessment. Med Educ. 2015;49.",A systematic review of validity evidence for checklists versus global rating scales in simulation-based assessment,Med Educ,2015,49,,,,,Ilgen JS; Ma IW; Hatala R; Cook DA
9,"Downing SM, Tekian A, Yudkowsky R. Procedures for establishing defensible absolute passing scores on performance examinations in health professions education. Teach Learn Med. 2006;18.",Procedures for establishing defensible absolute passing scores on performance examinations in health professions education,Teach Learn Med,2006,18,,,,,Downing SM; Tekian A; Yudkowsky R
10,"Yudkowsky R, Downing SM. Assessment in health professions education. Assessment in health professions education. 2020;None.",Assessment in health professions education,Assessment in health professions education,2020,,,,,,Yudkowsky R; Downing SM
11,"Nelson DR, Hunderfund AL, Mullon JJ. Learning curves in electromagnetic navigational bronchoscopy: what do they tell us?. ATS Sch. 2022;3.",Learning curves in electromagnetic navigational bronchoscopy: what do they tell us?,ATS Sch,2022,3,,,,,Nelson DR; Hunderfund AL; Mullon JJ
12,"Kennedy CC, Maldonado F, Cook DA. Simulation-based bronchoscopy training: systematic review and meta-analysis. Chest. 2013;144.",Simulation-based bronchoscopy training: systematic review and meta-analysis,Chest,2013,144,,,,,Kennedy CC; Maldonado F; Cook DA
13,"Wahidi MM, Silvestri GA, Coakley RD. A prospective multicenter study of competency metrics and educational interventions in the learning of bronchoscopy among new pulmonary fellows. Chest. 2010;137.",A prospective multicenter study of competency metrics and educational interventions in the learning of bronchoscopy among new pulmonary fellows,Chest,2010,137,,,,,Wahidi MM; Silvestri GA; Coakley RD
14,"Stather DR, Maceachern P, Chee A. Trainee impact on procedural complications: an analysis of 967 consecutive flexible bronchoscopy procedures in an interventional pulmonology practice. Respiration. 2013;85.",Trainee impact on procedural complications: an analysis of 967 consecutive flexible bronchoscopy procedures in an interventional pulmonology practice,Respiration,2013,85,,,,,Stather DR; Maceachern P; Chee A
15,"Davoudi M, Osann K, Colt HG. Validation of two instruments to assess technical bronchoscopic skill using virtual reality simulation. Respiration. 2008;76.",Validation of two instruments to assess technical bronchoscopic skill using virtual reality simulation,Respiration,2008,76,,,,,Davoudi M; Osann K; Colt HG
16,"Konge L, Larsen KR, Clementsen P. Reliable and valid assessment of clinical bronchoscopy performance. Respiration. 2012;83.",Reliable and valid assessment of clinical bronchoscopy performance,Respiration,2012,83,,,,,Konge L; Larsen KR; Clementsen P
17,"Voduc N, Dudek N, Parker CM. Development and validation of a Bronchoscopy Competence Assessment Tool in a clinical setting. Ann Am Thorac Soc. 2016;13.",Development and validation of a Bronchoscopy Competence Assessment Tool in a clinical setting,Ann Am Thorac Soc,2016,13,,,,,Voduc N; Dudek N; Parker CM
18,"Voduc N, Adamson R, Kashgari A. Development of learning curves for bronchoscopy: results of a multicenter study of pulmonary trainees. Chest. 2020;158.",Development of learning curves for bronchoscopy: results of a multicenter study of pulmonary trainees,Chest,2020,158,,,,,Voduc N; Adamson R; Kashgari A
19,"Siow WT, Tan GL, Loo CM. Impact of structured curriculum with simulation on bronchoscopy. Respirology. 2021;26.",Impact of structured curriculum with simulation on bronchoscopy,Respirology,2021,26,,,,,Siow WT; Tan GL; Loo CM
20,"Nielsen AO, Cold KM, Vamadevan A. Systematic endobronchial ultrasound -the six landmarks approach. J Vis Exp. 2023;None. doi:10.3791/65551.",Systematic endobronchial ultrasound -the six landmarks approach,J Vis Exp,2023,,,,10.3791/65551,,Nielsen AO; Cold KM; Vamadevan A
21,"Davoudi M, Colt HG, Osann KE. Endobronchial ultrasound skills and tasks assessment tool: assessing the validity evidence for a test of endobronchial ultrasound-guided transbronchial needle aspiration operator skill. Am J Respir Crit Care Med. 2012;186.",Endobronchial ultrasound skills and tasks assessment tool: assessing the validity evidence for a test of endobronchial ultrasound-guided transbronchial needle aspiration operator skill,Am J Respir Crit Care Med,2012,186,,,,,Davoudi M; Colt HG; Osann KE
22,"Konge L, Clementsen PF, Ringsted C. Simulator training for endobronchial ultrasound: a randomised controlled trial. Eur Respir J. 2015;46.",Simulator training for endobronchial ultrasound: a randomised controlled trial,Eur Respir J,2015,46,,,,,Konge L; Clementsen PF; Ringsted C
23,"Ahmad Y, Domaleski L, Kosciuk P. A novel simulator for teaching endobronchial ultrasound-guided needle biopsy. J Bronchology Interv Pulmonol. 2023;30.",A novel simulator for teaching endobronchial ultrasound-guided needle biopsy,J Bronchology Interv Pulmonol,2023,30,,,,,Ahmad Y; Domaleski L; Kosciuk P
24,"Naur T, Nilsson PM, Pietersen PI. Simulation-based training in flexible bronchoscopy and endobronchial ultrasound-guided transbronchial needle aspiration (EBUS-TBNA): a systematic review. Respiration. 2017;93.",Simulation-based training in flexible bronchoscopy and endobronchial ultrasound-guided transbronchial needle aspiration (EBUS-TBNA): a systematic review,Respiration,2017,93,,,,,Naur T; Nilsson PM; Pietersen PI
25,"Kheir F, Alokla K, Myers L, Palomino J. Endobronchial ultrasound-transbronchial needle aspiration of mediastinal and hilar lymphadenopathy learning curve. Am J Ther. 2016;23.",Endobronchial ultrasound-transbronchial needle aspiration of mediastinal and hilar lymphadenopathy learning curve,Am J Ther,2016,23,,,,,Kheir F; Alokla K; Myers L; Palomino J
26,"Wahidi MM, Hulett C, Pastis N. Learning experience of linear endobronchial ultrasound among pulmonary trainees. Chest. 2014;145.",Learning experience of linear endobronchial ultrasound among pulmonary trainees,Chest,2014,145,,,,,Wahidi MM; Hulett C; Pastis N
27,"Stather DR, Chee A, Maceachern P. Endobronchial ultrasound learning curve in interventional pulmonary fellows. Respirology. 2015;20.",Endobronchial ultrasound learning curve in interventional pulmonary fellows,Respirology,2015,20,,,,,Stather DR; Chee A; Maceachern P
28,"Lee HJ, Lerner AD, Coleman B. Learning electromagnetic navigational bronchoscopy and percutaneous transthoracic needle biopsy (LEAP): a pilot study. J Bronchology Interv Pulmonol. 2019;26.",Learning electromagnetic navigational bronchoscopy and percutaneous transthoracic needle biopsy (LEAP): a pilot study,J Bronchology Interv Pulmonol,2019,26,,,,,Lee HJ; Lerner AD; Coleman B
29,"Lee HJ, Argento AC, Batra H. A multicenter study assessing interventional pulmonary fellow competency in electromagnetic navigation bronchoscopy. ATS Sch. 2022;3.",A multicenter study assessing interventional pulmonary fellow competency in electromagnetic navigation bronchoscopy,ATS Sch,2022,3,,,,,Lee HJ; Argento AC; Batra H
30,"Toennesen LL, Vindum HH, Risom E. Learning curves for electromagnetic navigation bronchoscopy using CUSUM analysis. J Bronchology Interv Pulmonol. 2022;29.",Learning curves for electromagnetic navigation bronchoscopy using CUSUM analysis,J Bronchology Interv Pulmonol,2022,29,,,,,Toennesen LL; Vindum HH; Risom E
31,"Mahmood K, Wahidi MM, Osann KE. Development of a tool to assess basic competency in the performance of rigid bronchoscopy. Ann Am Thorac Soc. 2016;13.",Development of a tool to assess basic competency in the performance of rigid bronchoscopy,Ann Am Thorac Soc,2016,13,,,,,Mahmood K; Wahidi MM; Osann KE
32,"Mahmood K, Wahidi MM, Shepherd RW. Variable learning curve of basic rigid bronchoscopy in trainees. Respiration. 2021;100.",Variable learning curve of basic rigid bronchoscopy in trainees,Respiration,2021,100,,,,,Mahmood K; Wahidi MM; Shepherd RW
33,"Salamonsen M, Mcgrath D, Steiler G. A new instrument to assess physician skill at thoracic ultrasound, including pleural effusion markup. Chest. 2013;144.","A new instrument to assess physician skill at thoracic ultrasound, including pleural effusion markup",Chest,2013,144,,,,,Salamonsen M; Mcgrath D; Steiler G
34,"Salamonsen MR, Bashirzadeh F, Ritchie AJ. A new instrument to assess physician skill at chest tube insertion: the TUBE-iCOMPT. Thorax. 2015;70.",A new instrument to assess physician skill at chest tube insertion: the TUBE-iCOMPT,Thorax,2015,70,,,,,Salamonsen MR; Bashirzadeh F; Ritchie AJ
35,"Nayahangan LJ, Svendsen M, Bodtger U. Assessment of competence in local anaesthetic thoracoscopy: development and validity investigation of a new assessment tool. J Thorac Dis. 2021;13.",Assessment of competence in local anaesthetic thoracoscopy: development and validity investigation of a new assessment tool,J Thorac Dis,2021,13,,,,,Nayahangan LJ; Svendsen M; Bodtger U
36,"Colt HG, Davoudi M, Quadrelli S, Rohani Z, N. Use of competencybased metrics to determine effectiveness of a postgraduate thoracoscopy course. Respiration. 2010;80.",Use of competencybased metrics to determine effectiveness of a postgraduate thoracoscopy course,Respiration,2010,80,,,,,Colt HG; Davoudi M; Quadrelli S; Rohani Z; N
37,"De La Fuente R, Kattan E, Munoz-Gama J. Development of a comprehensive Percutaneous Dilatational Tracheostomy process model for procedural training: a Delphi-based experts consensus. Acta Anaesthesiol Scand. 2021;65.",Development of a comprehensive Percutaneous Dilatational Tracheostomy process model for procedural training: a Delphi-based experts consensus,Acta Anaesthesiol Scand,2021,65,,,,,De La Fuente R; Kattan E; Munoz-Gama J
38,"Alkhalidi A, Islam AM, T. Tool for assessing surgical tracheostomy skills in otolaryngology residents. B-ENT. 2015;11.",Tool for assessing surgical tracheostomy skills in otolaryngology residents,B-ENT,2015,11,,,,,Alkhalidi A; Islam AM; T
39,"Wegner M, Dusse F, Beeser F. Comparing simulation training of bronchoscopy-guided percutaneous dilatational tracheostomy using conventional versus 3D printed simulators (TRAC-Sim Study). J Intensive Care Med. 2024;39.",Comparing simulation training of bronchoscopy-guided percutaneous dilatational tracheostomy using conventional versus 3D printed simulators (TRAC-Sim Study),J Intensive Care Med,2024,39,,,,,Wegner M; Dusse F; Beeser F
40,"Richards JB, Claar D, Mccurdy MT. Impact of risk and volume on procedural training of pulmonary and critical care fellows. ATS Sch. 2021;2.",Impact of risk and volume on procedural training of pulmonary and critical care fellows,ATS Sch,2021,2,,,,,Richards JB; Claar D; Mccurdy MT
