#,ama,title,journal,year,volume,issue,pages,doi,pmid,authors
1,"López-Campos JL, Tan W, Soriano JB. Global burden of COPD. Respirology. 2016;21(1).",Global burden of COPD,Respirology,2016,21,1,,,,López-Campos JL; Tan W; Soriano JB
2,"Bagdonas E, Raudoniute J, Bruzauskaite I, Aldonyte R. Novel aspects of pathogenesis and regeneration mechanisms in COPD. Int J Chron Obstruct Pulmon Dis. 2015;10.",Novel aspects of pathogenesis and regeneration mechanisms in COPD,Int J Chron Obstruct Pulmon Dis,2015,10,,,,,Bagdonas E; Raudoniute J; Bruzauskaite I; Aldonyte R
3,"Demedts IK, Demoor T, Bracke KR, Joos GF, Brusselle GG. Role of apoptosis in the pathogenesis of COPD and pulmonary emphysema. Respir Res. 2006;7(1):53.",Role of apoptosis in the pathogenesis of COPD and pulmonary emphysema,Respir Res,2006,7,1,53,,,Demedts IK; Demoor T; Bracke KR; Joos GF; Brusselle GG
4,Gold. None. None. 2017;None.,,,2017,,,,,,Gold
5,Nice. Endobronchial valve insertion to reduce lung volume in emphysema. Endobronchial valve insertion to reduce lung volume in emphysema. 2018;None.,Endobronchial valve insertion to reduce lung volume in emphysema,Endobronchial valve insertion to reduce lung volume in emphysema,2018,,,,,,Nice
6,"Slebos DJ, Shah PL, Herth FJ, Valipour A. Endobronchial valves for endoscopic lung volume reduction: best practice recommendations from expert panel on endoscopic lung volume reduction. Respiration. 2017;93(2).",Endobronchial valves for endoscopic lung volume reduction: best practice recommendations from expert panel on endoscopic lung volume reduction,Respiration,2017,93,2,,,,Slebos DJ; Shah PL; Herth FJ; Valipour A
7,"Sciurba FC, Ernst A, Herth FJ, Strange C, Criner GJ, Marquette CH. A randomized study of endobronchial valves for advanced emphysema. N Engl J Med. 2010;363(13).",A randomized study of endobronchial valves for advanced emphysema,N Engl J Med,2010,363,13,,,,Sciurba FC; Ernst A; Herth FJ; Strange C; Criner GJ; Marquette CH
8,"Herth FJ, Noppen M, Valipour A, Leroy S, Vergnon JM, Ficker JH. Efficacy predictors of lung volume reduction with Zephyr valves in a European cohort. Eur Respir J. 2012;39.",Efficacy predictors of lung volume reduction with Zephyr valves in a European cohort,Eur Respir J,2012,39,,,,,Herth FJ; Noppen M; Valipour A; Leroy S; Vergnon JM; Ficker JH
9,"Davey C, Zoumot Z, Jordan S, Mcnulty WH, Carr DH, Hind MD. Bronchoscopic lung volume reduction with endobronchial valves for patients with heterogeneous emphysema and intact interlobar fissures (the BeLieVeR-HIFi study): a randomised controlled trial. Lancet. 2015;386.",Bronchoscopic lung volume reduction with endobronchial valves for patients with heterogeneous emphysema and intact interlobar fissures (the BeLieVeR-HIFi study): a randomised controlled trial,Lancet,2015,386,,,,,Davey C; Zoumot Z; Jordan S; Mcnulty WH; Carr DH; Hind MD
10,"Klooster K, Ten Hacken NH, Hartman JE, Kerstjens HA, Van Rikxoort EM, Slebos DJ. Endobronchial valves for emphysema without interlobar collateral ventilation. N Engl J Med. 2015;373(24).",Endobronchial valves for emphysema without interlobar collateral ventilation,N Engl J Med,2015,373,24,,,,Klooster K; Ten Hacken NH; Hartman JE; Kerstjens HA; Van Rikxoort EM; Slebos DJ
11,"Kemp SV, Slebos DJ, Kirk A et al.. A multicenter RCT of Zephyr ® endobronchial valve treatment in heterogeneous emphysema (TRANS-FORM). Am J Respir Crit Care Med. 2017;196.",A multicenter RCT of Zephyr ® endobronchial valve treatment in heterogeneous emphysema (TRANS-FORM),Am J Respir Crit Care Med,2017,196,,,,,Kemp SV; Slebos DJ; Kirk A; Kornaszewska M; Carron K; Ek L; Study; Team
12,"Valipour A, Slebos DJ, Herth F, Darwiche K, Wagner M, Ficker JH. Endobronchial valve therapy in patients with homogeneous emphysema. Results from the IMPACT study. Am J Respir Crit Care Med. 2016;194(9).",Endobronchial valve therapy in patients with homogeneous emphysema. Results from the IMPACT study,Am J Respir Crit Care Med,2016,194,9,,,,Valipour A; Slebos DJ; Herth F; Darwiche K; Wagner M; Ficker JH
13,"Criner GJ, Sue R, Wright S, Dransfield M, Rivas-Perez H, Wiese T. A multicenter RCT of Zephyr® endobronchial valve treatment in heterogeneous emphysema (LIBER-ATE). Am J Respir Crit Care Med. 2018;198(9). doi:10.1159/000517034.",A multicenter RCT of Zephyr® endobronchial valve treatment in heterogeneous emphysema (LIBER-ATE),Am J Respir Crit Care Med,2018,198,9,,10.1159/000517034,,Criner GJ; Sue R; Wright S; Dransfield M; Rivas-Perez H; Wiese T
14,"Herth FJ, Gompelmann D, Criner GJ, Sciurba FC, Ernst A, Eberhardt R. Lung volume reduction using endobronchial valves in COPD patients with low emphysema heterogeneity scores. Am J Respir Crit Care Med. 2015;191:1156.",Lung volume reduction using endobronchial valves in COPD patients with low emphysema heterogeneity scores,Am J Respir Crit Care Med,2015,191,,1156,,,Herth FJ; Gompelmann D; Criner GJ; Sciurba FC; Ernst A; Eberhardt R
15,"Eberhardt R, Heubel CP, Kreuter M, Weinheimer O, Herth F. Bronchoscopic lung volume reduction in patients with severe homogeneous lung emphysema: a pilot study. Dtsch Med Wochenschr. 2009;134(11).",Bronchoscopic lung volume reduction in patients with severe homogeneous lung emphysema: a pilot study,Dtsch Med Wochenschr,2009,134,11,,,,Eberhardt R; Heubel CP; Kreuter M; Weinheimer O; Herth F
16,"Valipour A, Slebos DJ, De Oliveira HG, Eberhardt R, Freitag L, Criner GJ. Expert statement: pneumothorax associated with endoscopic valve therapy for emphysema: potential mechanisms, treatment algorithm, and case examples. Respiration. 2014;87.","Expert statement: pneumothorax associated with endoscopic valve therapy for emphysema: potential mechanisms, treatment algorithm, and case examples",Respiration,2014,87,,,,,Valipour A; Slebos DJ; De Oliveira HG; Eberhardt R; Freitag L; Criner GJ
17,"Fishman A, Martinez F, Naunheim K, Piantadosi S, Wise R, Ries A. A randomized trial comparing lung-volume-reduction surgery with medical therapy for severe emphysema. N Engl J Med. 2003;348(21).",A randomized trial comparing lung-volume-reduction surgery with medical therapy for severe emphysema,N Engl J Med,2003,348,21,,,,Fishman A; Martinez F; Naunheim K; Piantadosi S; Wise R; Ries A
18,"Valipour A, Herth FJ, Burghuber OC, Criner G, Vergnon JM, Goldin J. Target lobe volume reduction and COPD outcome measures after endobronchial valve therapy. Eur Respir J. 2014;43.",Target lobe volume reduction and COPD outcome measures after endobronchial valve therapy,Eur Respir J,2014,43,,,,,Valipour A; Herth FJ; Burghuber OC; Criner G; Vergnon JM; Goldin J
19,"Gompelmann D, Hofbauer T, Gerovasili V, Eberhardt R, Lim HJ, Herth F. Predictors of clinical outcome in emphysema patients with atelectasis following endoscopic valve therapy: a retrospective study. Respirology. 2016;21.",Predictors of clinical outcome in emphysema patients with atelectasis following endoscopic valve therapy: a retrospective study,Respirology,2016,21,,,,,Gompelmann D; Hofbauer T; Gerovasili V; Eberhardt R; Lim HJ; Herth F
20,"Tanabe N, Muro S, Tanaka S, Sato S, Oguma T, Kiyokawa H. Emphysema distribution and annual changes in pulmonary function in male patients with chronic obstructive pulmonary disease. Respir Res. 2012;13:31.",Emphysema distribution and annual changes in pulmonary function in male patients with chronic obstructive pulmonary disease,Respir Res,2012,13,,31,,,Tanabe N; Muro S; Tanaka S; Sato S; Oguma T; Kiyokawa H
21,"Klooster K, Hartman JE, Ten Hacken NH, Slebos DJ. One-year follow-up after endobronchial valve treatment in patients with emphysema without collateral ventilation treated in the STELVIO trial. Respiration. 2017;93(2).",One-year follow-up after endobronchial valve treatment in patients with emphysema without collateral ventilation treated in the STELVIO trial,Respiration,2017,93,2,,,,Klooster K; Hartman JE; Ten Hacken NH; Slebos DJ
22,"Sciurba FC, Criner GJ, Strange C, Shah PL, Michaud G, Connolly TA. Effect of endobronchial coils vs usual care on exercise tolerance in patients with severe emphysema: the RENEW randomized clinical trial. JAMA. 2016;315(20).",Effect of endobronchial coils vs usual care on exercise tolerance in patients with severe emphysema: the RENEW randomized clinical trial,JAMA,2016,315,20,,,,Sciurba FC; Criner GJ; Strange C; Shah PL; Michaud G; Connolly TA
23, National Emphysema Treatment Trial Research Group. Patients at high-risk of death after lung volume reduction surgery. New Eng J Med. 2001;345(5).,National Emphysema Treatment Trial Research Group. Patients at high-risk of death after lung volume reduction surgery,New Eng J Med,2001,345,5,,,,
