#,ama,title,journal,year,volume,issue,pages,doi,pmid,authors
1,"Deboever N, Jones CM, Yamashita K, Ajani JA, Hofstetter WL. Advances in diagnosis and management of cancer of the esophagus. BMJ Clin Res ed). 2024;385:74962. doi:10.1136/bmj-2023-074962.",Advances in diagnosis and management of cancer of the esophagus,BMJ Clin Res ed),2024,385,,74962,10.1136/bmj-2023-074962,,Deboever N; Jones CM; Yamashita K; Ajani JA; Hofstetter WL
2,Thrift AP. Global burden and epidemiology of Barrett oesophagus and oesophageal cancer. Nat Rev Gastroenterol Hepatol. 2021;18(6). doi:10.1038/s41575-021-00419-3.,Global burden and epidemiology of Barrett oesophagus and oesophageal cancer,Nat Rev Gastroenterol Hepatol,2021,18,6,,10.1038/s41575-021-00419-3,,Thrift AP
3,"He S, Xu J, Liu X, Zhen Y. Advances and challenges in the treatment of esophageal cancer. Acta Pharm Sin B. 2021;11(11). doi:10.1016/j.apsb.2021.03.008.",Advances and challenges in the treatment of esophageal cancer,Acta Pharm Sin B,2021,11,11,,10.1016/j.apsb.2021.03.008,,He S; Xu J; Liu X; Zhen Y
4,"Yagi K, Toriumi T, Aikou S, Yamashita H, Seto Y. Salvage treatment after definitive chemoradiotherapy for esophageal squamous cell carcinoma. Ann Gastroenterol Surg. 2021;5(4). doi:10.1002/ags3.12448.",Salvage treatment after definitive chemoradiotherapy for esophageal squamous cell carcinoma,Ann Gastroenterol Surg,2021,5,4,,10.1002/ags3.12448,,Yagi K; Toriumi T; Aikou S; Yamashita H; Seto Y
5,"Koch KE, Dhanasopon AP, Woodard GA. Airway esophageal fistula. Thorac Surg Clin. 2024;34(4). doi:10.1016/j.thorsurg.2024.07.005.",Airway esophageal fistula,Thorac Surg Clin,2024,34,4,,10.1016/j.thorsurg.2024.07.005,,Koch KE; Dhanasopon AP; Woodard GA
6,"Lan K, Chen J. Efficacy and safety of reirradiation for locoregional esophageal squamous cell carcinoma recurrence after radiotherapy: a systematic review and metaanalysis. Radiat Oncol. 2022;17(1):61. doi:10.1186/s13014-022-02019-0.",Efficacy and safety of reirradiation for locoregional esophageal squamous cell carcinoma recurrence after radiotherapy: a systematic review and metaanalysis,Radiat Oncol,2022,17,1,61,10.1186/s13014-022-02019-0,,Lan K; Chen J
7,"Kim HS, Khemasuwan D, Diaz-Mendoza J, Mehta AC. Management of tracheooesophageal fistula in adults. Eur Respir Rev. 2020;29(158):200094. doi:10.1183/16000617.0094-2020.",Management of tracheooesophageal fistula in adults,Eur Respir Rev,2020,29,158,200094,10.1183/16000617.0094-2020,,Kim HS; Khemasuwan D; Diaz-Mendoza J; Mehta AC
8,"Wang H, Li W, Wang Z, Chen L, Lai G, JF. Chinese expert consensus on interventional diagnosis and management of acquired digestive-respiratory tract fistulas (second edition). Clin Respir J. 2023;17(5). doi:10.1111/crj.13607.",Chinese expert consensus on interventional diagnosis and management of acquired digestive-respiratory tract fistulas (second edition),Clin Respir J,2023,17,5,,10.1111/crj.13607,,Wang H; Li W; Wang Z; Chen L; Lai G; JF
9,"Xu W, Jiang H, Liu Y, Liu X, Jiang Y. Retrospective cohort study on treatment modalities and survival time after oesophageal fistula in patients with oesophageal cancer in a regional cancer care centre in China. BMJ Open. 2023;13(4):69703. doi:10.1136/bmjopen-2022-069703.",Retrospective cohort study on treatment modalities and survival time after oesophageal fistula in patients with oesophageal cancer in a regional cancer care centre in China,BMJ Open,2023,13,4,69703,10.1136/bmjopen-2022-069703,,Xu W; Jiang H; Liu Y; Liu X; Jiang Y
10,"Kim HS, Khemasuwan D, Diaz-Mendoza J, Mehta AC. Management of tracheooesophageal fistula in adults. Eur Respir Rev. 2020;29(158):200094. doi:10.1183/16000617.0094-2020.",Management of tracheooesophageal fistula in adults,Eur Respir Rev,2020,29,158,200094,10.1183/16000617.0094-2020,,Kim HS; Khemasuwan D; Diaz-Mendoza J; Mehta AC
11,"Avasarala SK, Freitag L, Mehta AC. Metallic endobronchial stents: a contemporary resurrection. Chest. 2019;155(6). doi:10.1016/j.chest.2018.12.001.",Metallic endobronchial stents: a contemporary resurrection,Chest,2019,155,6,,10.1016/j.chest.2018.12.001,,Avasarala SK; Freitag L; Mehta AC
12,"Chaddha U, Hogarth DK, Murgu S. Perspective on airway stenting in inoperable patients with tracheoesophageal fistula after curative-intent treatment for esophageal cancer. J Thorac Dis. 2019;11(5). doi:10.21037/jtd.2018.12.128.",Perspective on airway stenting in inoperable patients with tracheoesophageal fistula after curative-intent treatment for esophageal cancer,J Thorac Dis,2019,11,5,,10.21037/jtd.2018.12.128,,Chaddha U; Hogarth DK; Murgu S
13,"Bai Y, Zhan K, Chi J, Jiang J, Li S, Yin Y. Self-expandable metal stent in the management of malignant airway disorders. Front Med. 2022;9:902488. doi:10.3389/fmed.2022.902488.",Self-expandable metal stent in the management of malignant airway disorders,Front Med,2022,9,,902488,10.3389/fmed.2022.902488,,Bai Y; Zhan K; Chi J; Jiang J; Li S; Yin Y
14,"Leong CK, Foo A, Goh KJ, Hsu A, Ho AR, Ng M. Airway interventions for tracheobronchial involvement in esophageal carcinoma: a retrospective cohort outcome study and algorithmic approach. J Thorac Dis. 2022;14(7). doi:10.21037/jtd-22-138.",Airway interventions for tracheobronchial involvement in esophageal carcinoma: a retrospective cohort outcome study and algorithmic approach,J Thorac Dis,2022,14,7,,10.21037/jtd-22-138,,Leong CK; Foo A; Goh KJ; Hsu A; Ho AR; Ng M
15,"Abnet CC, Arnold M, Wei WQ. Epidemiology of esophageal squamous cell carcinoma. Gastroenterology. 2018;154(2). doi:10.1053/j.gastro.2017.08.023.",Epidemiology of esophageal squamous cell carcinoma,Gastroenterology,2018,154,2,,10.1053/j.gastro.2017.08.023,,Abnet CC; Arnold M; Wei WQ
16,"Chen B, Deng M, Yang C, Dragomir MP, Zhao L, Bai K. High incidence of esophageal fistula on patients with clinical T4b esophageal squamous cell carcinoma who received chemoradiotherapy: a retrospective analysis. Radiother Oncol. 2021;158. doi:10.1016/j.radonc.2021.02.031.",High incidence of esophageal fistula on patients with clinical T4b esophageal squamous cell carcinoma who received chemoradiotherapy: a retrospective analysis,Radiother Oncol,2021,158,,,10.1016/j.radonc.2021.02.031,,Chen B; Deng M; Yang C; Dragomir MP; Zhao L; Bai K
17,"Qi JC, Zhi L, Li H, Huang Y, Ye Y, Li H. Prognostic factors for esophageal respiratory fistula in unresectable esophageal squamous cell carcinoma treated with radiotherapy. Sci Rep. 2024;14(1):17144. doi:10.1038/s41598-024-67859-0.",Prognostic factors for esophageal respiratory fistula in unresectable esophageal squamous cell carcinoma treated with radiotherapy,Sci Rep,2024,14,1,17144,10.1038/s41598-024-67859-0,,Qi JC; Zhi L; Li H; Huang Y; Ye Y; Li H
18,"Smith C, Bannon M, Ashraf A, Kaushik P, Marak C. Bronchoesophageal fistula: an unusual manifestation of lung cancer. Respir Med Case Rep. 2022;37:101634. doi:10.1016/j.rmcr.2022.101634.",Bronchoesophageal fistula: an unusual manifestation of lung cancer,Respir Med Case Rep,2022,37,,101634,10.1016/j.rmcr.2022.101634,,Smith C; Bannon M; Ashraf A; Kaushik P; Marak C
19,"Lenz CJ, Bick BL, Katzka D et al.. Esophagorespiratory fistulas: survival and outcomes of treatment. J Clin Gastroenterol. 2018;52(2). doi:10.1097/MCG.0000000000000751.",Esophagorespiratory fistulas: survival and outcomes of treatment,J Clin Gastroenterol,2018,52,2,,10.1097/MCG.0000000000000751,,Lenz CJ; Bick BL; Katzka D; Nichols FC; Depew ZS; Wong K; Song LM
20,"Wang S, Zhang C, Wang Y, Luo K, Yang Y, Yang Y. Risk factors and prognosis for esophageal fistula in patients with esophageal squamous cell carcinoma during radiotherapy. Esophagus. 2022;19(4). doi:10.1007/s10388-022-00919-4.",Risk factors and prognosis for esophageal fistula in patients with esophageal squamous cell carcinoma during radiotherapy,Esophagus,2022,19,4,,10.1007/s10388-022-00919-4,,Wang S; Zhang C; Wang Y; Luo K; Yang Y; Yang Y
21,"Guan X, Liu C, Zhou T, Ma Z, Zhang C, Wang B. Survival and prognostic factors of patients with esophageal fistula in advanced esophageal squamous cell carcinoma. Biosci Rep. 2020;40(1). doi:10.1042/BSR20193379.",Survival and prognostic factors of patients with esophageal fistula in advanced esophageal squamous cell carcinoma,Biosci Rep,2020,40,1,,10.1042/BSR20193379,,Guan X; Liu C; Zhou T; Ma Z; Zhang C; Wang B
22,"Watanabe T, Tanahashi M, Suzuki E, Yoshii N, Kohama T, Iguchi K. Airway stent intervention in a high-volume center: safe procedures and educational perspectives. J Thorac Dis. 2024;16(5). doi:10.21037/jtd-24-89.",Airway stent intervention in a high-volume center: safe procedures and educational perspectives,J Thorac Dis,2024,16,5,,10.21037/jtd-24-89,,Watanabe T; Tanahashi M; Suzuki E; Yoshii N; Kohama T; Iguchi K
23,"Bertrand T, Chatellier G, Mercier O. Management of neo-esophagus-airway fistula after esophagectomy for oesophageal cancer: systematic literature review and metaanalysis. Interdiscip Cardiovasc Thorac Surg. 2024;39(1):110. doi:10.1093/icvts/ivae110.",Management of neo-esophagus-airway fistula after esophagectomy for oesophageal cancer: systematic literature review and metaanalysis,Interdiscip Cardiovasc Thorac Surg,2024,39,1,110,10.1093/icvts/ivae110,,Bertrand T; Chatellier G; Mercier O
24,"Pao TH, Chen YY, Chang WL, Chang JS, Chiang NJ, Lin CY. Esophageal fistula after definitive concurrent chemotherapy and intensity modulated radiotherapy for esophageal squamous cell carcinoma. PloS one. 2021;16(5):251811. doi:10.1371/journal.pone.0251811.",Esophageal fistula after definitive concurrent chemotherapy and intensity modulated radiotherapy for esophageal squamous cell carcinoma,PloS one,2021,16,5,251811,10.1371/journal.pone.0251811,,Pao TH; Chen YY; Chang WL; Chang JS; Chiang NJ; Lin CY
25,"Bradley CJ, Yabroff KR, Zafar SY, Shih Y. Time to add screening for financial hardship as a quality measure?. CA Cancer J Clin. 2021;71(2). doi:10.3322/caac.21653.",Time to add screening for financial hardship as a quality measure?,CA Cancer J Clin,2021,71,2,,10.3322/caac.21653,,Bradley CJ; Yabroff KR; Zafar SY; Shih Y
26,"Herth FJ, Peter S, Baty F, Eberhardt R, Leuppi JD, Chhajed PN. Combined airway and oesophageal stenting in malignant airwayoesophageal fistulas: a prospective study. Eur Respir J. 2010;36(6). doi:10.1183/09031936.00049809.",Combined airway and oesophageal stenting in malignant airwayoesophageal fistulas: a prospective study,Eur Respir J,2010,36,6,,10.1183/09031936.00049809,,Herth FJ; Peter S; Baty F; Eberhardt R; Leuppi JD; Chhajed PN
27,"Kawakami T, Tsushima T, Omae K, Ogawa H, Shirasu H, Kito Y. Risk factors for esophageal fistula in thoracic esophageal squamous cell carcinoma invading adjacent organs treated with definitive chemoradiotherapy: a monocentric case-control study. BMC Cancer. 2018;18(1):573. doi:10.1186/s12885-018-4486-3.",Risk factors for esophageal fistula in thoracic esophageal squamous cell carcinoma invading adjacent organs treated with definitive chemoradiotherapy: a monocentric case-control study,BMC Cancer,2018,18,1,573,10.1186/s12885-018-4486-3,,Kawakami T; Tsushima T; Omae K; Ogawa H; Shirasu H; Kito Y
28,"Chou IT, Yu FJ, Shih HY, Liu YW, Lee JY, Chou SH. Risk factors of stent migration in esophageal cancer patients who underwent fully-covered self-expanding metal stents for malignant dysphagia or tracheoesophageal fistula. J Formos Med Assoc. 2024;None. doi:10.1016/j.jfma.2024.05.014.",Risk factors of stent migration in esophageal cancer patients who underwent fully-covered self-expanding metal stents for malignant dysphagia or tracheoesophageal fistula,J Formos Med Assoc,2024,,,,10.1016/j.jfma.2024.05.014,,Chou IT; Yu FJ; Shih HY; Liu YW; Lee JY; Chou SH
29,"Flannery A, Daneshvar C, Dutau H, Breen D. The art of rigid bronchoscopy and airway stenting. Clin Chest Med. 2018;39(1). doi:10.1016/j.ccm.2017.11.011.",The art of rigid bronchoscopy and airway stenting,Clin Chest Med,2018,39,1,,10.1016/j.ccm.2017.11.011,,Flannery A; Daneshvar C; Dutau H; Breen D
30,"Chen Y, Zhou ZQ, Feng JX, Su ZQ, Zhong CH, Lu LY. Hybrid stenting with silicone Y stents and metallic stents in the management of severe malignant airway stenosis and fistulas. Transl Lung Cancer Res. 2021;10(5). doi:10.21037/tlcr-21-353.",Hybrid stenting with silicone Y stents and metallic stents in the management of severe malignant airway stenosis and fistulas,Transl Lung Cancer Res,2021,10,5,,10.21037/tlcr-21-353,,Chen Y; Zhou ZQ; Feng JX; Su ZQ; Zhong CH; Lu LY
31,"Holden VK, Ospina-Delgado D, Chee A et al.. Safety and efficacy of the tracheobronchial bonastent: a single-center case series. Respiration. 2020;99(4). doi:10.1159/000506815.",Safety and efficacy of the tracheobronchial bonastent: a single-center case series,Respiration,2020,99,4,,10.1159/000506815,,Holden VK; Ospina-Delgado D; Chee A; Parikh MS; Carreiro MM; Moya A; D
32,"Zheng B, Zeng T, Yang H, Leng X, Yuan Y, Dai L. The clinical characteristics, treatments and prognosis of postesophagectomy airway fistula: a multicenter cohort study. Transl Lung Cancer Res. 2022;11(3). doi:10.21037/tlcr-22-141.","The clinical characteristics, treatments and prognosis of postesophagectomy airway fistula: a multicenter cohort study",Transl Lung Cancer Res,2022,11,3,,10.21037/tlcr-22-141,,Zheng B; Zeng T; Yang H; Leng X; Yuan Y; Dai L
33,"Goh KJ, Lee P, Foo A, Tan EH, Ong HS, Hsu A. Characteristics and outcomes of airway involvement in esophageal cancer. Ann Thorac Surg. 2021;112(3). doi:10.1016/j.athoracsur.2020.10.015.",Characteristics and outcomes of airway involvement in esophageal cancer,Ann Thorac Surg,2021,112,3,,10.1016/j.athoracsur.2020.10.015,,Goh KJ; Lee P; Foo A; Tan EH; Ong HS; Hsu A
34,"Wang Q, Chen Y, Xu Y, Xu H, Cai X, Wang R. Palliation of malignant esophageal stent esophagorespiratory fistula with rigid bronchoscope and Y silicone trachea stent: experience with seven patients. J Thorac Dis. 2024;16(2). doi:10.21037/jtd-23-1298.",Palliation of malignant esophageal stent esophagorespiratory fistula with rigid bronchoscope and Y silicone trachea stent: experience with seven patients,J Thorac Dis,2024,16,2,,10.21037/jtd-23-1298,,Wang Q; Chen Y; Xu Y; Xu H; Cai X; Wang R
35,"Fugazza A, Lamonaca L, Mercante G, Civilini E, Pradella A, Anderloni A. The worst adverse event for an endoscopist after esophageal stent placement: an aortoesophageal fistula. Endoscopy. 2022;54(2). doi:10.1055/a-1368-3677.",The worst adverse event for an endoscopist after esophageal stent placement: an aortoesophageal fistula,Endoscopy,2022,54,2,,10.1055/a-1368-3677,,Fugazza A; Lamonaca L; Mercante G; Civilini E; Pradella A; Anderloni A
36,"Berger G, French D. Palliative management of a malignant tracheoesophageal fistula using repeat endobronchial laser debridement and esophageal stenting. J Surg Case Rep. 2023;12:590. doi:10.1093/jscr/rjad590.",Palliative management of a malignant tracheoesophageal fistula using repeat endobronchial laser debridement and esophageal stenting,J Surg Case Rep,2023,,12,590,10.1093/jscr/rjad590,,Berger G; French D
37,"Sugihara T, Yasunaga H, Matsui H, Kamei J, Fujimura T, Kume H. Regional clinical practice variation in urology: usage example of the open data of the national database of health insurance claims and specific health checkups of Japan. Int J Urol. 2019;26(2). doi:10.1111/iju.13840.",Regional clinical practice variation in urology: usage example of the open data of the national database of health insurance claims and specific health checkups of Japan,Int J Urol,2019,26,2,,10.1111/iju.13840,,Sugihara T; Yasunaga H; Matsui H; Kamei J; Fujimura T; Kume H
38,"Anstee QM, Hallsworth K, Lynch N, Hauvespre A, Mansour E, Kozma S. Real-world management of non-alcoholic steatohepatitis differs from clinical practice guideline recommendations and across regions. JHEP Rep. 2022;4(1):100411. doi:10.1016/j.jhepr.2021.100411.",Real-world management of non-alcoholic steatohepatitis differs from clinical practice guideline recommendations and across regions,JHEP Rep,2022,4,1,100411,10.1016/j.jhepr.2021.100411,,Anstee QM; Hallsworth K; Lynch N; Hauvespre A; Mansour E; Kozma S
39,"Qian Y, Teufel A. Regional differences: clinical practice guidelines on the management of hepatocellular carcinoma. Hepatobiliary Surg Nutr. 2022;11(1). doi:10.21037/hbsn-21-496.",Regional differences: clinical practice guidelines on the management of hepatocellular carcinoma,Hepatobiliary Surg Nutr,2022,11,1,,10.21037/hbsn-21-496,,Qian Y; Teufel A
40,"Kontos M, Kanavidis P, Kuhn T, Masannat Y, Gulluoglu B, Study Group T. Targeted axillary dissection: worldwide variations in clinical practice. Breast Cancer Res Treat. 2024;204(2). doi:10.1007/s10549-023-07204-7.",Targeted axillary dissection: worldwide variations in clinical practice,Breast Cancer Res Treat,2024,204,2,,10.1007/s10549-023-07204-7,,Kontos M; Kanavidis P; Kuhn T; Masannat Y; Gulluoglu B; Study Group T
