#,ama,title,journal,year,volume,issue,pages,doi,pmid,authors
1, Respiration. Respiration. 2018;96. doi:10.1159/000490732.,Respiration,Respiration,2018,96,,,10.1159/000490732,,
2,Light RW. Clinical practice. Pleural effusion. N Engl J Med. 2002;346.,Clinical practice. Pleural effusion,N Engl J Med,2002,346,,,,,Light RW
3,"Owings MF, Kozak LJ. Ambulatory and Inpatient Procedures in the United States. Data from the National Health Survey. 1996;13.",Ambulatory and Inpatient Procedures in the United States,Data from the National Health Survey,1996,13,,,,,Owings MF; Kozak LJ
4,"Kvale PA, Selecky PA, Prakash UB. Palliative care in lung cancer: ACCP evidence-based clinical practice guidelines (2nd edition). Chest. 2007;132.",Palliative care in lung cancer: ACCP evidence-based clinical practice guidelines (2nd edition),Chest,2007,132,,,,,Kvale PA; Selecky PA; Prakash UB
5,"Clive AO, Kahan BC, Hooper CE et al.. Predicting survival in malignant pleural effusion: development and validation of the LENT prognostic score. Thorax. 2014;69.",Predicting survival in malignant pleural effusion: development and validation of the LENT prognostic score,Thorax,2014,69,,,,,Clive AO; Kahan BC; Hooper CE; Bhatnagar R; Morley AJ; Zahan-Evans N; Bintcliffe OJ; Boshuizen RC; Fysh ET; Tobin CL; Medford AR; Harvey JE; Van Den Heuvel MM; Lee YC; Maskell NA
6,"Bielsa S, Panades MJ, Egido R et al.. Accuracy of pleural fluid cytology in malignant effusions). An Med Interna. 2008;25.",Accuracy of pleural fluid cytology in malignant effusions),An Med Interna,2008,25,,,,,Bielsa S; Panades MJ; Egido R; Rue M; Salud A; Matias-Guiu X; Rodriguez-Panadero F; Porcel JM
7,"Prakash UB, Reiman HM. Comparison of needle biopsy with cytologic analysis for the evaluation of pleural effusion: analysis of 414 cases. Mayo Clin Proc. 1985;60.",Comparison of needle biopsy with cytologic analysis for the evaluation of pleural effusion: analysis of 414 cases,Mayo Clin Proc,1985,60,,,,,Prakash UB; Reiman HM
8,"Hooper C, Lee YC, Maskell N. Investigation of a unilateral pleural effusion in adults: British Thoracic Society Pleural Disease Guideline 2010. Thorax. 2010;65(suppl 2).",Investigation of a unilateral pleural effusion in adults: British Thoracic Society Pleural Disease Guideline 2010,Thorax,2010,65,suppl 2,,,,Hooper C; Lee YC; Maskell N
9,"Adams RF, Gray W, Davies RJ, Gleeson FV. Percutaneous image-guided cutting needle biopsy of the pleura in the diagnosis of malignant mesothelioma. Chest. 2001;120.",Percutaneous image-guided cutting needle biopsy of the pleura in the diagnosis of malignant mesothelioma,Chest,2001,120,,,,,Adams RF; Gray W; Davies RJ; Gleeson FV
10,"Benamore RE, Scott K, Richards CJ, Entwisle JJ. Image-guided pleural biopsy: diagnostic yield and complications. Clin Radiol. 2006;61.",Image-guided pleural biopsy: diagnostic yield and complications,Clin Radiol,2006,61,,,,,Benamore RE; Scott K; Richards CJ; Entwisle JJ
11,"Scott EM, Marshall TJ, Flower CD, Stewart S. Diffuse pleural thickening: percutaneous CTguided cutting needle biopsy. Radiology. 1995;194.",Diffuse pleural thickening: percutaneous CTguided cutting needle biopsy,Radiology,1995,194,,,,,Scott EM; Marshall TJ; Flower CD; Stewart S
12,"Mueller PR, Saini S, Simeone JF et al.. Image-guided pleural biopsies: indications, technique, and results in 23 patients. Radiology. 1988;169.","Image-guided pleural biopsies: indications, technique, and results in 23 patients",Radiology,1988,169,,,,,Mueller PR; Saini S; Simeone JF; Silverman SG; Morris E; Hahn PF; Forman BH; Mcloud TC; Shepard JO; Ferrucci JT
13,"Harris RJ, Kavuru MS, Rice TW, Kirby TJ. The diagnostic and therapeutic utility of thoracoscopy. A review. Chest. 1995;108.",The diagnostic and therapeutic utility of thoracoscopy. A review,Chest,1995,108,,,,,Harris RJ; Kavuru MS; Rice TW; Kirby TJ
14,"Rahman NM, Ali NJ, Brown G et al.. Local anaesthetic thoracoscopy: British Thoracic Society Pleural Disease Guideline. Thorax. 2010;65(suppl 2).",Local anaesthetic thoracoscopy: British Thoracic Society Pleural Disease Guideline,Thorax,2010,65,suppl 2,,,,Rahman NM; Ali NJ; Brown G; Chapman SJ; Davies RJ; Downer NJ; Gleeson FV; Howes TQ; Treasure T; Singh S; Phillips GD
15,"Husain AN, Colby TV, Ordonez NG et al.. Guidelines for pathologic diagnosis of malignant mesothelioma 2017 update of the consensus statement from the international mesothelioma interest group. Arch Pathol Lab Med. 2018;142.",Guidelines for pathologic diagnosis of malignant mesothelioma 2017 update of the consensus statement from the international mesothelioma interest group,Arch Pathol Lab Med,2018,142,,,,,Husain AN; Colby TV; Ordonez NG; Allen TC; Attanoos RL; Beasley MB; Butnor KJ; Chirieac LR; Churg AM; Dacic S; Galateau-Salle F; Gibbs A; Gown AM; Krausz T; Litzky LA; Marchevsky A; Nicholson AG; Roggli VL; Sharma AK; Travis WD; Walts AE; Wick MR
16,"Walters J, Maskell NA. Biopsy Techniques for the Diagnosis of Mesothelioma. Malignant Mesothelioma. 2011;None.",Biopsy Techniques for the Diagnosis of Mesothelioma,Malignant Mesothelioma,2011,,,,,,Walters J; Maskell NA
17,"Vakil E, Ost D, Vial MR et al.. Non-specific pleuritis in patients with active malignancy. Respirology. 2018;23.",Non-specific pleuritis in patients with active malignancy,Respirology,2018,23,,,,,Vakil E; Ost D; Vial MR; Stewart J; Sarkiss MG; Morice RC; Casal RF; Eapen GA; Grosu HB
18,Light R. Pleural Diseases. Pleural Diseases. 2013;6.,Pleural Diseases,Pleural Diseases,2013,6,,,,,Light R
19,"Moschos C, Kalomenidis I. Drug related pleural disease. Pleural Bulletin, Turk Toraks Denergi. None;4.",Drug related pleural disease,"Pleural Bulletin, Turk Toraks Denergi",,4,,,,,Moschos C; Kalomenidis I
20,"Camus P, Foucher P. Pneumotox: The drug induced respiratory disease website. Pneumotox: The drug induced respiratory disease website. 2012;2.",Pneumotox: The drug induced respiratory disease website,Pneumotox: The drug induced respiratory disease website,2012,2,,,,,Camus P; Foucher P
21,"Jain D, Mathur SR, Iyer VK. Cell blocks in cytopathology: a review of preparative methods, utility in diagnosis and role in ancillary studies. Cytopathology. 2014;25.","Cell blocks in cytopathology: a review of preparative methods, utility in diagnosis and role in ancillary studies",Cytopathology,2014,25,,,,,Jain D; Mathur SR; Iyer VK
22,"Shivakumarswamy U, Arakeri SU, Karigowdar MH, Yelikar B. Diagnostic utility of the cell block method versus the conventional smear study in pleural fluid cytology. J Cytol. 2012;29.",Diagnostic utility of the cell block method versus the conventional smear study in pleural fluid cytology,J Cytol,2012,29,,,,,Shivakumarswamy U; Arakeri SU; Karigowdar MH; Yelikar B
23,"Porcel JM, Quiros M, Gatius S, Bielsa S. Examination of cytological smears and cell blocks of pleural fluid: complementary diagnostic value for malignant effusions. Rev Clin Esp. 2017;217.",Examination of cytological smears and cell blocks of pleural fluid: complementary diagnostic value for malignant effusions,Rev Clin Esp,2017,217,,,,,Porcel JM; Quiros M; Gatius S; Bielsa S
24,"Hirsch A, Ruffie P, Nebut M, Bignon J, Chretien J. Pleural effusion: laboratory tests in 300 cases. Thorax. 1979;34.",Pleural effusion: laboratory tests in 300 cases,Thorax,1979,34,,,,,Hirsch A; Ruffie P; Nebut M; Bignon J; Chretien J
25,"Salyer WR, Eggleston JC, Erozan YS. Efficacy of pleural needle biopsy and pleural fluid cytopathology in the diagnosis of malignant neoplasm involving the pleura. Chest. 1975;67.",Efficacy of pleural needle biopsy and pleural fluid cytopathology in the diagnosis of malignant neoplasm involving the pleura,Chest,1975,67,,,,,Salyer WR; Eggleston JC; Erozan YS
26,"Nance KV, Shermer RW, Askin FB. Diagnostic efficacy of pleural biopsy as compared with that of pleural fluid examination. Mod Pathol. 1991;4.",Diagnostic efficacy of pleural biopsy as compared with that of pleural fluid examination,Mod Pathol,1991,4,,,,,Nance KV; Shermer RW; Askin FB
27,"Coughlin SS, Trock B, Criqui MH, Pickle LW, Browner D, Tefft MC. The logistic modeling of sensitivity, specificity, and predictive value of a diagnostic test. J Clin Epidemiol. 1992;45:27.","The logistic modeling of sensitivity, specificity, and predictive value of a diagnostic test",J Clin Epidemiol,1992,45,,27,,,Coughlin SS; Trock B; Criqui MH; Pickle LW; Browner D; Tefft MC
28,Diamond GA. Clinical epistemology of sensitivity and specificity. J Clin Epidemiol. 1992;45.,Clinical epistemology of sensitivity and specificity,J Clin Epidemiol,1992,45,,,,,Diamond GA
29,"Verma A, Abisheganaden J. Light RW: Identifying malignant pleural effusion by a cancer ratio (serum LDH: pleural fluid ADA ratio). Lung. 2016;194.",Light RW: Identifying malignant pleural effusion by a cancer ratio (serum LDH: pleural fluid ADA ratio),Lung,2016,194,,,,,Verma A; Abisheganaden J
30,"Johnson PW, Joel SP, Love S et al.. Tumour markers for prediction of survival and monitoring of remission in small cell lung cancer. Br J Cancer. 1993;67.",Tumour markers for prediction of survival and monitoring of remission in small cell lung cancer,Br J Cancer,1993,67,,,,,Johnson PW; Joel SP; Love S; Butcher M; Pandian MR; Squires L; Wrigley PF; Slevin ML
31,"Gatenby RA, Gillies RJ. Why do cancers have high aerobic glycolysis?. Nat Rev Cancer. 2004;4.",Why do cancers have high aerobic glycolysis?,Nat Rev Cancer,2004,4,,,,,Gatenby RA; Gillies RJ
