#,ama,title,journal,year,volume,issue,pages,doi,pmid,authors
1,"Sahn SA, Heffner JE. Pleural fluid analysis. Textbook of pleural diseases. 2008;None.",Pleural fluid analysis,Textbook of pleural diseases,2008,,,,,,Sahn SA; Heffner JE
2,"Yap E, Anderson G, Donald J. Pleural effusion in patients with pulmonary embolism. Respirology. 2008;13(3).",Pleural effusion in patients with pulmonary embolism,Respirology,2008,13,3,,,,Yap E; Anderson G; Donald J
3,"Porcel JM, Madronero AB, Pardina M. Analysis of pleural effusions in acute pulmonary embolism: radiological and pleural fluid data from 230 patients. Respirology. 2007;12(3).",Analysis of pleural effusions in acute pulmonary embolism: radiological and pleural fluid data from 230 patients,Respirology,2007,12,3,,,,Porcel JM; Madronero AB; Pardina M
4,"Blackmore CC, Black WC, Dallas RV. Pleural fluid volume estimation: a chest radiograph prediction rule. Acad Radiol. 1996;3(2+).",Pleural fluid volume estimation: a chest radiograph prediction rule,Acad Radiol,1996,3,2+,,,,Blackmore CC; Black WC; Dallas RV
5,"Ruskin JA, Gurney JW, Thorsen MK. Detection of pleural effusions on supine chest radiographs. AJR Am J Roentgenol. 1987;148(2+).",Detection of pleural effusions on supine chest radiographs,AJR Am J Roentgenol,1987,148,2+,,,,Ruskin JA; Gurney JW; Thorsen MK
6,"Armstrong P, Wilson AG, Dee P. Imaging of diseases of the chest. Imaging of diseases of the chest. 2001;None.",Imaging of diseases of the chest,Imaging of diseases of the chest,2001,,,,,,Armstrong P; Wilson AG; Dee P
7,"Hirsch JH, Rogers JV, Mack LA. Real-time sonography of pleural opacities. AJR Am J Roentgenol. 1981;136(2).",Real-time sonography of pleural opacities,AJR Am J Roentgenol,1981,136,2,,,,Hirsch JH; Rogers JV; Mack LA
8,"Kohan JM, Poe RH, Israel RH. Value of chest ultrasonography versus decubitus roentgenology for thoracentesis. Am Rev Respir Dis. 1986;133(2+).",Value of chest ultrasonography versus decubitus roentgenology for thoracentesis,Am Rev Respir Dis,1986,133,2+,,,,Kohan JM; Poe RH; Israel RH
9,"O'moore PV, Mueller PR, Simeone JF. Sonographic guidance in diagnostic and therapeutic interventions in the pleural space. AJR Am J Roentgenol. 1987;149(3).",Sonographic guidance in diagnostic and therapeutic interventions in the pleural space,AJR Am J Roentgenol,1987,149,3,,,,O'moore PV; Mueller PR; Simeone JF
10,"Barnes TW, Morgenthaler TI, Olson EJ. Sonographically guided thoracentesis and rate of pneumothorax. J Clin Ultrasound. 2005;33(3).",Sonographically guided thoracentesis and rate of pneumothorax,J Clin Ultrasound,2005,33,3,,,,Barnes TW; Morgenthaler TI; Olson EJ
11,"Grogan DR, Irwin RS, Channick R. Complications associated with thoracentesis. A prospective randomized study comparing three different methods. Arch Intern Med. 1990;150(1+).",Complications associated with thoracentesis. A prospective randomized study comparing three different methods,Arch Intern Med,1990,150,1+,,,,Grogan DR; Irwin RS; Channick R
12,"Raptopoulos V, Davis LM, Lee G. Factors affecting the development of pneumothorax associated with thoracentesis. AJR Am J Roentgenol. 1990;156(3).",Factors affecting the development of pneumothorax associated with thoracentesis,AJR Am J Roentgenol,1990,156,3,,,,Raptopoulos V; Davis LM; Lee G
13,"Lipscomb DJ, Flower C, Hadfield JW. Ultrsound of the pleura: an assessment of its clinical value. Clin Radiol. 1981;32(2+).",Ultrsound of the pleura: an assessment of its clinical value,Clin Radiol,1981,32,2+,,,,Lipscomb DJ; Flower C; Hadfield JW
14,"Wu RG, Yuan A, Liaw YS. Image comparison of real-time gray-scale ultrasound and colour Doppler ultrasound for use in diagnosis of minimal pleural effusion. Am J Respir Crit Care Med. 1994;150(2+).",Image comparison of real-time gray-scale ultrasound and colour Doppler ultrasound for use in diagnosis of minimal pleural effusion,Am J Respir Crit Care Med,1994,150,2+,,,,Wu RG; Yuan A; Liaw YS
15,"Roch A, Bojan M, Michelet P. Usefulness of ultrasonography in predicting pleural effusions >500 ml in patients receiving mechanical ventilation. Chest. 2005;127(2+).",Usefulness of ultrasonography in predicting pleural effusions >500 ml in patients receiving mechanical ventilation,Chest,2005,127,2+,,,,Roch A; Bojan M; Michelet P
16,"Eibenberger KL, Dock WI, Ammann ME. Quantification of pleural effusions: sonography versus radiography. Radiology. 1994;191.",Quantification of pleural effusions: sonography versus radiography,Radiology,1994,191,,,,,Eibenberger KL; Dock WI; Ammann ME
17,"Kearney SE, Davies C, Davies R. Computed tomography and ultrasound in parapneumonic effusions and empyema. Clin Radiol. 2000;55(3).",Computed tomography and ultrasound in parapneumonic effusions and empyema,Clin Radiol,2000,55,3,,,,Kearney SE; Davies C; Davies R
18,"Go ¨rg CH, Restrepo I, Schwerk WB. Sonography of malignant pleural effusion. Eur Radiol. 1997;7(3).",Sonography of malignant pleural effusion,Eur Radiol,1997,7,3,,,,Go ¨rg CH; Restrepo I; Schwerk WB
19,"Yang PC, Luh KT, Chang D. Value of sonography in determining the nature of pleural effusion: analysis of 320 cases. AJR Am J Roentgenol. 1992;159.",Value of sonography in determining the nature of pleural effusion: analysis of 320 cases,AJR Am J Roentgenol,1992,159,,,,,Yang PC; Luh KT; Chang D
20,"Qureshi NR, Rahman NM, Gleeson FV. Thoracic ultrasound in the diagnosis of malignant pleural effusion. Thorax. 2009;64.",Thoracic ultrasound in the diagnosis of malignant pleural effusion,Thorax,2009,64,,,,,Qureshi NR; Rahman NM; Gleeson FV
21,"Diacon AH, Brutsche MH, Soler M. Accuracy of pleural puncture sites. A prospective comparison of clinical examination with ultrasound. Chest. 2003;123(2+).",Accuracy of pleural puncture sites. A prospective comparison of clinical examination with ultrasound,Chest,2003,123,2+,,,,Diacon AH; Brutsche MH; Soler M
22,"Ferrer A, Osset J, Alegre J. Prospective clinical and microbiological study of pleural effusions. Eur J Clin Microbiol Infect Dis. 1999;18(2+).",Prospective clinical and microbiological study of pleural effusions,Eur J Clin Microbiol Infect Dis,1999,18,2+,,,,Ferrer A; Osset J; Alegre J
23,"Abouzgheib W, Bartter T, Dagher H. A prospective study of the volume of pleural fluid required for accurate diagnosis of malignant pleural effusion. Chest. 2009;135.",A prospective study of the volume of pleural fluid required for accurate diagnosis of malignant pleural effusion,Chest,2009,135,,,,,Abouzgheib W; Bartter T; Dagher H
24,"Swiderek J, Donthireddy MS, V. Prospective study to determine the volume of pleural fluid required to diagnose malignancy. Chest. 2010;137.",Prospective study to determine the volume of pleural fluid required to diagnose malignancy,Chest,2010,137,,,,,Swiderek J; Donthireddy MS; V
25,"Manosca F, Schinstine M, Fetsch PA. Diagnostic effects of prolonged storage on fresh effusion samples. Diagn Cytopathol. 2007;35(2+).",Diagnostic effects of prolonged storage on fresh effusion samples,Diagn Cytopathol,2007,35,2+,,,,Manosca F; Schinstine M; Fetsch PA
26,Sahn S. Pleural fluid analysis: narrowing the differential diagnosis. Semin Respir Med. 1987;9(4).,Pleural fluid analysis: narrowing the differential diagnosis,Semin Respir Med,1987,9,4,,,,Sahn S
27,"Villena V, Lopez-Encuentra A, Garcia-Lujan R. Clinical implications of appearance of pleural fluid at thoracentesis. Chest. 2004;125(3).",Clinical implications of appearance of pleural fluid at thoracentesis,Chest,2004,125,3,,,,Villena V; Lopez-Encuentra A; Garcia-Lujan R
28,"Light RW, Erozan YS, Ball W. Cells in pleural fluid. Their value in differential diagnosis. Arch Intern Med. 1973;132(3).",Cells in pleural fluid. Their value in differential diagnosis,Arch Intern Med,1973,132,3,,,,Light RW; Erozan YS; Ball W
29,"Ali HA, Lippmann M, Mundathaje U. Spontaneous hemothorax. Chest. 2008;134(4).",Spontaneous hemothorax,Chest,2008,134,4,,,,Ali HA; Lippmann M; Mundathaje U
30,"Light RW, Macgreggor I, Luchsinger PC. Pleural effusions: the diagnostic separation of transudates and exudates. Ann Intern Med. 1972;77.",Pleural effusions: the diagnostic separation of transudates and exudates,Ann Intern Med,1972,77,,,,,Light RW; Macgreggor I; Luchsinger PC
31,"Heffner JE, Brown LK, Barbieri CA. Diagnostic value of tests that discriminate between exudative and transudative pleural effusions. Chest. 1997;111(1+).",Diagnostic value of tests that discriminate between exudative and transudative pleural effusions,Chest,1997,111,1+,,,,Heffner JE; Brown LK; Barbieri CA
32,"Romero-Candiera S, Romero-Brufao S, Fernandez C. Is it meaningful to use biochemical parameters to discriminate between transudative and exudative pleural effusions?. Chest. 2002;122.",Is it meaningful to use biochemical parameters to discriminate between transudative and exudative pleural effusions?,Chest,2002,122,,,,,Romero-Candiera S; Romero-Brufao S; Fernandez C
33,"Romero-Candiera S, Fernandez C, Martin C. Influence of diuretics on the concentration of proteins and other components of pleural transudates in patients with heart failure. Am J Med. 2001;110(3).",Influence of diuretics on the concentration of proteins and other components of pleural transudates in patients with heart failure,Am J Med,2001,110,3,,,,Romero-Candiera S; Fernandez C; Martin C
34,"Gotsman I, Fridlender Z, Meirovitz A. The evaluation of pleural effusions in patients with heart failure. Am J Med. 2001;111(3).",The evaluation of pleural effusions in patients with heart failure,Am J Med,2001,111,3,,,,Gotsman I; Fridlender Z; Meirovitz A
35,"Porcel JM, Pena JM, De Vera V, C. Bayesian analysis using continuous likelihood ratios for identifying pleural exudates. Respir Med. 2006;100(2L).",Bayesian analysis using continuous likelihood ratios for identifying pleural exudates,Respir Med,2006,100,2L,,,,Porcel JM; Pena JM; De Vera V; C
36,"Liao H, Na MJ, Dikensoy O. Diagnostic value of pleural fluid N-terminal pro-brain natriuretic peptide levels in patients with cardiovascular diseases. Respirology. 2008;13(2L).",Diagnostic value of pleural fluid N-terminal pro-brain natriuretic peptide levels in patients with cardiovascular diseases,Respirology,2008,13,2L,,,,Liao H; Na MJ; Dikensoy O
37,"Kolditz M, Halank M, Schiemanck CS. High diagnostic accuracy of NT-proBNP for cardiac origin of pleural effusions. Eur Respir J. 2006;28.",High diagnostic accuracy of NT-proBNP for cardiac origin of pleural effusions,Eur Respir J,2006,28,,,,,Kolditz M; Halank M; Schiemanck CS
38,"Porcel JM, Chorda J, Cao G. Comparing serum and pleural fluid pro-brain natriuretic peptide (NT-proBNP) levels with pleural-to-serum albumin gradient for the identification of cardiac effusions misclassified by Light's criteria. Respirology. 2007;12.",Comparing serum and pleural fluid pro-brain natriuretic peptide (NT-proBNP) levels with pleural-to-serum albumin gradient for the identification of cardiac effusions misclassified by Light's criteria,Respirology,2007,12,,,,,Porcel JM; Chorda J; Cao G
39,"Gegenhuber A, Mueller T, Dieplinger B. Plasma B-type Natriuretic peptide in patients with pleural effusions. Chest. 2005;128.",Plasma B-type Natriuretic peptide in patients with pleural effusions,Chest,2005,128,,,,,Gegenhuber A; Mueller T; Dieplinger B
40,"Tomcsanyi J, Nagy E, Somloi M. NT-brain natriuretic peptide levels in pleural fluid distinguish between pleural transudates and exudates. Eur J Heart Fail. 2004;6.",NT-brain natriuretic peptide levels in pleural fluid distinguish between pleural transudates and exudates,Eur J Heart Fail,2004,6,,,,,Tomcsanyi J; Nagy E; Somloi M
41,"Porcel JM, Vives M, Cao G. Measurement of Pro-Brain Natriuretic peptide in pleural fluid for the diagnosis of pleural effusions due to heart failure. Am J Med. 2004;116(2L).",Measurement of Pro-Brain Natriuretic peptide in pleural fluid for the diagnosis of pleural effusions due to heart failure,Am J Med,2004,116,2L,,,,Porcel JM; Vives M; Cao G
42,"Hann CH, Choi JE, Chung JH. Clinical utility of pleural fluid NT-pro Brain Natriuretic peptide (NT-proBNP) in patients with pleural effusions. Intern Med. 2008;47.",Clinical utility of pleural fluid NT-pro Brain Natriuretic peptide (NT-proBNP) in patients with pleural effusions,Intern Med,2008,47,,,,,Hann CH; Choi JE; Chung JH
43,"Pettersson T, Riska H. Diagnostic value of total and differential leukocyte counts in pleural effusions. Acta Med Scand. 1981;210(3).",Diagnostic value of total and differential leukocyte counts in pleural effusions,Acta Med Scand,1981,210,3,,,,Pettersson T; Riska H
44,"Ansari T, IS. Management of undiagnosed persistent pleural effusions. Clin Chest Med. 1998;19(4).",Management of undiagnosed persistent pleural effusions,Clin Chest Med,1998,19,4,,,,Ansari T; IS
45,"Light RW. Pleural diseases, 3rd edn. Pleural diseases, 3rd edn. 1995;None.","Pleural diseases, 3rd edn","Pleural diseases, 3rd edn",1995,,,,,,Light RW
46,"Turan SK, Basyigit G, I. Clinicopathologic significance of eosinophilic pleural effusions in a population with a high prevalence of tuberculosis and cancer. Acta Cytol. 2007;51(3).",Clinicopathologic significance of eosinophilic pleural effusions in a population with a high prevalence of tuberculosis and cancer,Acta Cytol,2007,51,3,,,,Turan SK; Basyigit G; I
47,"Adelman M, Albelda SM, Gottlieb J. Diagnostic utility of pleural fluid eosinophilia. Am J Med. 1984;77(3).",Diagnostic utility of pleural fluid eosinophilia,Am J Med,1984,77,3,,,,Adelman M; Albelda SM; Gottlieb J
48,"Wysenbeek AJ, Lahav M, Aelion JA. Eosinophilic pleural effusion: a review of 36 cases. Respiration. 1985;48(3).",Eosinophilic pleural effusion: a review of 36 cases,Respiration,1985,48,3,,,,Wysenbeek AJ; Lahav M; Aelion JA
49,"Martinez-Garcia MA, Viedma C-, Cordero-Rodriguez E, PJ. Diagnostic utility of eosinophils in the pleural fluid. Eur Respir J. 1999;15(3).",Diagnostic utility of eosinophils in the pleural fluid,Eur Respir J,1999,15,3,,,,Martinez-Garcia MA; Viedma C-; Cordero-Rodriguez E; PJ
50,"Good JT, Taryle DA, Maulitz RM. The diagnostic value of pleural fluid pH. Chest. 1980;78(3).",The diagnostic value of pleural fluid pH,Chest,1980,78,3,,,,Good JT; Taryle DA; Maulitz RM
51,"Potts DE, Taryle A, Sahn SA. The glucose-pH relationship in parapneumonic effusions. Arch Intern Med. 1978;138(3).",The glucose-pH relationship in parapneumonic effusions,Arch Intern Med,1978,138,3,,,,Potts DE; Taryle A; Sahn SA
52,"Sahn SA, Good J. Pleural fluid pH in malignant effusions. Diagnostic, prognostic, and therapeutic implications. Ann Intern Med. 1988;108.","Pleural fluid pH in malignant effusions. Diagnostic, prognostic, and therapeutic implications",Ann Intern Med,1988,108,,,,,Sahn SA; Good J
53,"Heffner JE, Nietert PJ, Barbieri C. Pleural fluid pH as a predictor of survival for patients with malignant pleural effusions. Chest. 2000;117(1+).",Pleural fluid pH as a predictor of survival for patients with malignant pleural effusions,Chest,2000,117,1+,,,,Heffner JE; Nietert PJ; Barbieri C
54,"Heffner JE, Brown LK, Barbieri C. Pleural fluid chemical analysis in parapneumonic effusions. A meta-analysis. Am J Respir Crit Care Med. 1995;151(1+).",Pleural fluid chemical analysis in parapneumonic effusions. A meta-analysis,Am J Respir Crit Care Med,1995,151,1+,,,,Heffner JE; Brown LK; Barbieri C
55,"Maskell NA, Gleeson FV, Darby M. Diagnostically significant variations in pleural fluid pH in loculated parapneumonic effusions. Chest. 2004;126(3).",Diagnostically significant variations in pleural fluid pH in loculated parapneumonic effusions,Chest,2004,126,3,,,,Maskell NA; Gleeson FV; Darby M
56,"Rahman NM, Mishra EK, Davies HE. Clinically important factors influencing the diagnostic measurement of pleural fluid pH and glucose. Am J Respir Crit Care Med. 2008;178.",Clinically important factors influencing the diagnostic measurement of pleural fluid pH and glucose,Am J Respir Crit Care Med,2008,178,,,,,Rahman NM; Mishra EK; Davies HE
57,"Emil P, Lesho DO, Bernard J. Is pH paper an acceptable low cost alternative to the blood gas analyser for determining pleural fluid pH?. Chest. 1997;112(2+).",Is pH paper an acceptable low cost alternative to the blood gas analyser for determining pleural fluid pH?,Chest,1997,112,2+,,,,Emil P; Lesho DO; Bernard J
58,"Light RW, Ball WC. Glucose and amylase in pleural effusions. JAMA. 1973;225(3).",Glucose and amylase in pleural effusions,JAMA,1973,225,3,,,,Light RW; Ball WC
59,Sahn SA. Pathogenesis and clinical features of diseases associated with low pleural fluid glucose. The pleural in health and disease. 1985;None.,Pathogenesis and clinical features of diseases associated with low pleural fluid glucose,The pleural in health and disease,1985,,,,,,Sahn SA
60,Sahn SA. The pleura. Am Rev Respir Dis. 1988;138(4).,The pleura,Am Rev Respir Dis,1988,138,4,,,,Sahn SA
61,"Joseph J, Viney S, Beck P. A prospective study of amylase-rich pleural effusions with special reference to amylase isoenzyme analysis. Chest. 1992;102(3).",A prospective study of amylase-rich pleural effusions with special reference to amylase isoenzyme analysis,Chest,1992,102,3,,,,Joseph J; Viney S; Beck P
62,"Sherr HP, Light RW, Merson MH. Origin of pleural fluid amylase in oesophageal rupture. Ann Intern Med. 1972;76(4).",Origin of pleural fluid amylase in oesophageal rupture,Ann Intern Med,1972,76,4,,,,Sherr HP; Light RW; Merson MH
63,Kramer M. High amylase levels in neoplasm related pleural effusion. Ann Intern Med. 1989;110(4).,High amylase levels in neoplasm related pleural effusion,Ann Intern Med,1989,110,4,,,,Kramer M
64,"Branca P, Rodriguez M, Rogers JT. Routine measurement of pleural fluid amylase is not indicated. Arch Intern Med. 2001;161(3).",Routine measurement of pleural fluid amylase is not indicated,Arch Intern Med,2001,161,3,,,,Branca P; Rodriguez M; Rogers JT
65,"Lankisch PG, Droge M, Becher R. Pleural effusions: a new negative prognostic parameter for acute pancreatitis. Am J Gastroenterol. 1994;89(3).",Pleural effusions: a new negative prognostic parameter for acute pancreatitis,Am J Gastroenterol,1994,89,3,,,,Lankisch PG; Droge M; Becher R
66,"Inglesias JI, Cobb J, Levey J. Recurrent left pleural effusion in a 44-year-old woman with a history of alcohol abuse. Chest. 1996;110(3).",Recurrent left pleural effusion in a 44-year-old woman with a history of alcohol abuse,Chest,1996,110,3,,,,Inglesias JI; Cobb J; Levey J
67,"Salyer WR, Eggleston JC, Erozan YS. Efficacy of pleural needle biopsy and pleural fluid cytopathology in the diagnosis of malignant neoplasm involving the pleura. Chest. 1975;67(4).",Efficacy of pleural needle biopsy and pleural fluid cytopathology in the diagnosis of malignant neoplasm involving the pleura,Chest,1975,67,4,,,,Salyer WR; Eggleston JC; Erozan YS
68,"Nance KV, Shermer RW, Askin FB. Diagnostic efficacy of pleural biopsy as compared with that of pleural fluid examination. Mod Pathol. 1991;4(2L).",Diagnostic efficacy of pleural biopsy as compared with that of pleural fluid examination,Mod Pathol,1991,4,2L,,,,Nance KV; Shermer RW; Askin FB
69,"Prakash UB, Reiman HM. Comparison of needle biopsy with cytologic analysis for the evaluation of pleural effusion: analysis of 414 cases. Mayo Clin Proc. 1985;60(2L).",Comparison of needle biopsy with cytologic analysis for the evaluation of pleural effusion: analysis of 414 cases,Mayo Clin Proc,1985,60,2L,,,,Prakash UB; Reiman HM
70,Garcia L. The value of multiple fluid specimens in the cytological diqgnosis of malignancy. Mod Pathol. 1994;7(3).,The value of multiple fluid specimens in the cytological diqgnosis of malignancy,Mod Pathol,1994,7,3,,,,Garcia L
71,"Dekker A, Bupp PA. Cytology of serous effusions. An investigation into the usefulness of cell blocks versus smears. Am J Clin Pathol. 1978;70(3).",Cytology of serous effusions. An investigation into the usefulness of cell blocks versus smears,Am J Clin Pathol,1978,70,3,,,,Dekker A; Bupp PA
72,"Chandra A, Cross P, Denton K. The BSCC code of practice: exfoliative cytolopathology (excluding gynaecological cytopathology). Cytopathology. 2009;20(4).",The BSCC code of practice: exfoliative cytolopathology (excluding gynaecological cytopathology),Cytopathology,2009,20,4,,,,Chandra A; Cross P; Denton K
73,"Denton K, Giles T, Smith P. Tissue pathways for exfoliative cytology and fine needle aspiration cytology. Tissue pathways for exfoliative cytology and fine needle aspiration cytology. 2009;None.",Tissue pathways for exfoliative cytology and fine needle aspiration cytology,Tissue pathways for exfoliative cytology and fine needle aspiration cytology,2009,,,,,,Denton K; Giles T; Smith P
74,"Porcel M, Vives M, Esquerda A. Use of a panel of tumour markers (carcinoembryonic antigen, cancer antigen 125, carbohydrate antigen 15-3 and cytokeratin 19 fragments) in pleural fluid for the differential diagnosis of benign and malignant effusions. Chest. 2004;126(2+).","Use of a panel of tumour markers (carcinoembryonic antigen, cancer antigen 125, carbohydrate antigen 15-3 and cytokeratin 19 fragments) in pleural fluid for the differential diagnosis of benign and malignant effusions",Chest,2004,126,2+,,,,Porcel M; Vives M; Esquerda A
75,"Sherpereel A, Grigoriu B, Conti M. Soluble mesothelin-related peptides in the diagnosis of malignant pleural mesothelioma. Am J Respir Crit Care Med. 2006;173(2+).",Soluble mesothelin-related peptides in the diagnosis of malignant pleural mesothelioma,Am J Respir Crit Care Med,2006,173,2+,,,,Sherpereel A; Grigoriu B; Conti M
76,"Creaney J, Yeoman D, Naumoff L. Soluble mesothelin in effusions: a useful tool for the diagnosis of malignant mesothelioma. Thorax. 2007;62(2++).",Soluble mesothelin in effusions: a useful tool for the diagnosis of malignant mesothelioma,Thorax,2007,62,2++,,,,Creaney J; Yeoman D; Naumoff L
77,"Creaney J, Van Bruggen I, Segal A. Combined CA125 and mesothelin levels for the diagnosis of malignant mesothelioma. Chest. 2007;132(2+).",Combined CA125 and mesothelin levels for the diagnosis of malignant mesothelioma,Chest,2007,132,2+,,,,Creaney J; Van Bruggen I; Segal A
78,"Cristaudo A, Foddis R, Vivaldi A. Clinical significance of serum mesothelin in patients with mesothelioma and lung cancer. Clin Cancer Res. 2007;13(2+).",Clinical significance of serum mesothelin in patients with mesothelioma and lung cancer,Clin Cancer Res,2007,13,2+,,,,Cristaudo A; Foddis R; Vivaldi A
79,"Robinson B, Creaney J, Lake R. Mesothelin-family proteins and diagnosis of mesothelioma. Lancet. 2003;362(2+).",Mesothelin-family proteins and diagnosis of mesothelioma,Lancet,2003,362,2+,,,,Robinson B; Creaney J; Lake R
80,"Davies HE, Sadler RS, Bielsa S. The clinical impact and reliability of pleural fluid mesothelin in undiagnosed pleural effusions. Am J Respir Crit Care Med. 2009;180(2+).",The clinical impact and reliability of pleural fluid mesothelin in undiagnosed pleural effusions,Am J Respir Crit Care Med,2009,180,2+,,,,Davies HE; Sadler RS; Bielsa S
81,"Hassan R, Remaley A, Sampson M. Detection and quantitation of serum mesothelin, a tumour marker for patients with mesothelioma and ovarian cancer. Clin Cancer Res. 2006;12(2L).","Detection and quantitation of serum mesothelin, a tumour marker for patients with mesothelioma and ovarian cancer",Clin Cancer Res,2006,12,2L,,,,Hassan R; Remaley A; Sampson M
82,"Traill ZC, Davies R, Gleeson FV. Thoracic computed tomography in patients with suspected malignant pleural effusions. Clin Radiol. 2001;56.",Thoracic computed tomography in patients with suspected malignant pleural effusions,Clin Radiol,2001,56,,,,,Traill ZC; Davies R; Gleeson FV
83,"Mcloud T, Flower C. Imaging of the pleura: sonography, CT, and MR imaging. AJR Am J Roentgenol. 1991;156(4).","Imaging of the pleura: sonography, CT, and MR imaging",AJR Am J Roentgenol,1991,156,4,,,,Mcloud T; Flower C
84,"Waite RJ, Carbonneau RJ, Balikian JP. Parietal pleural changes in empyema: appearances on CT. Radiology. 1990;175(3).",Parietal pleural changes in empyema: appearances on CT,Radiology,1990,175,3,,,,Waite RJ; Carbonneau RJ; Balikian JP
85,"Leung AN, Muller NL, Miller RR. CT in differential diagnosis of diffuse pleural disease. AJR Am J Roentgenol. 1989;154(2L).",CT in differential diagnosis of diffuse pleural disease,AJR Am J Roentgenol,1989,154,2L,,,,Leung AN; Muller NL; Miller RR
86,"Scott EM, Marshall TJ, Flower C. Diffuse pleural thickening: percutaneous CT-guided cutting needle biopsy. Radiology. 1995;194(2+).",Diffuse pleural thickening: percutaneous CT-guided cutting needle biopsy,Radiology,1995,194,2+,,,,Scott EM; Marshall TJ; Flower C
87,"Falaschi F, Battolla L, Mascalchi M. Usefulness of MR signal intensity in distinguishing benign from malignant pleural disease. AJR Am J Roentgenol. 1995;166(2+).",Usefulness of MR signal intensity in distinguishing benign from malignant pleural disease,AJR Am J Roentgenol,1995,166,2+,,,,Falaschi F; Battolla L; Mascalchi M
88,"Knuuttila A, Kivisaari L, Kivisaari A. Evaluation of pleural disease using MR and CT. Acta Radiol. 2001;42(2+).",Evaluation of pleural disease using MR and CT,Acta Radiol,2001,42,2+,,,,Knuuttila A; Kivisaari L; Kivisaari A
89,"Geisel FL, Bischoff H, Tengg-Kobligk V, H. Dynamic contrast enhanced MRI of malignant pleural mesothelioma: a feasibility study of non-invasive assessment, therapeutic follow-up, and possible predictor of improved outcome. Chest. 2006;129(2+).","Dynamic contrast enhanced MRI of malignant pleural mesothelioma: a feasibility study of non-invasive assessment, therapeutic follow-up, and possible predictor of improved outcome",Chest,2006,129,2+,,,,Geisel FL; Bischoff H; Tengg-Kobligk V; H
90,"Duysinx B, Nguyen D, Louis R. Evaluation of pleural disease with 18-Fluorodeoxyglucose positron emission tomography imaging. Chest. 2004;125.",Evaluation of pleural disease with 18-Fluorodeoxyglucose positron emission tomography imaging,Chest,2004,125,,,,,Duysinx B; Nguyen D; Louis R
