#,ama,title,journal,year,volume,issue,pages,doi,pmid,authors
1,"Nayak R, Brogly SB, Lajkosz K, Lougheed MD, Petsikas D. Outcomes of operative and nonoperative treatment of thoracic empyema: a population-based study. Ann Thorac Surg. 2019;108.",Outcomes of operative and nonoperative treatment of thoracic empyema: a population-based study,Ann Thorac Surg,2019,108,,,,,Nayak R; Brogly SB; Lajkosz K; Lougheed MD; Petsikas D
2,"Davies HE, Davies RJ, Davies C. Management of pleural infection in adults: British Thoracic Society Pleural Disease Guideline 2010. Thorax. 2010;65.",Management of pleural infection in adults: British Thoracic Society Pleural Disease Guideline 2010,Thorax,2010,65,,,,,Davies HE; Davies RJ; Davies C
3,"Rahman NM, Maskell NA, West A, Teoh R, Arnold A, Mackinlay C. Intrapleural use of tissue plasminogen activator and DNase in pleural infection. N Engl J Med. 2011;365.",Intrapleural use of tissue plasminogen activator and DNase in pleural infection,N Engl J Med,2011,365,,,,,Rahman NM; Maskell NA; West A; Teoh R; Arnold A; Mackinlay C
4,"Popowicz N, Bintcliffe O, Fonseka D et al.. Dose de-escalation of intrapleural tissue plasminogen activator therapy for pleural infection: the alteplase dose assessment for pleural infection therapy project. Ann Am Thorac Soc. 2017;14.",Dose de-escalation of intrapleural tissue plasminogen activator therapy for pleural infection: the alteplase dose assessment for pleural infection therapy project,Ann Am Thorac Soc,2017,14,,,,,Popowicz N; Bintcliffe O; Fonseka D; Blyth D; Smith KG; Piccolo NA; F
5,"Mehta H, Biswas A, Penley A, Jantz M. Utilizing once daily use of tissue plasminogen activator (tPA) and deoxyribonuclease (DNase) for management of intrapleural sepsis [abstract. Am J Respir Crit Care Med. 2016;193:3228.",Utilizing once daily use of tissue plasminogen activator (tPA) and deoxyribonuclease (DNase) for management of intrapleural sepsis [abstract,Am J Respir Crit Care Med,2016,193,,3228,,,Mehta H; Biswas A; Penley A; Jantz M
6,"Majid A, Kheir F, Folch A, Fernandez-Bussy S, Chatterji S, Maskey A. Concurrent intrapleural instillation of tissue plasminogen activator and DNase for pleural infection: a single-center experience. Ann Am Thorac Soc. 2016;13.",Concurrent intrapleural instillation of tissue plasminogen activator and DNase for pleural infection: a single-center experience,Ann Am Thorac Soc,2016,13,,,,,Majid A; Kheir F; Folch A; Fernandez-Bussy S; Chatterji S; Maskey A
7,"Scarci M, Abah U, Solli P, Page A, Waller D, Van Schil P. EACTS expert consensus statement for surgical management of pleural empyema. Eur J Cardiothorac Surg. 2015;48.",EACTS expert consensus statement for surgical management of pleural empyema,Eur J Cardiothorac Surg,2015,48,,,,,Scarci M; Abah U; Solli P; Page A; Waller D; Van Schil P
8,"Chaddha U, Agrawal A, Feller-Kopman D, Kaul V, Shojaee S, Maldonado F. Use of fibrinolytics and deoxyribonuclease in adult patients with pleural empyema: a consensus statement. Lancet Respir Med. 2021;9.",Use of fibrinolytics and deoxyribonuclease in adult patients with pleural empyema: a consensus statement,Lancet Respir Med,2021,9,,,,,Chaddha U; Agrawal A; Feller-Kopman D; Kaul V; Shojaee S; Maldonado F
9,"Bedawi EO, George V, Rahman NM. A new approach to pleural infection: let it be?. Curr Pulmonol Rep. 2019;8.",A new approach to pleural infection: let it be?,Curr Pulmonol Rep,2019,8,,,,,Bedawi EO; George V; Rahman NM
10,"Khemasuwan D, Sorensen J, Griffin DC. Predictive variables for failure in administration of intrapleural tissue plasminogen activator/deoxyribonuclease in patients with complicated parapneumonic effusions/empyema. Chest. 2018;154.",Predictive variables for failure in administration of intrapleural tissue plasminogen activator/deoxyribonuclease in patients with complicated parapneumonic effusions/empyema,Chest,2018,154,,,,,Khemasuwan D; Sorensen J; Griffin DC
11,"Kim NY, Jang B, Gu K, Park YS, Kim Y, Cho J. Differential diagnosis of pleural effusion using machine learning. Ann Am Thorac Soc. 2024;21.",Differential diagnosis of pleural effusion using machine learning,Ann Am Thorac Soc,2024,21,,,,,Kim NY; Jang B; Gu K; Park YS; Kim Y; Cho J
12,"Cilloniz C, Ward L, Mogensen ML, Peric As JM, Us G, A. Machine-learning model for mortality prediction in patients with community-acquired pneumonia: development and validation study. Chest. 2023;163.",Machine-learning model for mortality prediction in patients with community-acquired pneumonia: development and validation study,Chest,2023,163,,,,,Cilloniz C; Ward L; Mogensen ML; Peric As JM; Us G; A
13,"Moll M, Qiao D, Regan EA, Hunninghake GM, Make BJ, Tal-Singer R. Machine learning and prediction of all-cause mortality in COPD. Chest. 2020;158.",Machine learning and prediction of all-cause mortality in COPD,Chest,2020,158,,,,,Moll M; Qiao D; Regan EA; Hunninghake GM; Make BJ; Tal-Singer R
14,"Zein JG, Wu C, Attaway AH, Zhang P, Nazha A. Novel machine learning can predict acute asthma exacerbation. Chest. 2021;159.",Novel machine learning can predict acute asthma exacerbation,Chest,2021,159,,,,,Zein JG; Wu C; Attaway AH; Zhang P; Nazha A
15,"Van Buuren S, Oudshoorn C. MICE: multivariate imputation by chained equations in R. J Stat Soft. 2011;45.",MICE: multivariate imputation by chained equations in R,J Stat Soft,2011,45,,,,,Van Buuren S; Oudshoorn C
16,"Azur MJ, Stuart EA, Frangakis C, Leaf PJ. Multiple imputation by chained equations: what is it and how does it work?. Int J Methods Psychiatr Res. 2011;20.",Multiple imputation by chained equations: what is it and how does it work?,Int J Methods Psychiatr Res,2011,20,,,,,Azur MJ; Stuart EA; Frangakis C; Leaf PJ
17,Breiman L. Bagging predictors. Mach Learn. 1996;24.,Bagging predictors,Mach Learn,1996,24,,,,,Breiman L
18,"Ke G, Meng Q, Finley T, Wang T, Ma CW, W. LightGBM: a highly efficient gradient boosting decision tree. Advances in Neural Information Processing Systems. 2017;30.",LightGBM: a highly efficient gradient boosting decision tree,Advances in Neural Information Processing Systems,2017,30,,,,,Ke G; Meng Q; Finley T; Wang T; Ma CW; W
19,"Chen T, Guestrin C. GBoost: a scalable tree boosting system. Proceedings of the 22nd ACM SIGKDD International Conference on Knowledge Discovery and Data Mining. 2016;None.",GBoost: a scalable tree boosting system,Proceedings of the 22nd ACM SIGKDD International Conference on Knowledge Discovery and Data Mining,2016,,,,,,Chen T; Guestrin C
20,"Kingma DP, Ba J. Adam: a method for stochastic optimization. Adam: a method for stochastic optimization. 2023;None.",Adam: a method for stochastic optimization,Adam: a method for stochastic optimization,2023,,,,,,Kingma DP; Ba J
21,"Power D. Evaluation: from precision, recall and F-measure to ROC, informedness, markedness and correlation. J Mach Learn Technol. 2011;2.","Evaluation: from precision, recall and F-measure to ROC, informedness, markedness and correlation",J Mach Learn Technol,2011,2,,,,,Power D
22,"Ng KH, Goh HK. Application of machine learning in medical diagnosis. J Med Syst. 2019;43:183.",Application of machine learning in medical diagnosis,J Med Syst,2019,43,,183,,,Ng KH; Goh HK
23,"Sokolova M, Lapalme G. A systematic analysis of performance measures for classification tasks. Inf Process Manage. 2009;45.",A systematic analysis of performance measures for classification tasks,Inf Process Manage,2009,45,,,,,Sokolova M; Lapalme G
24,"Abu-Daff S, Maziak DE, Alshehab D, Threader J, Ivanovic J, Deslaurier V. Intrapleural fibrinolytic therapy (IPFT) in loculated pleural effusions-analysis of predictors for failure of therapy and bleeding: a cohort study. BMJ Open. 2013;3:e001887.",Intrapleural fibrinolytic therapy (IPFT) in loculated pleural effusions-analysis of predictors for failure of therapy and bleeding: a cohort study,BMJ Open,2013,3,,e001887,,,Abu-Daff S; Maziak DE; Alshehab D; Threader J; Ivanovic J; Deslaurier V
25,"Piccolo F, Pitman N, Bhatnagar R, Popowicz N, Smith NA, Brockway B. Intrapleural tissue plasminogen activator and deoxyribonuclease for pleural infection: an effective and safe alternative to surgery. Ann Am Thorac Soc. 2014;11.",Intrapleural tissue plasminogen activator and deoxyribonuclease for pleural infection: an effective and safe alternative to surgery,Ann Am Thorac Soc,2014,11,,,,,Piccolo F; Pitman N; Bhatnagar R; Popowicz N; Smith NA; Brockway B
26,"Bishwakarma R, Shah S, Frank L, Zhang W, Sharma G, Nishi S. Mixing it up: coadministration of tPA/DNase in complicated parapneumonic pleural effusions and empyema. J Bronchology Interv Pulmonol. 2017;24.",Mixing it up: coadministration of tPA/DNase in complicated parapneumonic pleural effusions and empyema,J Bronchology Interv Pulmonol,2017,24,,,,,Bishwakarma R; Shah S; Frank L; Zhang W; Sharma G; Nishi S
27,"Kheir F, Cheng G, Rivera E, Folch A, Folch E, Fernandez-Bussy S. Concurrent versus sequential intrapleural instillation of tissue plasminogen activator and deoxyribonuclease for pleural infection. J Bronchology Interv Pulmonol. 2018;25.",Concurrent versus sequential intrapleural instillation of tissue plasminogen activator and deoxyribonuclease for pleural infection,J Bronchology Interv Pulmonol,2018,25,,,,,Kheir F; Cheng G; Rivera E; Folch A; Folch E; Fernandez-Bussy S
28,"Rajkomar A, Dean J, Kohane I. Machine learning in medicine. N Engl J Med. 2019;380.",Machine learning in medicine,N Engl J Med,2019,380,,,,,Rajkomar A; Dean J; Kohane I
29,"Wolpert DH, Macready WG. No free lunch theorems for optimization. IEEE Trans Evol Comput. 1997;1.",No free lunch theorems for optimization,IEEE Trans Evol Comput,1997,1,,,,,Wolpert DH; Macready WG
30,Nuzzo R. Statistical errors. Nature. 2014;506.,Statistical errors,Nature,2014,506,,,,,Nuzzo R
31,"Ioannidis JP, Tarone R, Mclaughlin JK. The false-positive to false-negative ratio in epidemiologic studies. Epidemiology. 2011;22.",The false-positive to false-negative ratio in epidemiologic studies,Epidemiology,2011,22,,,,,Ioannidis JP; Tarone R; Mclaughlin JK
32,"Bedawi EO, Stavroulias D, Hedley E et al.. Early video-assisted thoracoscopic surgery or intrapleural enzyme therapy in pleural infection: a feasibility randomized controlled trial. The Third Multicenter Intrapleural Sepsis Trial-MIST-3. Am J Respir Crit Care Med. 2023;208.",Early video-assisted thoracoscopic surgery or intrapleural enzyme therapy in pleural infection: a feasibility randomized controlled trial. The Third Multicenter Intrapleural Sepsis Trial-MIST-3,Am J Respir Crit Care Med,2023,208,,,,,Bedawi EO; Stavroulias D; Hedley E; Blyth KG; Kirk A; Fonseka D; D
