#,ama,title,journal,year,volume,issue,pages,doi,pmid,authors
1,"Loddenkemper R, Mathur PN, Noppen M. Medical Thoracoscopy/Pleuroscopy. Manual and Atlas. Medical Thoracoscopy/Pleuroscopy. Manual and Atlas. 2011;None.",Medical Thoracoscopy/Pleuroscopy. Manual and Atlas,Medical Thoracoscopy/Pleuroscopy. Manual and Atlas,2011,,,,,,Loddenkemper R; Mathur PN; Noppen M
2,"Seijo LM, Sterman DH. Interventional pulmonology. N Engl J Med. 2001;344.",Interventional pulmonology,N Engl J Med,2001,344,,,,,Seijo LM; Sterman DH
3,"Hooper CE, Lee Y, Maskell NA. Setting up a specialist pleural disease service. Respirology. 2010;15.",Setting up a specialist pleural disease service,Respirology,2010,15,,,,,Hooper CE; Lee Y; Maskell NA
4,"Loddenkemper R, Mathur PN, Lee P. History and clinical use of thoracoscopy/pleuroscopy in respiratory medicine. Breathe. 2011;8.",History and clinical use of thoracoscopy/pleuroscopy in respiratory medicine,Breathe,2011,8,,,,,Loddenkemper R; Mathur PN; Lee P
5,"Gru ¨ning W, Loddenkemper R. Medical thoracoscopy/ pleuroscopy procedure video. Medical thoracoscopy/ pleuroscopy procedure video. 2011;None.",Medical thoracoscopy/ pleuroscopy procedure video,Medical thoracoscopy/ pleuroscopy procedure video,2011,,,,,,Gru ¨ning W; Loddenkemper R
6,"Loddenkemper R, Haslam PL. European Standards for Training in Adult Respiratory Medicine: Syllabus. European Standards for Training in Adult Respiratory Medicine: Syllabus. 2008;None.",European Standards for Training in Adult Respiratory Medicine: Syllabus,European Standards for Training in Adult Respiratory Medicine: Syllabus,2008,,,,,,Loddenkemper R; Haslam PL
7,Loddenkemper R. Thoracoscopy -state of the art. Eur Respir J. 1998;11.,Thoracoscopy -state of the art,Eur Respir J,1998,11,,,,,Loddenkemper R
8,"Jacobaeus HC. U ¨ber die Mo ¨glichkeit, die Zystoskopie bei Untersuchungen sero ¨ser Ho ¨hlungen anzuwenden. [On the possibility to use cystoscopy to examine serous cavities. Mu ¨nch Med Wochenschr. 1910;40.","U ¨ber die Mo ¨glichkeit, die Zystoskopie bei Untersuchungen sero ¨ser Ho ¨hlungen anzuwenden. [On the possibility to use cystoscopy to examine serous cavities",Mu ¨nch Med Wochenschr,1910,40,,,,,Jacobaeus HC
