#,ama,title,journal,year,volume,issue,pages,doi,pmid,authors
91,"Fortin M, Lacasse Y, Elharrar X. Safety and efficacy of a fully covered self-expandable metallic stent in benign airway stenosis. Respiration. 2017;93(6).",Safety and efficacy of a fully covered self-expandable metallic stent in benign airway stenosis,Respiration,2017,93,6,,,,Fortin M; Lacasse Y; Elharrar X
92,"Grewal HS, Dangayach NS, Ahmad U, Ghosh S, Gildea T, Mehta AC. Treatment of tracheobronchial injuries: a contemporary review. Chest. 2019;155(3).",Treatment of tracheobronchial injuries: a contemporary review,Chest,2019,155,3,,,,Grewal HS; Dangayach NS; Ahmad U; Ghosh S; Gildea T; Mehta AC
93,"Dutau H, Breen D, Bugalho A. Current practice of airway stenting in the adult population in Europe: a survey of the European Association of Bronchology and Interventional Pulmonology (EABIP). Respiration. 2018;95(1).",Current practice of airway stenting in the adult population in Europe: a survey of the European Association of Bronchology and Interventional Pulmonology (EABIP),Respiration,2018,95,1,,,,Dutau H; Breen D; Bugalho A
94,"Shah SK, Jennings JH, Diaz-Mendoza JI, Yessayan L, Ray C, Simoff MJ. Removal of self-expanding metallic stents. J Bronchology Interv Pulmonol. 2016;23(4).",Removal of self-expanding metallic stents,J Bronchology Interv Pulmonol,2016,23,4,,,,Shah SK; Jennings JH; Diaz-Mendoza JI; Yessayan L; Ray C; Simoff MJ
95,"Noppen M, Stratakos G, 'haese D, Meysman J, Vinken M, W. Removal of covered self-expandable metallic airway stents in benign disorders: indications, technique, and outcomes. Chest. 2005;127(2).","Removal of covered self-expandable metallic airway stents in benign disorders: indications, technique, and outcomes",Chest,2005,127,2,,,,Noppen M; Stratakos G; 'haese D; Meysman J; Vinken M; W
96,"Alazemi S, Lunn W, Majid A. Outcomes, health-care resources use, and costs of endoscopic removal of metallic airway stents. Chest. 2010;138(2).","Outcomes, health-care resources use, and costs of endoscopic removal of metallic airway stents",Chest,2010,138,2,,,,Alazemi S; Lunn W; Majid A
97,"Murgu SD, Laxmanan B. Biomechanical properties of airway stents: implications for clinical practice. J Bronchology Interv Pulmonol. 2016;23(2).",Biomechanical properties of airway stents: implications for clinical practice,J Bronchology Interv Pulmonol,2016,23,2,,,,Murgu SD; Laxmanan B
98,"Dutau H, Musani AI, Laroumagne S, Darwiche K, Freitag L, Astoul P. Biodegradable airway stents-bench to bedside: a comprehensive review. Respiration. 2015;90(6).",Biodegradable airway stents-bench to bedside: a comprehensive review,Respiration,2015,90,6,,,,Dutau H; Musani AI; Laroumagne S; Darwiche K; Freitag L; Astoul P
99,"Cheng GZ, Jose Estepar S, Folch R et al.. Three-dimensional printing and 3D slicer: powerful tools in understanding and treating structural lung disease. Chest. 2016;149(5):100.",Three-dimensional printing and 3D slicer: powerful tools in understanding and treating structural lung disease,Chest,2016,149,5,100,,,Cheng GZ; Jose Estepar S; Folch R; Onieva E; Gangadharan J; Majid S; A
100,"Freitag L, Gordes M, Zarogoulidis P. Towards individualized tracheobronchial stents: technical, practical and legal considerations. Respiration. 2017;94(5).","Towards individualized tracheobronchial stents: technical, practical and legal considerations",Respiration,2017,94,5,,,,Freitag L; Gordes M; Zarogoulidis P
