#,ama,title,journal,year,volume,issue,pages,doi,pmid,authors
1,"Ernst A, Silvestri GA, Johnstone D, College A, Physicians C. Interventional pulmonary procedures: guidelines from the American College of Chest Physicians. Chest. 2003;123(5).",Interventional pulmonary procedures: guidelines from the American College of Chest Physicians,Chest,2003,123,5,,,,Ernst A; Silvestri GA; Johnstone D; College A; Physicians C
2,"Lund ME, Force S. Airway stenting for patients with benign airway disease and the Food and Drug Administration advisory: a call for restraint. Chest. 2007;132(4).",Airway stenting for patients with benign airway disease and the Food and Drug Administration advisory: a call for restraint,Chest,2007,132,4,,,,Lund ME; Force S
3,"Chapron J, Wermert D, Pimpec-Barthes L, F. Bronchial rupture related to endobronchial stenting in relapsing polychondritis. Eur Respir Rev. 2012;21(126).",Bronchial rupture related to endobronchial stenting in relapsing polychondritis,Eur Respir Rev,2012,21,126,,,,Chapron J; Wermert D; Pimpec-Barthes L; F
4,"Saad CP, Murthy S, Krizmanich G, Mehta AC. Self-expandable metallic airway stents and flexible bronchoscopy: long-term outcomes analysis. Chest. 2003;124(5).",Self-expandable metallic airway stents and flexible bronchoscopy: long-term outcomes analysis,Chest,2003,124,5,,,,Saad CP; Murthy S; Krizmanich G; Mehta AC
5,"Montaudon M, Berger P, De Dietrich G. Assessment of airways with three-dimensional quantitative thin-section CT: in vitro and in vivo validation. Radiology. 2007;242(2).",Assessment of airways with three-dimensional quantitative thin-section CT: in vitro and in vivo validation,Radiology,2007,242,2,,,,Montaudon M; Berger P; De Dietrich G
6,"Dalrymple NC, Prasad SR, Freckleton MW, Chintapalli KN. Informatics in radiology (infoRAD): introduction to the language of three-dimensional imaging with multidetector CT. Radiographics. 2005;25(5).",Informatics in radiology (infoRAD): introduction to the language of three-dimensional imaging with multidetector CT,Radiographics,2005,25,5,,,,Dalrymple NC; Prasad SR; Freckleton MW; Chintapalli KN
7,Boiselle PM. Imaging of the large airways. Clin Chest Med. 2008;29(1).,Imaging of the large airways,Clin Chest Med,2008,29,1,,,,Boiselle PM
8,"Boiselle PM, Ernst A. Recent advances in central airway imaging. Chest. 2002;121(5).",Recent advances in central airway imaging,Chest,2002,121,5,,,,Boiselle PM; Ernst A
9,"Downie G, Huang YY, Mcguire FR. Measurement accuracy of a novel stent-sizing device in the porcine airway. J Bronchology Interv Pulmonol. 2006;13(1).",Measurement accuracy of a novel stent-sizing device in the porcine airway,J Bronchology Interv Pulmonol,2006,13,1,,,,Downie G; Huang YY; Mcguire FR
10,"Dinkel HP, Triller J. Primary and long-term success of percutaneous biliary metallic endoprotheses (Wallstents) in malignant obstructive jaundice. Rofo. 2001;173(12).",Primary and long-term success of percutaneous biliary metallic endoprotheses (Wallstents) in malignant obstructive jaundice,Rofo,2001,173,12,,,,Dinkel HP; Triller J
11,"Freitag L, Eicker R, Linz B, Greschuchna D. Theoretical and experimental basis for the development of a dynamic airway stent. Eur Respir J. 1994;7(11).",Theoretical and experimental basis for the development of a dynamic airway stent,Eur Respir J,1994,7,11,,,,Freitag L; Eicker R; Linz B; Greschuchna D
12,"Freitag L, Eicker K, Donovan TJ, Dimov D. Mechanical properties of airway stents. J Bronchology Interv Pulmonol. 1995;2(4).",Mechanical properties of airway stents,J Bronchology Interv Pulmonol,1995,2,4,,,,Freitag L; Eicker K; Donovan TJ; Dimov D
13,"Mahtabi MJ, Shamsaei N, Mitchell MR. Fatigue of nitinol: the stateof-the-art and ongoing challenges. J Mech Behav Biomed Mater. 2015;50.",Fatigue of nitinol: the stateof-the-art and ongoing challenges,J Mech Behav Biomed Mater,2015,50,,,,,Mahtabi MJ; Shamsaei N; Mitchell MR
14,Cooper JD. Use of silicone tubes in the management of complex airway problems. Thorac Surg Clin. 2018;28(3).,Use of silicone tubes in the management of complex airway problems,Thorac Surg Clin,2018,28,3,,,,Cooper JD
15,"Lee HJ, Labaki W, Yu DH. Airway stent complications: the role of follow-up bronchoscopy as a surveillance method. J Thorac Dis. 2017;9(11).",Airway stent complications: the role of follow-up bronchoscopy as a surveillance method,J Thorac Dis,2017,9,11,,,,Lee HJ; Labaki W; Yu DH
16,"Panchabhai TS, Mehta AC. Historical perspectives of bronchoscopy. Connecting the dots. Ann Am Thorac Soc. 2015;12(5).",Historical perspectives of bronchoscopy. Connecting the dots,Ann Am Thorac Soc,2015,12,5,,,,Panchabhai TS; Mehta AC
17,Montgomery WW. T-tube tracheal stent. Arch Otolaryngol. 1965;82.,T-tube tracheal stent,Arch Otolaryngol,1965,82,,,,,Montgomery WW
18,"Wright KC, Wallace S, Charnsangavej C, Carrasco CH, Gianturco C. Percutaneous endovascular stents: an experimental evaluation. Radiology. 1985;156(1).",Percutaneous endovascular stents: an experimental evaluation,Radiology,1985,156,1,,,,Wright KC; Wallace S; Charnsangavej C; Carrasco CH; Gianturco C
19,"Sarodia BD, Dasgupta A, Mehta AC. Management of airway manifestations of relapsing polychondritis: case reports and review of literature. Chest. 1999;116(6).",Management of airway manifestations of relapsing polychondritis: case reports and review of literature,Chest,1999,116,6,,,,Sarodia BD; Dasgupta A; Mehta AC
20,"Rousseau H, Puel J, Joffre F. Self-expanding endovascular prosthesis: an experimental study. Radiology. 1987;164(3).",Self-expanding endovascular prosthesis: an experimental study,Radiology,1987,164,3,,,,Rousseau H; Puel J; Joffre F
21,"Rousseau H, Dahan M, Lauque D. Self-expandable prostheses in the tracheobronchial tree. Radiology. 1993;188(1).",Self-expandable prostheses in the tracheobronchial tree,Radiology,1993,188,1,,,,Rousseau H; Dahan M; Lauque D
22,"Nakajima Y, Kurihara Y, Niimi H. Efficacy and complications of the Gianturco-Z tracheobronchial stent for malignant airway stenosis. Cardiovasc Intervent Radiol. 1999;22(4).",Efficacy and complications of the Gianturco-Z tracheobronchial stent for malignant airway stenosis,Cardiovasc Intervent Radiol,1999,22,4,,,,Nakajima Y; Kurihara Y; Niimi H
23,"Monnier P, Mudry A, Stanzel F. The use of the covered Wallstent for the palliative treatment of inoperable tracheobronchial cancers. A prospective, multicenter study. Chest. 1996;110(5).","The use of the covered Wallstent for the palliative treatment of inoperable tracheobronchial cancers. A prospective, multicenter study",Chest,1996,110,5,,,,Monnier P; Mudry A; Stanzel F
24,"Hautmann H, Huber RM. Stent flexibility: an essential feature in the treatment of dynamic airway collapse. Eur Respir J. 1996;9(3).",Stent flexibility: an essential feature in the treatment of dynamic airway collapse,Eur Respir J,1996,9,3,,,,Hautmann H; Huber RM
25,"Breyer G, Haussinger K. Tracheobronchial stents-indications and possibilities. Pneumologie. 1991;45(12).",Tracheobronchial stents-indications and possibilities,Pneumologie,1991,45,12,,,,Breyer G; Haussinger K
26,"Hauck RW, Lembeck RM, Emslander HP, Schomig A. Implantation of Accuflex and Strecker stents in malignant bronchial stenoses by flexible bronchoscopy. Chest. 1997;112(1).",Implantation of Accuflex and Strecker stents in malignant bronchial stenoses by flexible bronchoscopy,Chest,1997,112,1,,,,Hauck RW; Lembeck RM; Emslander HP; Schomig A
27,Ebeid M. Balloon expandable stents for coarctation of the aorta: review of current status and technical considerations. Images Paediatr Cardiol. 2003;5(2).,Balloon expandable stents for coarctation of the aorta: review of current status and technical considerations,Images Paediatr Cardiol,2003,5,2,,,,Ebeid M
28,"Slonim SM, Razavi M, Kee S, Semba CP, Dake MD. Transbronchial Palmaz stent placement for tracheo-bronchial stenosis. J Vasc Intervent Radiol. 1998;9(1 pt 1).",Transbronchial Palmaz stent placement for tracheo-bronchial stenosis,J Vasc Intervent Radiol,1998,9,1 pt 1,,,,Slonim SM; Razavi M; Kee S; Semba CP; Dake MD
29,Mehta AC. AERO self-expanding hybrid stent for airway stenosis. Expert Rev Medical Devices. 2008;5(5).,AERO self-expanding hybrid stent for airway stenosis,Expert Rev Medical Devices,2008,5,5,,,,Mehta AC
30,"Tan JH, Fidelman N, Durack JC. Management of recurrent airway strictures in lung transplant recipients using AERO covered stents. J Vasc Intervent Radiol. 2010;21(12).",Management of recurrent airway strictures in lung transplant recipients using AERO covered stents,J Vasc Intervent Radiol,2010,21,12,,,,Tan JH; Fidelman N; Durack JC
31,"Ost DE, Shah AM, Lei X. Respiratory infections increase the risk of granulation tissue formation following airway stenting in patients with malignant airway obstruction. Chest. 2012;141(6).",Respiratory infections increase the risk of granulation tissue formation following airway stenting in patients with malignant airway obstruction,Chest,2012,141,6,,,,Ost DE; Shah AM; Lei X
32,Stent BU. None. None. 2018;None.,,,2018,,,,,,Stent BU
33,"Breitenbucher A, Chhajed PN, Brutsche MH, Mordasini C, Schilter D, Tamm M. Long-term follow-up and survival after Ultraflex stent insertion in the management of complex malignant airway stenoses. Respiration. 2008;75(4).",Long-term follow-up and survival after Ultraflex stent insertion in the management of complex malignant airway stenoses,Respiration,2008,75,4,,,,Breitenbucher A; Chhajed PN; Brutsche MH; Mordasini C; Schilter D; Tamm M
34,"Scientific B, Dynamicô. Stent. Stent. 2018;None.",Stent,Stent,2018,,,,,,Scientific B; Dynamicô
35,"Freitag L, Darwiche K. Endoscopic treatment of tracheal stenosis. Thorac Surg Clin. 2014;24(1).",Endoscopic treatment of tracheal stenosis,Thorac Surg Clin,2014,24,1,,,,Freitag L; Darwiche K
36,"Freitag L, Tekolf E, Stamatis G, Greschuchna D. Clinical evaluation of a new bifurcated dynamic airway stent: a 5-year experience with 135 patients. Thorac Cardiovasc Surg. 1997;45(1).",Clinical evaluation of a new bifurcated dynamic airway stent: a 5-year experience with 135 patients,Thorac Cardiovasc Surg,1997,45,1,,,,Freitag L; Tekolf E; Stamatis G; Greschuchna D
37,"Freitag L, Tekolf E, Steveling H, Donovan TJ, Stamatis G. Management of malignant esophagotracheal fistulas with airway stenting and double stenting. Chest. 1996;110(5).",Management of malignant esophagotracheal fistulas with airway stenting and double stenting,Chest,1996,110,5,,,,Freitag L; Tekolf E; Steveling H; Donovan TJ; Stamatis G
38,"Yarmus L, Gilbert C, Akulian J, Feller-Kopman D. Novel use of the GlideScope for rigid bronchoscopic placement of a Dynamic (Y) Stent. Ann Thorac Surg. 2012;94(1).",Novel use of the GlideScope for rigid bronchoscopic placement of a Dynamic (Y) Stent,Ann Thorac Surg,2012,94,1,,,,Yarmus L; Gilbert C; Akulian J; Feller-Kopman D
39,"Obeidat S, Badin S, Khawaja I. A new technique of deploying dynamic Y stent using flexible bronchoscope, video laryngoscope, and laryngeal mask airway. J Bronchology Interv Pulmonol. 2010;17(2).","A new technique of deploying dynamic Y stent using flexible bronchoscope, video laryngoscope, and laryngeal mask airway",J Bronchology Interv Pulmonol,2010,17,2,,,,Obeidat S; Badin S; Khawaja I
40,"Folch E, Keyes C. Airway stents. Ann Cardiothorac Surg. 2018;7(2).",Airway stents,Ann Cardiothorac Surg,2018,7,2,,,,Folch E; Keyes C
41,"Kazakov J, Khereba M, Thiffault V, Duranceau A, Ferraro P, Liberman M. Modified technique for tracheobronchial Y-stent insertion using flexible bronchoscope for stent guidance. J Thorac Cardiovasc Surg. 2015;150(4).",Modified technique for tracheobronchial Y-stent insertion using flexible bronchoscope for stent guidance,J Thorac Cardiovasc Surg,2015,150,4,,,,Kazakov J; Khereba M; Thiffault V; Duranceau A; Ferraro P; Liberman M
42, Food and Drug Administration. Food and Drug Administration. 2018;None.,Food and Drug Administration,Food and Drug Administration,2018,,,,,,
43,"Holden VK, Alape D, Chee AC, Parikh MS, Leclair T, Majid A. Safety and efficacy of a new fully covered self-expandable metallic airway stent. Safety and efficacy of a new fully covered self-expandable metallic airway stent. 2018;None. doi:10.1164/ajrccm-conference.2018.197.1_MeetingAbstracts.A7315.",Safety and efficacy of a new fully covered self-expandable metallic airway stent,Safety and efficacy of a new fully covered self-expandable metallic airway stent,2018,,,,10.1164/ajrccm-conference.2018.197.1_MeetingAbstracts.A7315,,Holden VK; Alape D; Chee AC; Parikh MS; Leclair T; Majid A
44,"Novatech, Silmetò. None. None. 2018;None.",,,2018,,,,,,Novatech; Silmetò
45,"Marchese R, Poidomani G, Paglino G et al.. Fully covered self-expandable metal stent in tracheobronchial disorders: clinical experience. Respiration. 2015;89(1).",Fully covered self-expandable metal stent in tracheobronchial disorders: clinical experience,Respiration,2015,89,1,,,,Marchese R; Poidomani G; Paglino G; Crimi C; Nigro L; Argano C; V
46, HANAROSTENTÒ Trachea/Bronchium (CCC). HANAROSTENTÒ Trachea/Bronchium (CCC). 2018;None.,HANAROSTENTÒ Trachea/Bronchium (CCC),HANAROSTENTÒ Trachea/Bronchium (CCC),2018,,,,,,
47, Micro-Tech. Nitinol stents. Micro-Tech. Nitinol stents. 2018;None.,Micro-Tech. Nitinol stents,Micro-Tech. Nitinol stents,2018,,,,,,
48,"Ozdemir C, Sokucu SN, Karasulu L, Onur ST, Dalar L. Placement of self-expandable bifurcated metallic stents without use of fluoroscopic and guidewire guidance to palliate central airway lesions. Multidiscip Respir Med. 2016;11:15.",Placement of self-expandable bifurcated metallic stents without use of fluoroscopic and guidewire guidance to palliate central airway lesions,Multidiscip Respir Med,2016,11,,15,,,Ozdemir C; Sokucu SN; Karasulu L; Onur ST; Dalar L
49,"Madan K, Dhooria S, Sehgal IS. A multicenter experience with the placement of self-expanding metallic tracheobronchial Y stents. J Bronchology Interv Pulmonol. 2016;23(1).",A multicenter experience with the placement of self-expanding metallic tracheobronchial Y stents,J Bronchology Interv Pulmonol,2016,23,1,,,,Madan K; Dhooria S; Sehgal IS
50,Taewoong. Niti-SÔ ComviÔ tracheobronchial stent. Niti-SÔ ComviÔ tracheobronchial stent. 2018;None.,Niti-SÔ ComviÔ tracheobronchial stent,Niti-SÔ ComviÔ tracheobronchial stent,2018,,,,,,Taewoong
51,"Kim JH, Shin JH, Song HY, Shim TS, Yoon CJ, Ko GY. Benign tracheobronchial strictures: long-term results and factors affecting airway patency after temporary stent placement. AJR Am J Roentgenolo. 2007;188(4).",Benign tracheobronchial strictures: long-term results and factors affecting airway patency after temporary stent placement,AJR Am J Roentgenolo,2007,188,4,,,,Kim JH; Shin JH; Song HY; Shim TS; Yoon CJ; Ko GY
52,"Shin JH, Hong SJ, Song HY. Placement of covered retrievable expandable metallic stents for pediatric tracheobronchial obstruction. J Vasc Intervent Radiol. 2006;17(2 pt 1).",Placement of covered retrievable expandable metallic stents for pediatric tracheobronchial obstruction,J Vasc Intervent Radiol,2006,17,2 pt 1,,,,Shin JH; Hong SJ; Song HY
53,Atrium. ATRIUM ICASTÔ balloon expandable covered stent. ATRIUM ICASTÔ balloon expandable covered stent. 2018;None.,ATRIUM ICASTÔ balloon expandable covered stent,ATRIUM ICASTÔ balloon expandable covered stent,2018,,,,,,Atrium
54,"Sethi S, Gildea TR, Almeida FA, Cicenia JC, Machuzak MS. Clinical success stenting distal bronchi for ""lobar salvage"" in bronchial stenosis. J Bronchology Interv Pulmonol. 2018;25(1).","Clinical success stenting distal bronchi for ""lobar salvage"" in bronchial stenosis",J Bronchology Interv Pulmonol,2018,25,1,,,,Sethi S; Gildea TR; Almeida FA; Cicenia JC; Machuzak MS
55,"Ernst A, Feller-Kopman D, Becker HD, Mehta AC. Central airway obstruction. Am J Respir Crit Care Med. 2004;169(12).",Central airway obstruction,Am J Respir Crit Care Med,2004,169,12,,,,Ernst A; Feller-Kopman D; Becker HD; Mehta AC
56,"Flannery A, Daneshvar C, Dutau H, Breen D. The art of rigid bronchoscopy and airway stenting. Clin Chest Med. 2018;39(1).",The art of rigid bronchoscopy and airway stenting,Clin Chest Med,2018,39,1,,,,Flannery A; Daneshvar C; Dutau H; Breen D
57,"Hurtgen M, Herber SC. Treatment of malignant tracheoesophageal fistula. Thorac Surg Clin. 2014;24(1).",Treatment of malignant tracheoesophageal fistula,Thorac Surg Clin,2014,24,1,,,,Hurtgen M; Herber SC
58,"Zhou C, Hu Y, Xiao Y, Yin W. Current treatment of tracheoesophageal fistula. Therapeutic Advances Respir Dis. 2017;11(4).",Current treatment of tracheoesophageal fistula,Therapeutic Advances Respir Dis,2017,11,4,,,,Zhou C; Hu Y; Xiao Y; Yin W
59,"Wang H, Tao M, Zhang N. Airway covered metallic stent based on different fistula location and size in malignant tracheoesophageal fistula. Am J Med Sci. 2015;350(5).",Airway covered metallic stent based on different fistula location and size in malignant tracheoesophageal fistula,Am J Med Sci,2015,350,5,,,,Wang H; Tao M; Zhang N
60,"Herth FJ, Peter S, Baty F, Eberhardt R, Leuppi JD, Chhajed PN. Combined airway and oesophageal stenting in malignant airwayoesophageal fistulas: a prospective study. Eur Respir J. 2010;36(6).",Combined airway and oesophageal stenting in malignant airwayoesophageal fistulas: a prospective study,Eur Respir J,2010,36,6,,,,Herth FJ; Peter S; Baty F; Eberhardt R; Leuppi JD; Chhajed PN
61,"Nomori H, Horio H, Imazu Y, Suemasu K. Double stenting for esophageal and tracheobronchial stenoses. Ann Thorac Surg. 2000;70(6).",Double stenting for esophageal and tracheobronchial stenoses,Ann Thorac Surg,2000,70,6,,,,Nomori H; Horio H; Imazu Y; Suemasu K
62,"Choudhary C, Gildea TR, Salman R, Guzman ED, Mehta AC. Management of tracheomediastinal fistula using self-expanding metallic stents. Ann Thorac Surg. 2008;85(5).",Management of tracheomediastinal fistula using self-expanding metallic stents,Ann Thorac Surg,2008,85,5,,,,Choudhary C; Gildea TR; Salman R; Guzman ED; Mehta AC
63,"Ranes JL, Budev MM, Murthy S, Mehta AC. Management of tracheomediastinal fistulas using self-expanding metallic stents. J Thorac Cardiovasc Surg. 2006;131(3).",Management of tracheomediastinal fistulas using self-expanding metallic stents,J Thorac Cardiovasc Surg,2006,131,3,,,,Ranes JL; Budev MM; Murthy S; Mehta AC
64,"Kent PD, Michet CJ, Jr, Luthra HS. Relapsing polychondritis. Curr Opin Rheumatol. 2004;16(1).",Relapsing polychondritis,Curr Opin Rheumatol,2004,16,1,,,,Kent PD; Michet CJ; Jr; Luthra HS
65,"Damiani JM, Levine HL. Relapsing polychondritis-report of ten cases. Laryngoscope. 1979;89(6 pt 1).",Relapsing polychondritis-report of ten cases,Laryngoscope,1979,89,6 pt 1,,,,Damiani JM; Levine HL
66,"Tso AS, Chung HS, Wu CY. Anesthetic management of a patient with relapsing polychondritis-a case report. Acta Anaesthesiol Sin. 2001;39(4).",Anesthetic management of a patient with relapsing polychondritis-a case report,Acta Anaesthesiol Sin,2001,39,4,,,,Tso AS; Chung HS; Wu CY
67,"Casas B, Fernandez-Bussy D, Folch S et al.. Non-malignant central airway obstruction [article in English, Spanish]. Arch Bronconeumol. 2014;50(8).","Non-malignant central airway obstruction [article in English, Spanish]",Arch Bronconeumol,2014,50,8,,,,Casas B; Fernandez-Bussy D; Folch S; E; Aldeyturriaga F; Majid J; A
68,"Ernst A, Rafeq S, Boiselle P. Relapsing polychondritis and airway involvement. Chest. 2009;135(4).",Relapsing polychondritis and airway involvement,Chest,2009,135,4,,,,Ernst A; Rafeq S; Boiselle P
69,"Eng J, Sabanathan S. Airway complications in relapsing polychondritis. Ann Thorac Surg. 1991;51(4).",Airway complications in relapsing polychondritis,Ann Thorac Surg,1991,51,4,,,,Eng J; Sabanathan S
70,"Faul JL, Kee ST, Rizk NW. Endobronchial stenting for severe airway obstruction in relapsing polychondritis. Chest. 1999;116(3).",Endobronchial stenting for severe airway obstruction in relapsing polychondritis,Chest,1999,116,3,,,,Faul JL; Kee ST; Rizk NW
71,"Dunne JA, Sabanathan S. Use of metallic stents in relapsing polychondritis. Chest. 1994;105(3).",Use of metallic stents in relapsing polychondritis,Chest,1994,105,3,,,,Dunne JA; Sabanathan S
72,"Murgu SD, Colt HG. Treatment of adult tracheobronchomalacia and excessive dynamic airway collapse: an update. Treatments Respir Med. 2006;5(2).",Treatment of adult tracheobronchomalacia and excessive dynamic airway collapse: an update,Treatments Respir Med,2006,5,2,,,,Murgu SD; Colt HG
73,"Hammond K, Ghori UK, Musani AI. Tracheobronchomalacia and excessive dynamic airway collapse. Clin Chest Med. 2018;39(1).",Tracheobronchomalacia and excessive dynamic airway collapse,Clin Chest Med,2018,39,1,,,,Hammond K; Ghori UK; Musani AI
74,"Majid A, Gaurav K, Sanchez JM. Evaluation of tracheobronchomalacia by dynamic flexible bronchoscopy. A pilot study. Ann Am Thorac Soc. 2014;11(6).",Evaluation of tracheobronchomalacia by dynamic flexible bronchoscopy. A pilot study,Ann Am Thorac Soc,2014,11,6,,,,Majid A; Gaurav K; Sanchez JM
75,"Murgu S, Colt H. Tracheobronchomalacia and excessive dynamic airway collapse. Clin Chest Med. 2013;34(3).",Tracheobronchomalacia and excessive dynamic airway collapse,Clin Chest Med,2013,34,3,,,,Murgu S; Colt H
76,"Ferguson GT, Benoist J. Nasal continuous positive airway pressure in the treatment of tracheobronchomalacia. Am Rev Respir Dis. 1993;147(2).",Nasal continuous positive airway pressure in the treatment of tracheobronchomalacia,Am Rev Respir Dis,1993,147,2,,,,Ferguson GT; Benoist J
77,"Ernst A, Majid A, Feller-Kopman D. Airway stabilization with silicone stents for treating adult tracheobronchomalacia: a prospective observational study. Chest. 2007;132(2).",Airway stabilization with silicone stents for treating adult tracheobronchomalacia: a prospective observational study,Chest,2007,132,2,,,,Ernst A; Majid A; Feller-Kopman D
78,"Majid A, Alape D, Kheir F. Short-term use of uncovered selfexpanding metallic airway stents for severe expiratory central airway collapse. Respiration. 2016;92(6).",Short-term use of uncovered selfexpanding metallic airway stents for severe expiratory central airway collapse,Respiration,2016,92,6,,,,Majid A; Alape D; Kheir F
79,"Frye L, Machuzak M. Airway complications after lung transplantation. Clin Chest Med. 2017;38(4).",Airway complications after lung transplantation,Clin Chest Med,2017,38,4,,,,Frye L; Machuzak M
80,"Mahajan AK, Folch E, Khandhar SJ. The diagnosis and management of airway complications following lung transplantation. Chest. 2017;152(3).",The diagnosis and management of airway complications following lung transplantation,Chest,2017,152,3,,,,Mahajan AK; Folch E; Khandhar SJ
81,"Crespo MM, Mccarthy DP, Hopkins PM. ISHLT Consensus Statement on adult and pediatric airway complications after lung transplantation: definitions, grading system, and therapeutics. J Heart Lung Transplant. 2018;37(5).","ISHLT Consensus Statement on adult and pediatric airway complications after lung transplantation: definitions, grading system, and therapeutics",J Heart Lung Transplant,2018,37,5,,,,Crespo MM; Mccarthy DP; Hopkins PM
82,"Luna BW, Paoletti L, Denlinger CE, Pastis NJ, Whelan TP. Closure of a post-transplant bronchial dehiscence with endobronchial fibrin sealant. Ann Thorac Surg. 2018;106(4).",Closure of a post-transplant bronchial dehiscence with endobronchial fibrin sealant,Ann Thorac Surg,2018,106,4,,,,Luna BW; Paoletti L; Denlinger CE; Pastis NJ; Whelan TP
83,"Mughal MM, Gildea TR, Murthy S, Pettersson G, Decamp M, Mehta AC. Short-term deployment of self-expanding metallic stents facilitates healing of bronchial dehiscence. Am J Respir Crit Care Med. 2005;172(6).",Short-term deployment of self-expanding metallic stents facilitates healing of bronchial dehiscence,Am J Respir Crit Care Med,2005,172,6,,,,Mughal MM; Gildea TR; Murthy S; Pettersson G; Decamp M; Mehta AC
84,"Saad CP, Ghamande SA, Minai OA. The role of selfexpandable metallic stents for the treatment of airway complications after lung transplantation. Transplantation. 2003;75(9).",The role of selfexpandable metallic stents for the treatment of airway complications after lung transplantation,Transplantation,2003,75,9,,,,Saad CP; Ghamande SA; Minai OA
85,"Murthy SC, Blackstone EH, Gildea TR. Impact of anastomotic airway complications after lung transplantation. Ann Thorac Surg. 2007;84(2).",Impact of anastomotic airway complications after lung transplantation,Ann Thorac Surg,2007,84,2,,,,Murthy SC; Blackstone EH; Gildea TR
86,Shepherd RW. Lobar airway stents: proceed with caution. J Bronchology Interv Pulmonol. 2018;25(1).,Lobar airway stents: proceed with caution,J Bronchology Interv Pulmonol,2018,25,1,,,,Shepherd RW
87,"Ost DE, Ernst A, Grosu HB. Complications following therapeutic bronchoscopy for malignant central airway obstruction: results of the AQuIRE Registry. Chest. 2015;148(2).",Complications following therapeutic bronchoscopy for malignant central airway obstruction: results of the AQuIRE Registry,Chest,2015,148,2,,,,Ost DE; Ernst A; Grosu HB
88,"Ost DE, Ernst A, Grosu HB. Therapeutic bronchoscopy for malignant central airway obstruction: success rates and impact on dyspnea and quality of life. Chest. 2015;147(5).",Therapeutic bronchoscopy for malignant central airway obstruction: success rates and impact on dyspnea and quality of life,Chest,2015,147,5,,,,Ost DE; Ernst A; Grosu HB
89,"Majid A, Kheir F, Chung J. Covered balloon-expanding stents in airway stenosis. J Bronchology Interv Pulmonol. 2017;24(2).",Covered balloon-expanding stents in airway stenosis,J Bronchology Interv Pulmonol,2017,24,2,,,,Majid A; Kheir F; Chung J
90,"Fruchter O, Raouf AE, Rosengarten B, Kramer D, MR. Longterm outcome of short metallic stents for lobar airway stenosis. J Bronchology Interv Pulmonol. 2017;24(3).",Longterm outcome of short metallic stents for lobar airway stenosis,J Bronchology Interv Pulmonol,2017,24,3,,,,Fruchter O; Raouf AE; Rosengarten B; Kramer D; MR
