#,ama,title,journal,year,volume,issue,pages,doi,pmid,authors
67,"Mcclave SA, Jafri NS. Spectrum of morbidity related to bolster placement at time of percutaneous endoscopic gastrostomy: Buried bumper syndrome to leakage and peritonitis. Gastrointestinal Endoscopy Clinics of North America. 2007;17(4).",Spectrum of morbidity related to bolster placement at time of percutaneous endoscopic gastrostomy: Buried bumper syndrome to leakage and peritonitis,Gastrointestinal Endoscopy Clinics of North America,2007,17,4,,,,Mcclave SA; Jafri NS
68,"Mekhail TM, Adelstein DJ, Rybicki LA, Larto MA, Saxton JP, Lavertu P. Enteral nutrition during the treatment of head and neck carcinoma: Is a percutaneous endoscopic gastrostomy tube preferable to a nasogastric tube?. Cancer. 2001;91(9).",Enteral nutrition during the treatment of head and neck carcinoma: Is a percutaneous endoscopic gastrostomy tube preferable to a nasogastric tube?,Cancer,2001,91,9,,,,Mekhail TM; Adelstein DJ; Rybicki LA; Larto MA; Saxton JP; Lavertu P
69,"Müller-Gerbes D, Aymaz S, Dormann AJ. Management of the buried bumper syndrome: A new minimally invasive technique-the push method. Zeitschrift für Gastroenterolie. 2009;47.",Management of the buried bumper syndrome: A new minimally invasive technique-the push method,Zeitschrift für Gastroenterolie,2009,47,,,,,Müller-Gerbes D; Aymaz S; Dormann AJ
70,"Nguyen NP, North D, Smith HJ et al.. Safety and effectiveness of prophylactic gastrostomy tubes for head and neck cancer patients undergoing chemoradiation. Supportive Care in Cancer. 2006;15(4).",Safety and effectiveness of prophylactic gastrostomy tubes for head and neck cancer patients undergoing chemoradiation,Supportive Care in Cancer,2006,15,4,,,,Nguyen NP; North D; Smith HJ; Dutta S; Alfi Eri A; Karlsson U; Sallah S
71,"Schapiro GD, Edmundowicz SA. Complications of percutaneous endoscopic gastrostomy. Gastrointestinal Endoscopy Clinics of North America. 1996;6.",Complications of percutaneous endoscopic gastrostomy,Gastrointestinal Endoscopy Clinics of North America,1996,6,,,,,Schapiro GD; Edmundowicz SA
72,"Schmitt F, Caldari D, Corradini N et al.. Tolerance and effi cacy of preventive gastrostomy feeding in pediatric oncology. Pediatric Blood & Cancer. 2012;59(5).",Tolerance and effi cacy of preventive gastrostomy feeding in pediatric oncology,Pediatric Blood & Cancer,2012,59,5,,,,Schmitt F; Caldari D; Corradini N; Gicquel P; Lutz P; Leclair MD; Podevin G
73,"Schrag SP, Sharma R, Jaik NP et al.. Complications related to percutaneous endoscopic gastrostomy (PEG) tubes. A comprehensive clinical review. Journal of Gastrointestinal and Liver Diseases. 2007;16(4).",Complications related to percutaneous endoscopic gastrostomy (PEG) tubes. A comprehensive clinical review,Journal of Gastrointestinal and Liver Diseases,2007,16,4,,,,Schrag SP; Sharma R; Jaik NP; Seamon MJ; Lukaszczyk JJ; Martin ND; Stawicki SP
74,"Scolapio JS, Spangler PR, Romano MM, Mclaughlin MP, Salassa JR. Prophylactic placement of gastrostomy feeding tubes before radiotherapy in patients with head and neck cancer: Is it worthwhile. Journal of Clinical Gastroenterology. 2001;33(3).",Prophylactic placement of gastrostomy feeding tubes before radiotherapy in patients with head and neck cancer: Is it worthwhile,Journal of Clinical Gastroenterology,2001,33,3,,,,Scolapio JS; Spangler PR; Romano MM; Mclaughlin MP; Salassa JR
75,"Shaver WA, Winer SF, Snyder EJ. Gastrostomy: A simple and effective technique. Southern Medical Journal. 2014;81.",Gastrostomy: A simple and effective technique,Southern Medical Journal,2014,81,,,,,Shaver WA; Winer SF; Snyder EJ
76,"Singh D, Laya AS, Vaidya OU, Ahmed SA, Bonham AJ, Clarkston WK. Risk of bleeding after percutaneous endoscopic gastrostomy (PEG). Digestive Diseases and Sciences. 2012;57(4).",Risk of bleeding after percutaneous endoscopic gastrostomy (PEG),Digestive Diseases and Sciences,2012,57,4,,,,Singh D; Laya AS; Vaidya OU; Ahmed SA; Bonham AJ; Clarkston WK
77,"Smith BM, Perring P, Engoren M, Sferra JJ. Hospital and long-term outcome after percutaneous endoscopic gastrostomy. Surgical Endoscopy. 2008;22.",Hospital and long-term outcome after percutaneous endoscopic gastrostomy,Surgical Endoscopy,2008,22,,,,,Smith BM; Perring P; Engoren M; Sferra JJ
78,"Tracey DL, Patterson GE. Care of Peg tube in the home. Home Healthcare Nurse. 2006;24(6).",Care of Peg tube in the home,Home Healthcare Nurse,2006,24,6,,,,Tracey DL; Patterson GE
79,"Tucker AT, Gourin CG, Ghegan MD, Porubsky ES, Martindale RG, Terris DJ. Push"" versus ""pull"" percutaneous endoscopic gastrostomy tube placement in patients with advanced head and neck cancer. The Laryngoscope. 2003;113(11).","Push"" versus ""pull"" percutaneous endoscopic gastrostomy tube placement in patients with advanced head and neck cancer",The Laryngoscope,2003,113,11,,,,Tucker AT; Gourin CG; Ghegan MD; Porubsky ES; Martindale RG; Terris DJ
80,"Vanis N, Saray A, Gornjakovic S, Mesihovic R. Percutaneous endoscopic gastrostomy (PEG): Retrospective analysis of a 7-year clinical experience. Acta Informatica Medica. 2012;20(4).",Percutaneous endoscopic gastrostomy (PEG): Retrospective analysis of a 7-year clinical experience,Acta Informatica Medica,2012,20,4,,,,Vanis N; Saray A; Gornjakovic S; Mesihovic R
81,"Vyawahare MA, Shirodkar M, Gharat A, Patil P, Mehta S, Mohandas KM. A comparative observational study of early versus delayed feeding after percutaneous endoscopic gastrostomy. Indian Journal of Gastroenterology. 2013;32(6).",A comparative observational study of early versus delayed feeding after percutaneous endoscopic gastrostomy,Indian Journal of Gastroenterology,2013,32,6,,,,Vyawahare MA; Shirodkar M; Gharat A; Patil P; Mehta S; Mohandas KM
82,"Wang J, Liu M, Liu C, Ye Y, Huang G. Percutaneous endoscopic gastrostomy versus nasogastric tube feeding for patients with head and neck cancer: A systematic review. Journal of Radiation Research. 2014;55(3).",Percutaneous endoscopic gastrostomy versus nasogastric tube feeding for patients with head and neck cancer: A systematic review,Journal of Radiation Research,2014,55,3,,,,Wang J; Liu M; Liu C; Ye Y; Huang G
83,"Wiggenraad RG, Flierman L, Goossens A et al.. Prophylactic gastrostomy placement and early tube feeding may limit loss of weight during chemoradiotherapy for advanced head and neck cancer, a preliminary study. Clinical Otolaryngology. 2007;32(5).","Prophylactic gastrostomy placement and early tube feeding may limit loss of weight during chemoradiotherapy for advanced head and neck cancer, a preliminary study",Clinical Otolaryngology,2007,32,5,,,,Wiggenraad RG; Flierman L; Goossens A; Brand R; Verschuur HP; Croll GA; Vriesendorp R
84,"Yagüe-Sebastián MM, Sanjuán-Domingo R, Villaverde-Royo MV, Ruiz-Bueno MP, Elías-Villanueva MP. Replacing percutaneous endoscopic gastrostomy with the collaboration of the endoscopy and the primary care home care support teams. An effi cient and safe experience. Semergen/Sociedad Española de Medicina Rural y Generalista. 2013;39.",Replacing percutaneous endoscopic gastrostomy with the collaboration of the endoscopy and the primary care home care support teams. An effi cient and safe experience,Semergen/Sociedad Española de Medicina Rural y Generalista,2013,39,,,,,Yagüe-Sebastián MM; Sanjuán-Domingo R; Villaverde-Royo MV; Ruiz-Bueno MP; Elías-Villanueva MP
