#,ama,title,journal,year,volume,issue,pages,doi,pmid,authors
81,"Liao R, Li JY, Liu GY. Comparison of sevoflurane volatile induction/maintenance anaesthesia and propofol-remifentanil total intravenous anaesthesia for rigid bronchoscopy under spontaneous breathing for tracheal/bronchial foreign body removal in children. Eur J Anaesthesiol. 2010;27(11).",Comparison of sevoflurane volatile induction/maintenance anaesthesia and propofol-remifentanil total intravenous anaesthesia for rigid bronchoscopy under spontaneous breathing for tracheal/bronchial foreign body removal in children,Eur J Anaesthesiol,2010,27,11,,,,Liao R; Li JY; Liu GY
82,"Ehsan Z, Mahmoud M, Shott SR. The effects of anesthesia and opioids on the upper airway: a systematic review. Laryngoscope. 2016;126(1).",The effects of anesthesia and opioids on the upper airway: a systematic review,Laryngoscope,2016,126,1,,,,Ehsan Z; Mahmoud M; Shott SR
83,"Ansermino JM, Magruder W, Dosani M. Spontaneous respiration during intravenous anesthesia in children. Curr Opin Anaesthesiol. 2009;22(3).",Spontaneous respiration during intravenous anesthesia in children,Curr Opin Anaesthesiol,2009,22,3,,,,Ansermino JM; Magruder W; Dosani M
84,"Zhang H, Fang B, Zhou W. The efficacy of dexmedetomidine-remifentanil versus dexmedetomidine-propofol in children undergoing flexible bronchoscopy: a retrospective trial. Medicine. 2017;96(1):5815.",The efficacy of dexmedetomidine-remifentanil versus dexmedetomidine-propofol in children undergoing flexible bronchoscopy: a retrospective trial,Medicine,2017,96,1,5815,,,Zhang H; Fang B; Zhou W
85,"Oberer C, Von Ungern-Sternberg BS, Frei FJ. Respiratory reflex responses of the larynx differ between sevoflurane and propofol in pediatric patients. Anesthesiology. 2005;103(6).",Respiratory reflex responses of the larynx differ between sevoflurane and propofol in pediatric patients,Anesthesiology,2005,103,6,,,,Oberer C; Von Ungern-Sternberg BS; Frei FJ
86,"Ma XX, Fang XM, Hou TN. Comparison of the effectiveness of dexmedetomidine versus propofol target-controlled infusion for sedation during coblation-assisted upper airway procedure. Chin Med J (Engl). 2012;125(5).",Comparison of the effectiveness of dexmedetomidine versus propofol target-controlled infusion for sedation during coblation-assisted upper airway procedure,Chin Med J (Engl),2012,125,5,,,,Ma XX; Fang XM; Hou TN
87,"Mahmoud M, Gunter J, Donnelly LF. A comparison of dexmedetomidine with propofol for magnetic resonance imaging sleep studies in children. Anesth Analg. 2009;109(3).",A comparison of dexmedetomidine with propofol for magnetic resonance imaging sleep studies in children,Anesth Analg,2009,109,3,,,,Mahmoud M; Gunter J; Donnelly LF
88,"Mahmoud M, Jung D, Salisbury S. Effect of increasing depth of dexmedetomidine and propofol anesthesia on upper airway morphology in children and adolescents with obstructive sleep apnea. J Clin Anesth. 2013;25(7).",Effect of increasing depth of dexmedetomidine and propofol anesthesia on upper airway morphology in children and adolescents with obstructive sleep apnea,J Clin Anesth,2013,25,7,,,,Mahmoud M; Jung D; Salisbury S
89,"Mahmoud M, Radhakrishman R, Gunter J. Effect of increasing depth of dexmedetomidine anesthesia on upper airway morphology in children. Paediatr Anaesth. 2010;20(6).",Effect of increasing depth of dexmedetomidine anesthesia on upper airway morphology in children,Paediatr Anaesth,2010,20,6,,,,Mahmoud M; Radhakrishman R; Gunter J
90,"Eikermann M, Grosse-Sundrup M, Zaremba S. Ketamine activates breathing and abolishes the coupling between loss of consciousness and upper airway dilator muscle dysfunction. Anesthesiology. 2012;116(1).",Ketamine activates breathing and abolishes the coupling between loss of consciousness and upper airway dilator muscle dysfunction,Anesthesiology,2012,116,1,,,,Eikermann M; Grosse-Sundrup M; Zaremba S
91,"Kandil A, Subramanyam R, Hossain MM. Comparison of the combination of dexmedetomidine and ketamine to propofol or propofol/sevoflurane for drug-induced sleep endoscopy in children. Paediatr Anaesth. 2016;26(7).",Comparison of the combination of dexmedetomidine and ketamine to propofol or propofol/sevoflurane for drug-induced sleep endoscopy in children,Paediatr Anaesth,2016,26,7,,,,Kandil A; Subramanyam R; Hossain MM
92,"Fadaizadeh L, Hoseyni MS, Shajareh E. Use of bispectral index score for interventional bronchoscopy procedures. Tanaffos. 2015;14(4).",Use of bispectral index score for interventional bronchoscopy procedures,Tanaffos,2015,14,4,,,,Fadaizadeh L; Hoseyni MS; Shajareh E
93,"Powers KS, Nazarian EB, Tapyrik SA. Bispectral index as a guide for titration of propofol during procedural sedation among children. Pediatrics. 2005;115(6).",Bispectral index as a guide for titration of propofol during procedural sedation among children,Pediatrics,2005,115,6,,,,Powers KS; Nazarian EB; Tapyrik SA
94,"Chrissian AA, Bedi H. Bronchoscopist-directed continuous propofol infusion for targeting moderate sedation during endobronchial ultrasound bronchoscopy: a practical and effective protocol. J Bronchology Interv Pulmonol. 2015;22(3).",Bronchoscopist-directed continuous propofol infusion for targeting moderate sedation during endobronchial ultrasound bronchoscopy: a practical and effective protocol,J Bronchology Interv Pulmonol,2015,22,3,,,,Chrissian AA; Bedi H
95,"Dang D, Robinson PC, Winnicki S. The safety of flexible fibre-optic bronchoscopy and proceduralist-administered sedation: a tertiary referral centre experience. Intern Med J. 2012;42(3).",The safety of flexible fibre-optic bronchoscopy and proceduralist-administered sedation: a tertiary referral centre experience,Intern Med J,2012,42,3,,,,Dang D; Robinson PC; Winnicki S
96,"Grendelmeier P, Kurer G, Pflimlin E. Feasibility and safety of propofol sedation in flexible bronchoscopy. Swiss Med Wkly. 2011;141:13248.",Feasibility and safety of propofol sedation in flexible bronchoscopy,Swiss Med Wkly,2011,141,,13248,,,Grendelmeier P; Kurer G; Pflimlin E
97,"Hassan C, Rex DK, Cooper GS. Endoscopistdirected propofol administration versus anesthesiologist assistance for colorectal cancer screening: a cost-effectiveness analysis. Endoscopy. 2012;44(5).",Endoscopistdirected propofol administration versus anesthesiologist assistance for colorectal cancer screening: a cost-effectiveness analysis,Endoscopy,2012,44,5,,,,Hassan C; Rex DK; Cooper GS
98,"Schulze M, Grande B, Kolbe M. SafAIRway: an airway training for pulmonologists performing a flexible bronchoscopy with nonanesthesiologist administered propofol sedation: a prospective evaluation. Medicine. 2016;95(23):3849.",SafAIRway: an airway training for pulmonologists performing a flexible bronchoscopy with nonanesthesiologist administered propofol sedation: a prospective evaluation,Medicine,2016,95,23,3849,,,Schulze M; Grande B; Kolbe M
