#,ama,title,journal,year,volume,issue,pages,doi,pmid,authors
1, The WHO family of international classifications. The WHO family of international classifications. 2006;None.,The WHO family of international classifications,The WHO family of international classifications,2006,,,,,,
2,"Murgu SD, Colt HG. Description of a multidimensional classification system for patients with expiratory central airway collapse. Respirology. 2007;12.",Description of a multidimensional classification system for patients with expiratory central airway collapse,Respirology,2007,12,,,,,Murgu SD; Colt HG
3,"Murgu SD, Colt HG. Tracheobronchomalacia and excessive dynamic airway collapse. Respirology. 2006;11.",Tracheobronchomalacia and excessive dynamic airway collapse,Respirology,2006,11,,,,,Murgu SD; Colt HG
4,"Park JG, Edell ES. Dynamic airway collapse. Different from tracheomalacia. Rev Port Pneumol. 2005;11.",Dynamic airway collapse. Different from tracheomalacia,Rev Port Pneumol,2005,11,,,,,Park JG; Edell ES
5,"Kalra A, Abouzgheib W, Gajera M. Excessive dynamic airway collapse for the internist: new nomenclature or different entity?. Postgrad Med J. 2011;87.",Excessive dynamic airway collapse for the internist: new nomenclature or different entity?,Postgrad Med J,2011,87,,,,,Kalra A; Abouzgheib W; Gajera M
6,"Boiselle PM, Michaud G, Roberts DH. Dynamic expiratory tracheal collapse in COPD: correlation with clinical and physiological parameters. Chest. 2012;142(6).",Dynamic expiratory tracheal collapse in COPD: correlation with clinical and physiological parameters,Chest,2012,142,6,,,,Boiselle PM; Michaud G; Roberts DH
7,"Aquino SL, Shepard JA, Ginns LC. Acquired tracheomalacia: detection by expiratory CT scan. J Comput Assist Tomogr. 2001;25.",Acquired tracheomalacia: detection by expiratory CT scan,J Comput Assist Tomogr,2001,25,,,,,Aquino SL; Shepard JA; Ginns LC
8,"Stern EJ, Graham CM, Webb WR. Normal trachea during forced expiration: dynamic CT measurements. Radiology. 1993;187.",Normal trachea during forced expiration: dynamic CT measurements,Radiology,1993,187,,,,,Stern EJ; Graham CM; Webb WR
9,Nuutinen J. Acquired tracheobronchomalacia. A clinical study with bronchological correlations. Ann Clin Res. 1977;9.,Acquired tracheobronchomalacia. A clinical study with bronchological correlations,Ann Clin Res,1977,9,,,,,Nuutinen J
10,"Masaoka A, Yamakawa Y, Niwa H. Pediatric and adult tracheobronchomalacia. Eur J Cardiothorac Surg. 1996;10.",Pediatric and adult tracheobronchomalacia,Eur J Cardiothorac Surg,1996,10,,,,,Masaoka A; Yamakawa Y; Niwa H
11,"Sverzellati N, Rastelli A, Chetta A. Airway malacia in chronic obstructive pulmonary disease: prevalence, morphology and relationship with emphysema, bronchiectasis and bronchial wall thickening. Eur Radiol. 2009;19.","Airway malacia in chronic obstructive pulmonary disease: prevalence, morphology and relationship with emphysema, bronchiectasis and bronchial wall thickening",Eur Radiol,2009,19,,,,,Sverzellati N; Rastelli A; Chetta A
12,"Boiselle PM, Donnell O, Bankier CR, AA. Tracheal collapsibility in healthy volunteers during forced expiration: assessment with multidetector CT. Radiology. 2009;252.",Tracheal collapsibility in healthy volunteers during forced expiration: assessment with multidetector CT,Radiology,2009,252,,,,,Boiselle PM; Donnell O; Bankier CR; AA
13,Rayl JE. Tracheobronchial collapse during cough. Radiology. 1965;85.,Tracheobronchial collapse during cough,Radiology,1965,85,,,,,Rayl JE
14,"Johnson TH, Mikita JJ, Wilson RJ. Acquired tracheomalacia. Radiology. 1973;109.",Acquired tracheomalacia,Radiology,1973,109,,,,,Johnson TH; Mikita JJ; Wilson RJ
15,"Feist JH, Johnson TH, Wilson RJ. Acquired tracheomalacia: etiology and differential diagnosis. Chest. 1975;68.",Acquired tracheomalacia: etiology and differential diagnosis,Chest,1975,68,,,,,Feist JH; Johnson TH; Wilson RJ
16,"Thiriet M, Maarek JM, Chartrand DA. Transverse images of the human thoracic trachea during forced expiration. J Appl Physiol. 1989;67.",Transverse images of the human thoracic trachea during forced expiration,J Appl Physiol,1989,67,,,,,Thiriet M; Maarek JM; Chartrand DA
17,"Litmanovich D, Donnell O, Bankier CR, AA. Bronchial collapsibility at forced expiration in healthy volunteers: assessment with multidetector CT. Radiology. 2010;257.",Bronchial collapsibility at forced expiration in healthy volunteers: assessment with multidetector CT,Radiology,2010,257,,,,,Litmanovich D; Donnell O; Bankier CR; AA
18,"Brouns M, Jayaraju ST, Lacor C. Tracheal stenosis: a flow dynamics study. J Appl Physiol. 2007;102.",Tracheal stenosis: a flow dynamics study,J Appl Physiol,2007,102,,,,,Brouns M; Jayaraju ST; Lacor C
19,"Jokinen K, Palva T, Sutinen S. Acquired tracheobronchomalacia. Ann Clin Res. 1977;9.",Acquired tracheobronchomalacia,Ann Clin Res,1977,9,,,,,Jokinen K; Palva T; Sutinen S
20,"Joosten S, Macdonald M, Lau KK. Excessive dynamic airway collapse co-morbid with COPD diagnosed using 320-slice dynamic CT scanning technology. Thorax. 2012;67.",Excessive dynamic airway collapse co-morbid with COPD diagnosed using 320-slice dynamic CT scanning technology,Thorax,2012,67,,,,,Joosten S; Macdonald M; Lau KK
21,"¨lu ¨kbas B, Bergmann S, Fisseler-Eckhoff T, A. Short-and long-term outcome of sleeve resections in the elderly. Eur J Cardiothorac Surg. 2010;37.",Short-and long-term outcome of sleeve resections in the elderly,Eur J Cardiothorac Surg,2010,37,,,,,¨lu ¨kbas B; Bergmann S; Fisseler-Eckhoff T; A
22,"Represas R, C, ´ndez-Villar F, Garcı ´a-Tejedor A, JL. Excessive dynamic airway collapse: a new disease. Rev Clin Esp. 2010;210.",Excessive dynamic airway collapse: a new disease,Rev Clin Esp,2010,210,,,,,Represas R; C; ´ndez-Villar F; Garcı ´a-Tejedor A; JL
23,"Tamura Y, Sakatani K, Yamakoshi N. A case of severe COPD associated with tracheo-bronchial stenosis, treated with non-invasive positive pressure ventilation. Nihon Kokyuki Gakkai Zasshi. 2008;46.","A case of severe COPD associated with tracheo-bronchial stenosis, treated with non-invasive positive pressure ventilation",Nihon Kokyuki Gakkai Zasshi,2008,46,,,,,Tamura Y; Sakatani K; Yamakoshi N
24,"O'donnell CR, Litmanovich D, Loring SH. Age and gender dependence of forced expiratory central airway collapse in healthy volunteers. Chest. 2012;142(1).",Age and gender dependence of forced expiratory central airway collapse in healthy volunteers,Chest,2012,142,1,,,,O'donnell CR; Litmanovich D; Loring SH
25,"Healy F, Wilson AF, Fairshter RD. Physiologic correlates of airway collapse in chronic airflow obstruction. Chest. 1984;85.",Physiologic correlates of airway collapse in chronic airflow obstruction,Chest,1984,85,,,,,Healy F; Wilson AF; Fairshter RD
26,"Campbell AH, Faulks LW. Expiratory air-flow pattern in tracheobronchial collapse. Am Rev Respir Dis. 1965;92.",Expiratory air-flow pattern in tracheobronchial collapse,Am Rev Respir Dis,1965,92,,,,,Campbell AH; Faulks LW
27,"Baydur A, Wilkinson L, Mehdian R. Extrathoracic expiratory flow limitation in obesity and obstructive and restrictive disorders: effects of increasing negative expiratory pressure. Chest. 2004;125.",Extrathoracic expiratory flow limitation in obesity and obstructive and restrictive disorders: effects of increasing negative expiratory pressure,Chest,2004,125,,,,,Baydur A; Wilkinson L; Mehdian R
28,"Behazin N, Jones SB, Cohen RI. Respiratory restriction and elevated pleural and esophageal pressures in morbid obesity. J Appl Physiol. 2010;108.",Respiratory restriction and elevated pleural and esophageal pressures in morbid obesity,J Appl Physiol,2010,108,,,,,Behazin N; Jones SB; Cohen RI
29,"Steier J, Jolley CJ, Seymour J. Obese patients develop an intrinsic positive end expiratory pressure (PEEP) when supine. Am J Respir Crit Care Med. 2008;177:A275.",Obese patients develop an intrinsic positive end expiratory pressure (PEEP) when supine,Am J Respir Crit Care Med,2008,177,,A275,,,Steier J; Jolley CJ; Seymour J
30,"Mead J, Turner JM, Macklem PT. Significance of the relationship between lung recoil and maximum expiratory flow. J Appl Physiol. 1967;22.",Significance of the relationship between lung recoil and maximum expiratory flow,J Appl Physiol,1967,22,,,,,Mead J; Turner JM; Macklem PT
31,"Dawson SV, Elliott EA. Wave-speed limitation on expiratory flow-a unifying concept. J Appl Physiol. 1977;43.",Wave-speed limitation on expiratory flow-a unifying concept,J Appl Physiol,1977,43,,,,,Dawson SV; Elliott EA
32,"Macklem PT, Fraser RG, Brown WG. The detection of the flow-limiting bronchi in bronchitis and emphysema by airway pressure measurements. Med Thorac. 1965;22.",The detection of the flow-limiting bronchi in bronchitis and emphysema by airway pressure measurements,Med Thorac,1965,22,,,,,Macklem PT; Fraser RG; Brown WG
33,"Macklem PT, Wilson NJ. Measurement of intrabronchial pressure in man. J Appl Physiol. 1965;20.",Measurement of intrabronchial pressure in man,J Appl Physiol,1965,20,,,,,Macklem PT; Wilson NJ
34,"Smaldone GC, Smith PL. Location of flow-limiting segments via airway catheters near residual volume in humans. J Appl Physiol. 1985;59.",Location of flow-limiting segments via airway catheters near residual volume in humans,J Appl Physiol,1985,59,,,,,Smaldone GC; Smith PL
35,"Baram D, Smaldone G. Tracheal collapse versus tracheobronchomalacia: normal function versus disease. Am J Respir Crit Care Med. 2006;174:724.",Tracheal collapse versus tracheobronchomalacia: normal function versus disease,Am J Respir Crit Care Med,2006,174,,724,,,Baram D; Smaldone G
36,"Pedersen OF, Brackel HJ, Bogaard JM. Wave-speed-determined flow limitation at peak flow in normal and asthmatic subjects. J Appl Physiol. 1997;83.",Wave-speed-determined flow limitation at peak flow in normal and asthmatic subjects,J Appl Physiol,1997,83,,,,,Pedersen OF; Brackel HJ; Bogaard JM
37,"Nishine H, Hiramoto T, Kida H. Assessing the site of maximal obstruction in the trachea using lateral pressure measurement during bronchoscopy. Am J Respir Crit Care Med. 2012;185.",Assessing the site of maximal obstruction in the trachea using lateral pressure measurement during bronchoscopy,Am J Respir Crit Care Med,2012,185,,,,,Nishine H; Hiramoto T; Kida H
38,"Pedersen OF, Ingram RH. Configuration of maximum expiratory flow volume curve: model experiments with physiological implications. J Appl Physiol. 1985;58.",Configuration of maximum expiratory flow volume curve: model experiments with physiological implications,J Appl Physiol,1985,58,,,,,Pedersen OF; Ingram RH
39,"Miyazawa T, Nishine H, Handa H. Migration of the choke point in relapsing polychondritis after stenting. Chest. 2009;136:81S.",Migration of the choke point in relapsing polychondritis after stenting,Chest,2009,136,,81S,,,Miyazawa T; Nishine H; Handa H
40,"Miyazawa T, Miyazu Y, Iwamoto Y. Stenting at the flow-limiting segment in tracheobronchial stenosis due to lung cancer. Am J Respir Crit Care Med. 2004;169.",Stenting at the flow-limiting segment in tracheobronchial stenosis due to lung cancer,Am J Respir Crit Care Med,2004,169,,,,,Miyazawa T; Miyazu Y; Iwamoto Y
41,"Brackel HJ, Pedersen OF, Mulder PG. Central airways behave more stiffly during forced expiration in patients with asthma. Am J Respir Crit Care Med. 2000;162(3 Pt 1).",Central airways behave more stiffly during forced expiration in patients with asthma,Am J Respir Crit Care Med,2000,162,3 Pt 1,,,,Brackel HJ; Pedersen OF; Mulder PG
42,"Enright PL, Kronmal RA, Manolio TA. Respiratory muscle strength in the elderly. Correlates and reference values. Cardiovascular Health Study Research Group. Am J Respir Crit Care Med. 1994;149(2 Pt 1).",Respiratory muscle strength in the elderly. Correlates and reference values. Cardiovascular Health Study Research Group,Am J Respir Crit Care Med,1994,149,2 Pt 1,,,,Enright PL; Kronmal RA; Manolio TA
43,"Hogg JC, Macklem PT, Thurlbeck WM. Site and nature of airway obstruction in chronic obstructive lung disease. N Engl J Med. 1968;278.",Site and nature of airway obstruction in chronic obstructive lung disease,N Engl J Med,1968,278,,,,,Hogg JC; Macklem PT; Thurlbeck WM
44,"Despas PJ, Leroux M, Macklem PT. Site of airway obstruction in asthma as determined by measuring maximal expiratory flow breathing air and a heliumoxygen mixture. J Clin Invest. 1972;51.",Site of airway obstruction in asthma as determined by measuring maximal expiratory flow breathing air and a heliumoxygen mixture,J Clin Invest,1972,51,,,,,Despas PJ; Leroux M; Macklem PT
45,Mink SN. Expiratory flow limitation and the response to breathing a helium-oxygen gas mixture in a canine model of pulmonary emphysema. J Clin Invest. 1984;73.,Expiratory flow limitation and the response to breathing a helium-oxygen gas mixture in a canine model of pulmonary emphysema,J Clin Invest,1984,73,,,,,Mink SN
46,"Tiddens HA, Bogaard JM, De Jongste JC. Physiological and morphological determinants of maximal expiratory flow in chronic obstructive lung disease. Eur Respir J. 1996;9.",Physiological and morphological determinants of maximal expiratory flow in chronic obstructive lung disease,Eur Respir J,1996,9,,,,,Tiddens HA; Bogaard JM; De Jongste JC
47,"Tandon MK, Campbell AH. Bronchial cartilage in chronic bronchitis. Thorax. 1969;24.",Bronchial cartilage in chronic bronchitis,Thorax,1969,24,,,,,Tandon MK; Campbell AH
48,"Nagai A, West WW, Paul JL. The National Institutes of Health Intermittent Positive-Pressure Breathing trial: pathology studies. I. Interrelationship between morphologic lesions. Am Rev Respir Dis. 1985;132.",The National Institutes of Health Intermittent Positive-Pressure Breathing trial: pathology studies. I. Interrelationship between morphologic lesions,Am Rev Respir Dis,1985,132,,,,,Nagai A; West WW; Paul JL
49,"Nagai A, Thurlbeck WM, Konno K. Responsiveness and variability of airflow obstruction in chronic obstructive pulmonary disease. Clinicopathologic correlative studies. Am J Respir Crit Care Med. 1995;151(3 Pt 1).",Responsiveness and variability of airflow obstruction in chronic obstructive pulmonary disease. Clinicopathologic correlative studies,Am J Respir Crit Care Med,1995,151,3 Pt 1,,,,Nagai A; Thurlbeck WM; Konno K
50,"Dunnill MS, Massarella GR, Anderson JA. A comparison of the quantitative anatomy of the bronchi in normal subjects, in status asthmaticus, in chronic bronchitis, and in emphysema. Thorax. 1969;24.","A comparison of the quantitative anatomy of the bronchi in normal subjects, in status asthmaticus, in chronic bronchitis, and in emphysema",Thorax,1969,24,,,,,Dunnill MS; Massarella GR; Anderson JA
51,"Moreno RH, Mccormack GS, Brendan J. Effect of intravenous papain on tracheal pressurevolume curves in rabbits. J Appl Physiol. 1986;60.",Effect of intravenous papain on tracheal pressurevolume curves in rabbits,J Appl Physiol,1986,60,,,,,Moreno RH; Mccormack GS; Brendan J
52,"Loring SH, Donnell O, Feller-Kopman CR, DJ. Central airway mechanics and flow limitation in acquired tracheobronchomalacia. Chest. 2007;131.",Central airway mechanics and flow limitation in acquired tracheobronchomalacia,Chest,2007,131,,,,,Loring SH; Donnell O; Feller-Kopman CR; DJ
53,"Ernst A, Majid A, Feller-Kopman D. Airway stabilization with silicone stents for treating adult tracheobronchomalacia: a prospective observational study. Chest. 2007;132.",Airway stabilization with silicone stents for treating adult tracheobronchomalacia: a prospective observational study,Chest,2007,132,,,,,Ernst A; Majid A; Feller-Kopman D
54,"Majid A, Guerrero J, Gangadharan S. Tracheobronchoplasty for severe tracheobronchomalacia: a prospective outcome analysis. Chest. 2008;134.",Tracheobronchoplasty for severe tracheobronchomalacia: a prospective outcome analysis,Chest,2008,134,,,,,Majid A; Guerrero J; Gangadharan S
55,"Jayamanne DS, Epstein H, Goldring RM. Flow-volume curve contour in COPD: correlation with pulmonary mechanics. Chest. 1980;77.",Flow-volume curve contour in COPD: correlation with pulmonary mechanics,Chest,1980,77,,,,,Jayamanne DS; Epstein H; Goldring RM
56,"Vincken WG, Cosio MG. Flow oscillations on the flow-volume loop: clinical and physiological implications. Eur Respir J. 1989;2.",Flow oscillations on the flow-volume loop: clinical and physiological implications,Eur Respir J,1989,2,,,,,Vincken WG; Cosio MG
57,"Pornsuriyasak P, Ploysongsang Y. Impulse oscillometry system in diagnosis of central airway obstruction in adults: comparison with spirometry and body plethysmography. Chest. 2009;136:123S.",Impulse oscillometry system in diagnosis of central airway obstruction in adults: comparison with spirometry and body plethysmography,Chest,2009,136,,123S,,,Pornsuriyasak P; Ploysongsang Y
58,"Handa H, Miyazawa T, Murgu SD. Novel multimodality imaging and physiologic assessments clarify choke-point physiology and airway wall structure in expiratory central airway collapse. Respir Care. 2012;57.",Novel multimodality imaging and physiologic assessments clarify choke-point physiology and airway wall structure in expiratory central airway collapse,Respir Care,2012,57,,,,,Handa H; Miyazawa T; Murgu SD
59,"Murgu SD, Colt HG. Bronchoscopic treatment of post tracheostomy tracheal stenosis with chondritis. Bronchoscopy and central airway disorders. 2012;None.",Bronchoscopic treatment of post tracheostomy tracheal stenosis with chondritis,Bronchoscopy and central airway disorders,2012,,,,,,Murgu SD; Colt HG
60,"Pedersen OF, Thiessen B, Lyager S. Airway compliance and flow limitation during forced expiration in dogs. J Appl Physiol. 1982;52.",Airway compliance and flow limitation during forced expiration in dogs,J Appl Physiol,1982,52,,,,,Pedersen OF; Thiessen B; Lyager S
61,"Murgu SD, Pecson J, Colt HG. Bronchoscopy on non invasive positive pressure ventilation: indications and technique. Respir Care. 2010;55.",Bronchoscopy on non invasive positive pressure ventilation: indications and technique,Respir Care,2010,55,,,,,Murgu SD; Pecson J; Colt HG
62, BronchAtlas bronchoscopy on CPAP for OSA. BronchAtlas bronchoscopy on CPAP for OSA. 2012;None.,BronchAtlas bronchoscopy on CPAP for OSA,BronchAtlas bronchoscopy on CPAP for OSA,2012,,,,,,
63,"Lee KS, Sun MR, Ernst A. Comparison of dynamic expiratory CT with bronchoscopy for diagnosing airway malacia: a pilot evaluation. Chest. 2007;131.",Comparison of dynamic expiratory CT with bronchoscopy for diagnosing airway malacia: a pilot evaluation,Chest,2007,131,,,,,Lee KS; Sun MR; Ernst A
64,"Baroni RH, Feller-Kopman D, Nishino M. Tracheobronchomalacia: comparison between end-expiratory and dynamic expiratory CT for evaluation of central airway collapse. Radiology. 2005;235.",Tracheobronchomalacia: comparison between end-expiratory and dynamic expiratory CT for evaluation of central airway collapse,Radiology,2005,235,,,,,Baroni RH; Feller-Kopman D; Nishino M
65,"Ferretti GR, Jankowski A, Perrin MA. Multidetector CT evaluation in patients suspected of tracheobronchomalacia: comparison of endexpiratory with dynamic expiratory volumetric acquisitions. Eur J Radiol. 2008;68.",Multidetector CT evaluation in patients suspected of tracheobronchomalacia: comparison of endexpiratory with dynamic expiratory volumetric acquisitions,Eur J Radiol,2008,68,,,,,Ferretti GR; Jankowski A; Perrin MA
66,"Hein E, Rogalla P, Hentschel C. Dynamic and quantitative assessment of tracheomalacia by electron beam tomography: correlation with clinical symptoms and bronchoscopy. J Comput Assist Tomogr. 2000;24.",Dynamic and quantitative assessment of tracheomalacia by electron beam tomography: correlation with clinical symptoms and bronchoscopy,J Comput Assist Tomogr,2000,24,,,,,Hein E; Rogalla P; Hentschel C
67,"Yamashiro T, Jose ´este ´par S, Matsuoka R, S. Intrathoracic tracheal volume and collapsibility on inspiratory and end-expiratory CT scans correlations with lung volume and pulmonary function in 85 smokers. Acad Radiol. 2011;18.",Intrathoracic tracheal volume and collapsibility on inspiratory and end-expiratory CT scans correlations with lung volume and pulmonary function in 85 smokers,Acad Radiol,2011,18,,,,,Yamashiro T; Jose ´este ´par S; Matsuoka R; S
68,"Lee EY, Strauss KJ, Tracy DA. Comparison of standard-dose and reduced-dose expiratory MDCT techniques for assessment of tracheomalacia in children. Acad Radiol. 2010;17.",Comparison of standard-dose and reduced-dose expiratory MDCT techniques for assessment of tracheomalacia in children,Acad Radiol,2010,17,,,,,Lee EY; Strauss KJ; Tracy DA
69,"Wever D, Vandecaveye W, Lanciotti V, S. Multidetector CT-generated virtual bronchoscopy: an illustrated review of the potential clinical indications. Eur Respir J. 2004;23.",Multidetector CT-generated virtual bronchoscopy: an illustrated review of the potential clinical indications,Eur Respir J,2004,23,,,,,Wever D; Vandecaveye W; Lanciotti V; S
70,"Boiselle PM, Donnell O, Loring CR, SH. Reproducibility of forced expiratory tracheal collapse: assessment with MDCT in healthy volunteers. Acad Radiol. 2010;17.",Reproducibility of forced expiratory tracheal collapse: assessment with MDCT in healthy volunteers,Acad Radiol,2010,17,,,,,Boiselle PM; Donnell O; Loring CR; SH
71,"Lee KS, Lunn W, Feller-Kopman D. Multislice CT evaluation of airway stents. J Thorac Imaging. 2005;20.",Multislice CT evaluation of airway stents,J Thorac Imaging,2005,20,,,,,Lee KS; Lunn W; Feller-Kopman D
72,"Baroni RH, Ashiku S, Boiselle PM. Dynamic CT evaluation of the central airways in patients undergoing tracheoplasty for tracheobronchomalacia. AJR Am J Roentgenol. 2005;184.",Dynamic CT evaluation of the central airways in patients undergoing tracheoplasty for tracheobronchomalacia,AJR Am J Roentgenol,2005,184,,,,,Baroni RH; Ashiku S; Boiselle PM
73,"Wright CD, Tracheomalacia. Chest Surg Clin N Am. Chest Surg Clin N Am. 2003;13.",Chest Surg Clin N Am,Chest Surg Clin N Am,2003,13,,,,,Wright CD; Tracheomalacia
74,"Lee KS, Ashiku SK, Ernst A. Comparison of expiratory CT airway abnormalities before and after tracheoplasty surgery for tracheobronchomalacia. J Thorac Imaging. 2008;23.",Comparison of expiratory CT airway abnormalities before and after tracheoplasty surgery for tracheobronchomalacia,J Thorac Imaging,2008,23,,,,,Lee KS; Ashiku SK; Ernst A
75,"Zhang J, Hasegawa I, Feller-Kopman D. AUR Memorial Award. Dynamic expiratory volumetric CT imaging of the central airways: comparison of standard-dose and low-dose techniques. Acad Radiol. 2003;10.",AUR Memorial Award. Dynamic expiratory volumetric CT imaging of the central airways: comparison of standard-dose and low-dose techniques,Acad Radiol,2003,10,,,,,Zhang J; Hasegawa I; Feller-Kopman D
76,"Ederle JR, Heussel CP, Hast J. Evaluation of changes in central airway dimensions, lung area and mean lung density at paired inspiratory/expiratory high-resolution computed tomography. Eur Radiol. 2003;13.","Evaluation of changes in central airway dimensions, lung area and mean lung density at paired inspiratory/expiratory high-resolution computed tomography",Eur Radiol,2003,13,,,,,Ederle JR; Heussel CP; Hast J
77,"Ochs RA, Petkovska I, Kim HJ. Prevalence of tracheal collapse in an emphysema cohort as measured with end-expiration CT. Acad Radiol. 2009;16.",Prevalence of tracheal collapse in an emphysema cohort as measured with end-expiration CT,Acad Radiol,2009,16,,,,,Ochs RA; Petkovska I; Kim HJ
78,"Lee CJ, Lee JH, Song JW. Correlation of tracheal cross-sectional area with parameters of pulmonary function test in COPD. Tuberc Respir Dis. 1999;46.",Correlation of tracheal cross-sectional area with parameters of pulmonary function test in COPD,Tuberc Respir Dis,1999,46,,,,,Lee CJ; Lee JH; Song JW
79,"Mcdermott S, Barry SC, Judge EE. Tracheomalacia in adults with cystic fibrosis: determination of prevalence and severity with dynamic cine CT. Radiology. 2009;252.",Tracheomalacia in adults with cystic fibrosis: determination of prevalence and severity with dynamic cine CT,Radiology,2009,252,,,,,Mcdermott S; Barry SC; Judge EE
80,"Lomasney L, Bergin CJ, Lomasney J. CT appearance of lunate trachea. J Comput Assist Tomogr. 1989;13.",CT appearance of lunate trachea,J Comput Assist Tomogr,1989,13,,,,,Lomasney L; Bergin CJ; Lomasney J
81,"Boiselle PM, Feller-Kopman D, Ashiku S. Tracheobronchomalacia: evolving role of dynamic multislice helical CT. Radiol Clin North Am. 2003;41.",Tracheobronchomalacia: evolving role of dynamic multislice helical CT,Radiol Clin North Am,2003,41,,,,,Boiselle PM; Feller-Kopman D; Ashiku S
82,"Boiselle PM, Ernst A. Tracheal morphology in patients with tracheomalacia: prevalence of inspiratory lunate and expiratory ""frown"" shapes. J Thorac Imaging. 2006;21.","Tracheal morphology in patients with tracheomalacia: prevalence of inspiratory lunate and expiratory ""frown"" shapes",J Thorac Imaging,2006,21,,,,,Boiselle PM; Ernst A
83,"Gupta PP, Yadav R, Verma M. High-resolution computed tomography features in patients with chronic obstructive pulmonary disease. Singapore Med J. 2009;50.",High-resolution computed tomography features in patients with chronic obstructive pulmonary disease,Singapore Med J,2009,50,,,,,Gupta PP; Yadav R; Verma M
84,"Fukai I, Yamakawa Y, Kiriyama M. Sabersheath malacic trachea remodeled and fixed into a normal shape by long-term placement and then removal of gianturco wire stent. Ann Thorac Surg. 2003;76.",Sabersheath malacic trachea remodeled and fixed into a normal shape by long-term placement and then removal of gianturco wire stent,Ann Thorac Surg,2003,76,,,,,Fukai I; Yamakawa Y; Kiriyama M
85,"Heussel CP, Ley S, Biedermann A. Respiratory lumenal change of the pharynx and trachea in normal subjects and COPD patients: assessment by cine-MRI. Eur Radiol. 2004;14.",Respiratory lumenal change of the pharynx and trachea in normal subjects and COPD patients: assessment by cine-MRI,Eur Radiol,2004,14,,,,,Heussel CP; Ley S; Biedermann A
